PublishDate,Sentence,Score
2017-05-14T02:44:00.000Z,上市櫃企業今年調薪結果陸續出爐，結果是幾家歡樂幾家愁，不少廠商如台積電 (2330) 與創意 (3443) 今年調薪幅度維持去年水準，部分廠商今年調薪幅度則較去年低，另有超過10家廠商今年不調薪。,1
2017-05-19T10:32:00.000Z,（中央社記者張建中新竹2017年5月19日電）台積電 (2330) 第一屆設備創意競賽結果出爐，由國立台灣科技大學應用科技學士學位學程所組成的隊伍贏得第一名，獲得新台幣60萬元獎金。,1
2017-05-19T10:32:00.000Z,為讓學生提早知道產業界需求，同時吸引更多學生投入半導體業，台積電與國立交通大學共同舉辦設備創意競賽，於去年10月向全國各大專院校徵件，邀請學生組隊參加。,3
2017-05-19T10:32:00.000Z,這次競賽著重機械臂創意設計，強調機械臂的控制與排程，台積電還針對這次競賽量身打造一個仿半導體設備的任務平台，共有18個隊伍參賽。,0
2017-05-19T04:12:00.000Z,  台積電與國立交通大學今日共同舉辦的「第一屆台積設備創意競賽」，今天在交大進行決賽。,1
2017-05-19T03:37:00.000Z,為推動台灣半導體產業設備的本土化發展，全球晶圓代工龍頭的台積電(2330)今日與交大合辦「第一屆台積設備創意競賽」決賽；而台積電製造技術副總林錦坤透露，半導體設備的本土化發展已有不錯進展，本土零件與材料比重已從過去的30%至40%，攀高到目前的70%；後段設備方面，本土化比重約30%至40%。,2
2017-05-19T03:16:00.000Z,台積電與國立交通大學共同舉辦的「第一屆台積設備創意競賽」，今天在交大進行決賽。,1
2017-05-20T03:02:00.000Z,晶圓代工龍頭台積電 （2330） 昨（19）日與交通大學舉辦「第一屆台積設備創意競賽」。,0
