PublishDate,Sentence,Score
2017-02-21T02:57:00.000Z,（中央社記者吳家豪台北2017年2月21日電）美股20日因華盛頓紀念節而休市，台股今天重演開高翻黑戲碼，電子、金融類股未站穩陣腳，傳產類股最近雖然開始修正，但鐵、銅、紙等原物料報價上揚，仍帶動相關個股走勢。,1
2017-02-21T02:39:00.000Z,美股昨休市，亞股今早偏多開演，台股3月台指期、電子期跟上腳步聯袂開高，大盤亦小漲8.07點、以9761.27點開出，隨後玉晶光 (3406) 重挫跌停，亞光 (3019) 、大同 (2371) 等權值股跟隨下殺，加上台積電 (2330) 壓低整理影響電子族群走弱，大盤氛圍轉空，多方僅靠造紙、電器、鋼鐵、金融等類股強撐盤，挑戰9800大關仍須再等等。,-2
2017-02-22T10:04:00.000Z,鉅亨台北資料中心◆盤勢分析週二美股再創新高，週三台指期開盤不久後即站上 9800 點大關，蘋概股、面板股與原物料族群強勢呈現，期指於 9:15 左右來到 9827 點的高點，但目前加權指數位置已是 21 個月來的高檔，市場追價力道不足，期指回落至 9800 點之下狹幅震盪，終場台指期上漲 16 點，以 9783 點作收。,6
2017-02-22T10:04:00.000Z,研究部認為在歐美股市維持強勢與資金行情未退下，台指期短期應不致出現大幅修正，但 9800 點以上賣壓顯然不輕，加上美國總統川普將於近日發表新的移民禁令，及新台幣近期明顯升值不利於外銷導向的電子產業，故操作上仍以謹慎小心為宜。,-1
2017-02-22T06:36:00.000Z,美股三大指數再創新高，台股跳空開高後超越9800點，重回5日線，但台積電 (2330) 收低1.5元，金融股指數翻黑收低，台股收盤小漲14點至9778點，成交值993億元。,3
2017-02-22T06:36:00.000Z,  美國沃爾瑪和家得寶等零售商的財報強勁，周二美股三大指數再度同創新高。,4
2017-02-22T06:36:00.000Z,  美股續攀高，台股多頭獲激勵，今早直接越過9800點之上，友達 (2409) 、群創 (3481) 等TFT面板股轉強，電子股指數小漲，中小型股仍是多頭重心，大同 (2371) 周二止跌今再續彈，蘋果供應鏈表現仍可圈可點，TPK-KY (3673) 強勢漲停，和碩 (4938) 、鎧勝-KY (5264) 、晶技 (3042) 等聯袂上揚，中小型業績題材股像是致茂 (2360) 亦大漲。,9
2017-02-22T05:51:00.000Z,（中央社記者韓婷婷台北2017年2月22日電）台股今天在美股大漲激勵下，蓄勢再攻9800點大關，不過在精神指標台積電 (2330) 未表態、金融股也攻高無力下，今年以來4度上攻9800點失敗。,1
2017-02-22T04:07:00.000Z,鉅亨網記者蔡宗憲 台北受美股再創高帶動，台股今 (22) 日多頭氣勢如虹，指數強勢表態，一度重回 9800 點之上，不過權值、高價股走勢平平，台積電、鴻海盤下震盪，股王大立光雖上漲 3% 穩盤，但多數高價股走勢向下修正，盤面靠題材與中小型股撐腰，指數力守 5 日線支撐，挑戰收盤站穩 9800 點。,4
2017-02-22T04:07:00.000Z,台股受美股持續攻高帶動，指數也穩步上攻表態，不過權值股走勢平平，台積電、鴻海、台塑、南亞等都在盤下震盪；高價股則靠股王、股后撐腰，大立光大漲逾 3%，精測也小漲表態，康友 - KY、旭準等股價都維持小漲格局，不過精華、矽力 - KY、信樺、樺漢、川湖與寶雅等，都在盤下震盪。,2
2017-02-22T04:07:00.000Z,整體來看，法人認為，在資金熱潮帶動下，加上美股持續攻高，台股仍有機會持續表態，盤面上資金輪動快速，指數可望沿著 5 日線向上走揚，整理後有機會挑戰再攻新高。,5
2017-02-22T02:27:00.000Z,美股三大指數再創新高，台股跳空開高後超越9800點，重回5日線，電金傳產類股多小幅上揚，TFT面板股重啟漲勢，前波大漲的轉機股亦止跌反彈。,7
2017-02-22T02:27:00.000Z,  美國沃爾瑪和家得寶等零售商的財報強勁，周二美股三大指數再度同創新高。,4
2017-02-22T02:27:00.000Z,  美股續漲，台股多頭獲激勵，今早直接開高9800點之上，台積電 (2330) 仍熄火，友達 (2409) 、群創 (3481) 等TFT面板股轉強，電子股指數小漲，中小型股仍是多頭重心，大同 (2371) 周二止跌今再續彈，此外，股王大立光 (3008) 持續強勢，帶動前波飆漲的玉晶光 (3406) 、亞光 (3019) 亦同步止跌反彈。,8
2017-02-23T09:54:00.000Z,鉅亨台北資料中心◆盤勢分析週三美股三大指數漲跌互見，週四台指期以小跌 3 點開出，9 點過後多方力圖搶攻 9800 點大關，並於 9:50 左右來到 9820 點的高點，不過市場信心仍然不足，期指逐步壓回，尾盤過後更回落至平盤之下，終場台指期下跌 11 點，以 9773 點作收。,-1
2017-02-23T09:54:00.000Z,研究部認為即使近日美股屢創新高，但台指期 9800 點大關卻屢攻不下，考驗著市場的信心與耐心，加上近期歐洲政經局勢不穩，美國川普政策的不確定仍高，及新台幣近期明顯升值不利於外銷導向的電子產業，將反應在第一季的財報上，故操作上仍以謹慎小心為宜。,3
2017-02-23T07:15:00.000Z,周三美股漲跌互見，道瓊指數連9日創新高，台股今日由股王大立光 (3008) 、股后精測 (6510) 雙雙領軍，帶動指數一度攻上9810.56點，惟萬點前近關情怯，且228連假將至，追價買盤退守觀望，終場加權指數下跌9.47點為9769.31點，今年來5度闖關9800點失利，成交值為989.84億元。,5
2017-02-23T06:27:00.000Z,  展望後市，國泰證期顧問處協理簡伯儀表示，美股因財報優於預期而強勢創高，但財報公布已漸入尾聲，後續的展望偏向保守，因此股市漲多後轉震盪的機率偏高，台股加權指數短線雖強勢不變，但風險有升高趨勢，操作上仍須避免追高，並留意後續拉回風險。,4
2017-02-23T03:04:00.000Z,  昨日美股漲跌互見，但投資氣氛仍維持相對樂觀，台16大類股中，以光學類股漲幅最為領先，達約1.2%，百貨類股上漲0.94%，油電燃氣上漲約0.4%，化工和生技類股分別上漲約0.4%和0.25%，食品類股則為今天盤面上較為弱勢，跌幅約0.4%。,3
2017-02-24T10:01:00.000Z,"鉅亨台北資料中心◆盤勢分析週四美股漲跌互見，而道瓊指數仍持續創新高，整體來看，市場仍看好美國新政府後續的改革，令美股得以持穩於高檔，也因此台指期週五雖然因為長假在即，上漲動能依舊不足，空方亦難有可趁之機；由個股觀察，前一日大漲的大立光拉回 4%，金融龍頭國泰金和富邦金亦走弱，所幸權重股王台積電持穩於平盤上，而聯電因傳出 14 奈米量產更是大漲 8.51%，穩住大盤行情，終場期指便僅以下跌 12 點至 9760 點作收，依然保在偏高的水位；但從技術面來看，自 2/17 日以來台指期悶盤的狀況便沒有改變，屢攻 9800 點失敗，MACD 柱狀體已降至接近 0 的水位，KD 值和動量指標都呈現下行，透露出連日的拉鋸後投資人信心逐漸減弱，後市不排除賣壓有大舉湧出的可能性；而在休假前法人布局則較為平淡，三大法人共小幅減碼淨多單 176 口至 61,417 口，值得注意的是外資終止連續 12 日的買超，週五小幅賣超現貨 16.2 億元，顯示熱錢流入的情況已經不再；研究部認為在整體追價動能不足下，操作最好偏向保守。",7
2017-02-24T10:01:00.000Z,下周川普將赴國會演說，屆時很有機會發表讓市場望眼欲穿的減稅細節，甚至是對於邊境調稅和外貿夥伴的看法， 不過有鑑於新任財長 Mnuchin 在週四言論透露出減稅法案要順利於國會通過並不容易，美股也已反應減稅政策的利多，預期美股進一步上檔空間有限；投資人在 228 休假期間可留意外期行情，並找尋布局的機會。,8
2017-02-24T03:03:00.000Z,（中央社記者潘智義台北2017年2月24日電）雖然美股道瓊工業指數再創新高，但台股漲多後，依然在9800點之下整理。,5
2017-02-24T10:01:00.000Z,"鉅亨台北資料中心◆盤勢分析週四美股漲跌互見，而道瓊指數仍持續創新高，整體來看，市場仍看好美國新政府後續的改革，令美股得以持穩於高檔，也因此台指期週五雖然因為長假在即，上漲動能依舊不足，空方亦難有可趁之機；由個股觀察，前一日大漲的大立光拉回 4%，金融龍頭國泰金和富邦金亦走弱，所幸權重股王台積電持穩於平盤上，而聯電因傳出 14 奈米量產更是大漲 8.51%，穩住大盤行情，終場期指便僅以下跌 12 點至 9760 點作收，依然保在偏高的水位；但從技術面來看，自 2/17 日以來台指期悶盤的狀況便沒有改變，屢攻 9800 點失敗，MACD 柱狀體已降至接近 0 的水位，KD 值和動量指標都呈現下行，透露出連日的拉鋸後投資人信心逐漸減弱，後市不排除賣壓有大舉湧出的可能性；而在休假前法人布局則較為平淡，三大法人共小幅減碼淨多單 176 口至 61,417 口，值得注意的是外資終止連續 12 日的買超，週五小幅賣超現貨 16.2 億元，顯示熱錢流入的情況已經不再；研究部認為在整體追價動能不足下，操作最好偏向保守。",7
2017-02-24T10:01:00.000Z,下周川普將赴國會演說，屆時很有機會發表讓市場望眼欲穿的減稅細節，甚至是對於邊境調稅和外貿夥伴的看法， 不過有鑑於新任財長 Mnuchin 在週四言論透露出減稅法案要順利於國會通過並不容易，美股也已反應減稅政策的利多，預期美股進一步上檔空間有限；投資人在 228 休假期間可留意外期行情，並找尋布局的機會。,8
2017-02-24T03:03:00.000Z,（中央社記者潘智義台北2017年2月24日電）雖然美股道瓊工業指數再創新高，但台股漲多後，依然在9800點之下整理。,5
2017-02-23T09:54:00.000Z,鉅亨台北資料中心◆盤勢分析週三美股三大指數漲跌互見，週四台指期以小跌 3 點開出，9 點過後多方力圖搶攻 9800 點大關，並於 9:50 左右來到 9820 點的高點，不過市場信心仍然不足，期指逐步壓回，尾盤過後更回落至平盤之下，終場台指期下跌 11 點，以 9773 點作收。,-1
2017-02-23T09:54:00.000Z,研究部認為即使近日美股屢創新高，但台指期 9800 點大關卻屢攻不下，考驗著市場的信心與耐心，加上近期歐洲政經局勢不穩，美國川普政策的不確定仍高，及新台幣近期明顯升值不利於外銷導向的電子產業，將反應在第一季的財報上，故操作上仍以謹慎小心為宜。,3
