PublishDate,Sentence,Score
2018-08-27T06:04:00.000Z,（中央社記者江明晏台北2018年8月27日電）歐美股市走揚，台股今天開高走高，尾盤受被動族群大漲激勵，指數一度漲逾百點，終場收在10902.21點，攻上10900點整數關卡，一口氣收復月線、季線。,6
2018-08-27T06:04:00.000Z,美國聯邦準備理事會（Fed）主席鮑爾（JeromePowell）確認美國央行目前升息基調，激勵美股走強，標準普爾500指數漲逾1月高點，呈現多頭最長走勢；歐股隨全球股市走揚。,7
2018-08-27T03:04:00.000Z,（中央社記者江明晏台北2018年8月27日電）美股走強，歐股上揚，台股24日下跌53.78點，收在10809.35點，今天台積電 (2330) 、大立光 (3008) 小漲，被動族群勁揚，帶動指數反彈逾70點，高至10880點，但暫未突破月線10884點、季線10898點反壓區。,2
2018-08-27T03:04:00.000Z,美國聯邦準備理事會（Fed）主席鮑爾（JeromePowell）確認美國央行目前升息基調，激勵美股走強，標準普爾500指數漲逾1月高點，呈現多頭最長走勢；歐股隨全球股市走揚。,7
2018-08-28T07:01:00.000Z,美墨達成一項新貿易協定，市場預期未來也可擴及加拿大，周一美股四大指數同步勁揚，道瓊工業指數首度在收盤屹立26000點之上，那指、普爾500指數更創歷史新高。,3
2018-08-28T06:38:00.000Z,（中央社記者田裕斌台北2018年8月28日電）台股今天在美股大漲下跳空開高，台積電 (2330) 一度大漲超過2%表態，盤中一度攻上11000點大關，不過中小型股再度轉弱，被動元件翻黑，11000點得而復失。,0
2018-08-28T03:04:00.000Z,（中央社記者田裕斌台北2018年8月28日電）美股勁揚近260點，帶動除陸股之外的亞股向上攻堅，台股則在台積電 (2330) 領軍下，指數向上挑戰11000點，成交值有機會創下近期新大量，超過新台幣1300億元。,4
2018-08-28T02:31:00.000Z,美墨達成貿易協議，昨夜美股再創新高，台股在昨日突破10900關卡，並一舉收復月、季、半年線三道重要反壓後，今早開盤續漲44.12點、以10946.33點開出，隨後在蘋概三巨頭台積電 (2330) 、大立光 (3008) 、鴻海 (2317) 齊揚，加上華新科 (2492) 、國巨 (2327) 帶領被動元件族群續攻的激勵下，大盤指數急拉衝上10996點，挑戰萬一關卡在望。,12
2018-08-29T07:12:00.000Z,美股以高科技產業為軸心的那指、標普500，周二牛氣續盛收盤再創新高。,4
2018-08-29T07:12:00.000Z,　美股激勵下電子股獲外資敲進，強勢攻堅重掌兵符，台達電 (2308) 、聯發科 (2454) 、日月光投控 (3711) 等向上攻堅，股王大立光早盤走勢翻紅，惟臨近尾盤拉回整理。,6
2018-08-29T06:30:00.000Z,貿易爭端出現正面進展，周二美股續收高。,1
2018-08-29T06:30:00.000Z,周二美股上漲，漲幅介於0.03至0.39%。,2
2018-08-30T07:12:00.000Z,受到美國第2季GDP優於市場預期下，美股周三標普及那指再寫新高點，以及台積電 (2330) ADR收漲逾4%，外資調升台積電目標價等利多消息激勵下，台股再度開高走高，開盤急漲54.4點至11153.97點，台積電盤中創下268元新高，加權指數開盤20分鐘來到11186點高價。,8
2018-08-30T03:11:00.000Z,美股在Apple與Amazon雙創史上新高帶動，美股全面收高，台股也外資持續加碼台積電 (2330) 下，帶動加權指數今天來到今年6月中旬以來高點，預估今天成交金額約1200多億元。,4
2018-08-30T03:11:00.000Z,台積電依舊今天盤面焦點，台積電是引領台股指標，但今天創高後，出現漲幅收斂，加上美股期指壓回，導致盤面買盤縮手，這波率先轉強的金融、傳產股獲利回吐賣壓，表現略顯疲態，影響台股指數盤中一度翻黑。,4
2018-08-30T01:24:00.000Z,周三美國科技股領軍，S&P500指數、那指再創新高點，美股齊大漲，終場道瓊指數漲60.55點，收26124.57點；那斯達克指數漲79.65點，收8109.69點；S&P500指數漲16.52點，收2914.04點；費城半導體指數漲3.43點，收1406.38點。,7
2018-08-31T07:23:00.000Z,美股四大指數周四全數收跌，早盤亞股多同步拉回修正。,-1
2018-08-31T03:27:00.000Z,（中央社記者潘智義台北2018年8月31日電）美中貿易戰再生波瀾，美股道瓊工業指數大跌137.65點，台股今天開低走低，盤中指數下跌近百點。,-4
2018-08-31T03:11:00.000Z,受到美國總統川普有意再對進口的大陸商品加徵關稅，美中貿易戰持續交火，美股四大指數全數收跌，其中道瓊工業指數更是收跌137.65點，亞股受到影響也同步走弱，台股今開跌56.49點，報在11037.26點，新台幣匯價小貶，指數開低後走低，一度下挫逾90點，摩台指今收盤結算、MSCI明晟季度權重調整盤後生效，宜提防尾盤出現爆量調節。,-7
2018-08-31T03:11:00.000Z, 美中貿易戰持續升溫，傳出美國總統川普預計在下周再對大陸加徵2000億美元關稅，也引發昨晚美股挫跌，連動亞股、台股今日表現，後續貿易戰變化也恐持續連動全球股市。,-1
