PublishDate,Sentence,Score
2018-12-03T06:59:00.000Z,法人認為，中美貿易戰獲得緩解，90天的壓力解除將有助於國際股市反彈，雖美元維持強勢，但美股反彈仍可激勵亞股表現，預期台股維持相對強勢格局不變，加上年底作夢行情加持，12月指數表現多呈現正向，短線指數有望持續反彈，挑戰站穩萬點關卡。,5
2018-12-03T06:31:00.000Z,國泰證券指出，美中貿易戰獲得緩解，美元續強，美股反彈可激勵亞股表現，台股短多格局不變，尤其年底作夢行情加持，12月指數表現多呈現正向。,3
2018-12-03T05:52:00.000Z,中美貿易戰悶氣吐光光，台股收復10100點！儘管壓抑全球股市逾半年的中美貿易戰仍有變數尚未落幕，但美國總統川普及大陸國家主席習近平願意就中美貿易紛爭在90天內持續協商，美國暫緩對大陸商品加徵25%關稅，讓美股及亞股歡聲雷動，美股今天雖然休市，但美國期指大漲，亞股及陸股一開盤就上演慶祝行情，讓台股未開盤就紅光滿面，軋空手與空單，以及投信法人作帳買盤大爆發，讓一開盤就跳空站上萬點的台股指數氣勢如虹，一路過關斬將。,7
2018-12-04T07:15:00.000Z,美中僵局暫時緩和，周一美股四大指數強勢上漲，然亞股一日激情後，周二身陷疲態，台股今日開盤亦跌17.44點至10120.43點。,1
2018-12-04T06:49:00.000Z,美股昨夜攻高，亞股激情一日後腿軟休憩，台股量縮收低，但仍堅守萬點之上。,-2
2018-12-04T03:09:00.000Z,（中央社記者韋樞台北2018年12月4日電）美中貿易戰暫休兵，今晨收盤美股大漲，大陸股市紅翻黑，台股繼3日大漲249點後，今天開低走低維持萬點，電子和傳產漲跌互見。,-2
2018-12-04T02:36:00.000Z,美中貿易戰中場休息，昨夜美股主要指數強勢大漲，亞股昨一日激情後，今早疲態顯露，日、韓股率先開低，影響台股三大期指早盤聯袂走弱，集中市場亦開低17.44點、以10120.43點開出，店頭市場則續漲0.08點，以130.71點開出。,3
2018-12-05T07:13:00.000Z,美債走勢示警經濟增長恐放緩，衝擊周二美股三大指數暴跌逾3%，亞股今日籠罩一片低氣壓，萬點好光景僅短短兩日的台股在蘋概股三天王台積電 (2330) 、鴻海 (2317) 與大立光 (3008) 齊步跳水下，開盤即摜破頸線10014點及萬點關卡，包括國泰金 (2882) 、富邦金 (2881) 、台塑 (1301) 、台化 (1326) 等傳金權值股同步走疲，加上日前強勢的被動元件、矽晶圓、二極體等漲價概念股聯袂拉回，衝擊早盤一度大跌逾180點，最低來到9895.29點，連續失守萬點及9900點關卡，終場加權指數下跌166.8點為9916.74點，成交值為1137.09億元。,-2
2018-12-05T07:13:00.000Z,　美股暴跌再度驚動全球股市，台股難置身事外大跌逾百點摔落萬點大關！費半指數隔夜重挫近5%，衝擊台積電 (2330) 、鴻海 (2317) 、大立光 (3008) 、旺宏 (2337) 、南亞科 (2408) 等電子權值股同步殺跌，其中台積電 (2330) 盤中下挫3.8%，總市值跌破6兆元，重創多頭軍心。,-3
2018-12-05T07:13:00.000Z,美中休兵政策各自表述，讓貿易戰後續發展再添變數，加上美債殖利率呈現倒掛，衝擊美股四大指數大崩跌，市場悲觀情緒再度籠罩，拖累台股跌逾百點，痛失萬點、險守9900點。,-4
2018-12-05T06:24:00.000Z,（中央社記者田裕斌台北2018年12月5日電）台股今天在美股暴跌重擊下，跳空跌破萬點支撐，這次萬點之上僅停留2個交易日，電子權值股成為空方倒貨重心，類股重挫超過2.5%。,-6
2018-12-05T06:24:00.000Z,分析師表示，亞股今天早盤走勢，普遍反應美股重挫利空，但盤中跌幅都有縮小跡象，台股表現相對疲弱，跌幅超過1.5%，居亞股之冠，直探9900點整數關卡支撐，所幸成交值較昨天持續量縮，指數雖連續2個交易日回檔，並回補3日川習會後的多方缺口，但成交值並未明顯擴增，價量關係仍屬多方格局，10日線9871點將有較為明顯的支撐力道。,-4
2018-12-05T06:24:00.000Z,分析師指出，由於外資近期動向仍受到國際股市牽動，若在美股未穩下，將影響外資進場信心，近期作帳動作較為明顯的內資，盤中仍有零星點火的跡象，不過今天櫃買指數跌幅不比加權指數小，內資是否有提前結帳的動作，將讓中小型股的後市蒙上陰影。,3
2018-12-05T05:58:00.000Z,美債走勢釋出經濟增長放緩的訊號，周二美股三大指數均暴跌逾3%。,-2
2018-12-05T05:58:00.000Z,終場美股四大指數重挫，跌幅介於4.98%~3.10%。,-3
2018-12-05T05:58:00.000Z, 美股費城半導體指數大跌4.98%，台股今天重挫逾百點開出，台積電股價大跌8元，收盤為226元。,-2
2018-12-05T03:13:00.000Z,美股費城半導體指數大跌4.98%，台積電美國存託憑證(ADR)跌逾3%，加上面臨第一季淡季考驗，台積電 (2330) 股價表現疲弱，盤中跌8元至226元，市值失守6兆元。,-3
2018-12-05T03:13:00.000Z, 美債走勢出現經濟衰退前兆，加上美國總統川普推文，再度讓投資人對美中貿易戰感到不安，美股三大指數周二重挫均逾3%。,-3
2018-12-05T03:04:00.000Z,美債走勢釋出經濟增長放緩的訊號，周二美股三大指數均暴跌逾3%。,-2
2018-12-05T03:04:00.000Z,終場美股四大指數重挫，跌幅介於4.98%~3.10%。,-3
2018-12-05T03:04:00.000Z, 美股費城半導體指數大跌4.98%，台股今天重挫逾百點開出，台積電股價大跌8.5元，盤中為225.5元。,-2
2018-12-05T02:31:00.000Z,（中央社記者田裕斌台北2018年12月5日電）受到美股暴跌影響，台股早盤跳空開低，盤中一度大跌181.30點，不過隨著亞股普遍跌幅縮小，台股也在中小型股率先反彈下跌幅收斂，量縮守穩9900點整數關卡。,-7
2018-12-05T02:31:00.000Z,分析師指出，雖然亞股普遍受到美股衝擊普遍走跌，但由於美股電子盤已止跌翻紅，亞股跌勢也見煞車跡象，台股今天最低點9902點穩在9900點整數關卡之上，雖跌破5日線9984點，但10日線9873點有守，且量能並未明顯爆發，市場並未出現過度恐慌氣氛。,-6
2018-12-05T02:29:00.000Z,（中央社記者張建中新竹2018年12月5日電）美股道瓊指數慘跌近800點，跌幅3.1%，費城半導體指數更大跌4.98%，台股今天重挫逾百點，台積電 (2330) 股價表現疲弱，盤中一度達新台幣226元，市值失守6兆元。,-5
2018-12-05T02:29:00.000Z,美債走勢出現經濟衰退前兆，加上美國總統川普推文，再度激起投資人對美中貿易戰的不安情緒，美股道瓊指數大跌799.36點，跌幅3.1%，費城半導體指數跌63.39點，跌幅更達4.98%。,-4
2018-12-05T01:21:00.000Z,（中央社記者田裕斌台北2018年12月5日電）由於市場擔憂美國經濟成長趨緩及美中貿易戰休兵出現疑慮，美股大跌近800點，台股難逃拖累，萬點僅站上2個交易日後再度跌破。,-6
2018-12-05T01:21:00.000Z,美股4大指數全面大跌，尤其是以科技股為主的NASDAQ指數、費城半導體指數跌幅更深，與台股連動較為密切的蘋果(Apple)股價跌幅超過4%，亞馬遜(Amazon)、谷歌(Google)、臉書(facebook)全數走跌，僅特斯拉(Tesla)逆勢收紅，也讓台股早盤以跳空下跌111.56點開出，直接摜破萬點。,-1
2018-12-06T07:18:00.000Z,美股隔夜休市，亞股早盤卻不平靜，市場傳出華為副董孟晚舟在加拿大被捕，加上大摩對智慧機敲警鐘，令台股今日慘遭重砲轟炸，包括手機及華為供應鏈大立光 (3008) 、台積電 (2330) 、聯發科 (2454) 、可成 (2474) 、穩懋 (3105) 、全新 (2455) 及聯鈞 (3450) 等應聲重挫，市場恐慌性賣壓傾巢出籠，指數狂殺逾200點，一度下探9664.75點，包括被動元件、矽晶圓、MOSFET等漲價族群及選後風光的韓流概念股亦軟腳無力，終場加權指數下跌232.02點為9684.72點，連續失守9900、9800及9700點及月線關卡，成交值放大至1428.15億元。,-7
2018-12-06T07:18:00.000Z,台股在連續二天重挫接近400點過程中，融資餘額仍相對位在低檔水位，且整體官股券商也出現跌低回補，若美股跌勢獲得控制，台股不至於馬上破底，惟月線再度下彎，後續指數若未站穩月線，操作上需保守。,-2
2018-12-07T07:12:00.000Z,華為財務長被捕撼動全球股市，市場憂心美中關係陷入緊張，美股隔夜震盪收跌，昨日慘遭血洗的台股今日隨亞股回神反攻，在雙王大立光 (3008) 、台積電 (2330) 領漲反彈下，指數開高走高重返9700點，包括友達 (2409) 、群創 (3481) 及聯發科 (2454) 、華碩 (2357) 、南亞科 (2408) 等權值股亦跟上腳步，MOSFET族群杰力 (5299) 大中 (6435) 、富鼎 (8261) 、尼克森 (3317) 剽悍強彈，台塑四寶也扮演撐盤要角，推升指數一度大漲百點，攻高9785.2點，終場加權指數上漲76.16點為9760.88點，成交值縮為962.11億元，周線翻黑下跌127.15點。,-1
2018-12-07T07:12:00.000Z,中美緊張關係隨著美股止血趨於淡化，令今日台股開高走高收復9700點大關。,0
2018-12-07T07:12:00.000Z,分析師表示，台股周K線收中長黑，且上影線明顯長於下影線，顯示空方賣壓力道仍強，不過本周周KD指標已經在低檔出現黃金交叉，因此，近期只要美股走勢未再跌破近期低點，下周應該有機會在營收公布完畢後出現反彈走勢。,0
2018-12-07T06:40:00.000Z, 分析師表示，從周線來看，本周周線呈現開高後再跌的走勢，周線下跌127點，周K線收中長黑，且K線均留有長長的上下影線，上影線明顯長於下影線，顯示盤面多方雖試圖力守支撐，但空方賣壓力道仍強，不過本周周KD指標已經在低檔出現黃金交叉，因此，近期只要美股走勢未再跌破近期低點，下周應該有機會在營收公布完畢後出現反彈走勢。,1
2018-12-07T02:51:00.000Z,美中關係因華為財務長被捕，雙方關係再度陷入緊張，美股跌幅收斂，終場僅那斯達克收紅，亞股今亦止穩，台股今開盤後隨即上漲逾70點，站上9700點關卡，大型權值股回神下，台股短線止血，只是在中美關係持續緊張之際，恐慌情緒放大，股市仍有波動較劇烈的風險存在。,-6
2018-12-10T07:18:00.000Z,華為事件持續延燒，美中貿易戰緊張局勢升高，令上周五美股狂瀉不止，美股電子盤今日亦持續下挫，包括日港陸等亞股臉色鐵青，台股在蘋概及華為概念股不支倒地下，包括大立光 (3008) 上演3000元保衛戰、鴻海 (2317) 股價、市值同創波段低點，台積電 (2330) 亦失守220元，衝擊指數大跌逾百點、一度下探9626.47點，11月營收表現欠佳的被動元件龍頭國巨 (2327) 不敵賣壓逼近跌停，令多方潰不成軍，終場加權指數大跌113.34點為9647.54點，成交值縮為980.67億元。,-11
2018-12-10T06:47:00.000Z,國際利空不斷，台股多頭退守9600點！美國經濟數據不佳，且華為CFO孟晚舟遭加拿大應美國要求拘留，不僅引發大陸官方激烈抗議，大陸民間企業也發起「挺華為抵制美國貨」活動，蘋果遭點名抵制，讓已飽受銷售不佳的蘋果及蘋果概念股雪上加霜，中美貿易戰增添新變數，上周四拉尾盤的美股在上周五不支倒地，且盤前期指繼續探低，讓台股及亞股未開盤就烏雲罩頂，今天台股在股王大立光 (3008) 、可成 (2474) 、鴻海 (2317) 、台積電 (2330) 等同步開低，拖累台股指數一開盤就失守9700點。,-10
2018-12-10T06:47:00.000Z, 　就技術面來看，受到華為事件負面效應持續顯現，美股及亞股全面重挫拖累，台股今天跳空開低，終場下跌113.34點，以9647.54點作收，失守9650點；上周台股先後受川習會釋出中美貿易戰和緩訊息、美債殖利率倒掛及華為事件影響指數先上後下呈現震盪劇烈，今天再因上周五美股重挫及華為事件負面效應顯現，指數開低收低，在全球產經利空不斷下，台股在12月3日近160點的長紅K所顯現的短多氣勢已被完全抵銷，短空勢力更為強大，由於目前台股指數已回落到先前9600點到9800點附近的震盪位置，同時亦失去了短均與月線的支撐，雖然10月31日長紅K下緣，即9600點附近應可視為短線上較有力的支撐，但全球經濟面臨衰退，且美股破底壓力仍在，加上12月6日長黑K上緣乃至當日空方缺口位置上檔層層套牢賣壓，均不利台股後市，考量現階段國際政經局勢依然紛擾，且華為事件愈演愈烈，加上台股指數位置再度落於所有均線之下，短線上盤勢明顯偏弱，若國際股市未能止跌，台股恐將下探9400點。,-14
2018-12-10T03:07:00.000Z,（中央社記者江明晏台北2018年12月10日電）華為事件餘波盪漾，美中貿易戰緊張局勢延續，美股上週五下跌，台股今天開低，盤中跌逾百點，蘋概股與華為概念股成重災區，股王大立光跌破3000元大關，鴻海股價再寫減資後新低。,-6
2018-12-10T03:07:00.000Z,美股3大指數終場重挫逾2%，其中以科技股為主的那斯達克指數大跌逾3%，道瓊指數大跌超過500點。,-3
2018-12-10T03:07:00.000Z,市場預期美股短期震盪整理。,0
2018-12-10T03:07:00.000Z,分析師表示，多空因素雜陳，美股急漲急跌，景氣位於高原期，台股指數再衝高不易，短期仍為震盪整理盤。,-2
2018-12-11T07:08:00.000Z,英國脫歐協議延後表決，且投資人憂心美中貿易戰升高，令隔夜美股大洗三溫暖，在科技股點火救援下，終場得以逆轉翻紅！亞股今日恢復平靜，台股由權值大軍大立光 (3008) 、台積電 (2330) 、鴻海 (2317) 、國巨 (2327) 、廣達 (2382) 與台達電 (2308) 等吹起反攻號角，5G概念股及PCB族群亦全面啟動，推升指數一路向上衝破9700城池，終場加權指數上漲59.5點為9707.04點，成交值縮為919.97億元，創下近期新低量。,12
2018-12-11T06:53:00.000Z,昨夜美股收高，亞股雖漲跌不一，但台股在三大權值巨頭大立光 (3008) 、台積電 (2330) 、鴻海 (2317) 攜手走強，輔以業績、5G、集團作帳等題材助攻之下，今日開高震盪走高，順利收復9700點關卡，終場集中市場收9707.04點，上漲59.5點，惟總成交值縮減至919.97億元；店頭市場收124.6點，上漲0.86點，總成交值256.69億元。,2
2018-12-11T06:21:00.000Z,（中央社記者韓婷婷台北2018年12月11日電）美股震盪翻紅，台股今天由蘋概股領軍向上攻堅，尾盤更有台積電 (2330) 、鴻海 (2317) 、大立光 (3008) 表態，指數重新站上9700點。,4
2018-12-11T02:45:00.000Z,（中央社記者韓婷婷台北2018年12月11日電）美股大洗三溫暖，盤中一度大跌超過500點後震盪翻紅，激勵亞股出現止跌訊號，台股也在蘋概股回穩下，盤中一度回到9700點之上，短線反壓先看5日線9741點。,3
2018-12-11T02:18:00.000Z,美股昨夜由科技股反攻PK因英國脫歐議題而坐大的金融空軍，道瓊盤中震盪逾600點，終場三大指數皆小漲作收，帶動日韓股市早盤跟漲，台股三大期指亦聯袂開高，隨後集中市場開9661.72點、上漲14.18點，店頭市場開123.84點、上漲0.1點，各大類股漲多跌少，盤面由多頭控局。,1
2018-12-12T07:17:00.000Z,周二美股漲跌互見，華為副董兼財務長孟晚舟獲保釋消息傳出後，令美中緊張關係轉趨緩和，激勵亞股開香檳慶賀，台股在三巨頭台積電 (2330) 、鴻海 (2317) 、大立光 (3008) 掛帥領漲蘋概股勁揚，配合題材股MOSFET、被動元件、矽晶圓、二極體族群攻勢凌厲，拉升指數開高走高衝破9800點，大漲逾百點、一度攻抵9835.56點，終場加權指數上漲109.41點為9816.45點，一舉收復5日線、9800點及月線大關，成交值為963.16億元。,11
2018-12-12T07:17:00.000Z,分析師表示，若美股回穩向上，且外資重新回補，台股仍有機會迎接元月行情，短期以9600點為多空關鍵。,1
2018-12-12T06:58:00.000Z,周二美股小幅漲跌，加拿大宣布准許華為首席財務官孟晚舟保釋，加上美中雙方正準備貿易談判事宜，在美中貿易戰局勢緩和之預期下，台股隨亞股開高，收盤大漲109.41點，收復9800點關卡，收在9816.45點，成交值963.16億元。,4
2018-12-12T06:58:00.000Z, 華為首席財務官孟晚舟獲釋，美股電子盤走揚，拉抬亞股擺脫利空，台股在台積電 (2330) 、鴻海 (2317) 等蘋概指標上揚，加上股性活潑的MOSFET、矽晶圓族群再度發動攻勢，台股開高，盤中攻克9800點並觸及月線關卡。,3
2018-12-12T06:58:00.000Z, 周二大陸傳有意調降美國進口國車輛關稅，激勵美股四大指數開高，但盤中美國總統說若不能建築美墨邊界牆，不惜政府關門的強硬言論，壓抑美股，周二美股漲跌互見。,-2
2018-12-12T06:58:00.000Z, 雖美股周二開高壓回，但因孟晚舟獲釋，市場解讀正面，亞洲股市今早紅光滿面，日韓港股全面開高走高，台股也在台積電等蘋概權值股領軍，加權指數跳空開高站穩9700點，盤中漲勢穩健，中場後台積電等權值股漲勢擴大，台股收在相對高點。,7
2018-12-12T06:58:00.000Z,展望後市，若美股可回穩向上，外資重新回補台股，台股仍有機會迎接元月行情。,3
2018-12-12T03:11:00.000Z,周二美股小跌，但加拿大宣布准許華為首席財務官孟晚舟保釋，美股電子盤走揚，拉抬亞股擺脫利空，台股在台積電 (2330) 、鴻海 (2317) 等蘋概指標上揚，加上股性活潑的MOSFET、矽晶圓族群再度發動攻勢，台股開高走高，站穩5日線，觸及9800點並蓄勢挑戰月線關卡。,3
2018-12-12T03:11:00.000Z," 周二大陸傳有意調降美國進口國車輛關稅，激勵美股四大指數開高，但盤中美國總統說若不能建築美墨邊界牆，不惜政府關門的強硬言論，壓抑美股，周二，道瓊工業指數收跌53.02點或0.22%，為24,370.24點。",-4
2018-12-12T03:11:00.000Z, 周二美股四大指數小幅漲跌，科技股表現不一，美光、谷歌、英特爾小漲，台積電ADR上漲0.74%，APPLE下跌0.57%。,-1
2018-12-12T03:11:00.000Z, 雖美股周二表現平淡，但因孟晚舟獲釋，市場解讀正面，亞洲股市今早紅光滿面，日韓港股全面開高走高，台股也在台積電等蘋概權值股領軍，加權指數跳空開高，站穩9700點盤中漲勢穩健，漲點近70點。,7
2018-12-12T03:11:00.000Z,展望後市，若美股可回穩向上，外資重新回補台股，台股仍有機會迎接元月行情，短期以9600點為多空關鍵。,2
2018-12-13T07:13:00.000Z,美中貿易戰在華為財務長獲保釋後出現緩和氣氛，隔夜美股四大指數全數收紅，亞股早盤呈現歡樂氣氛，台股改由集團股作帳股扮演領頭羊，惟雙王大立光 (3008) 、台積電 (2330) 熄火轉為觀望，被動元件國巨 (2327) 、華新科 (2492) 、禾伸堂 (3026) 及矽晶圓族群環球晶 (6488) 、台勝科 (3532) 等拉回拖累，令指數漲幅受到壓抑，相對日港等亞股表現溫和，最後一盤獲大單敲進，終場加權指數上漲42.31點為9858.76點，收復10日線，成交值為1119.87億元。,7
2018-12-13T03:56:00.000Z,美中貿易戰出現緩和氣氛、華為財務長獲保釋，美股四大指數全數收漲，亞股普遍走揚，台股今開盤漲10.87點，加權股價指數報在9827.32點，呈現震盪拉高後的走低，挑戰站穩月線9817點，今台股量能略顯回溫，預估全天成交量落在約1200億元，短線觀察外資是否能終止連七日賣超，以及美中貿易若可再釋利多，則有利台股發展。,4
2018-12-13T03:56:00.000Z, 分析師指出，華為孟晚舟於聽證會後得以保釋，美中緊張關係得到片刻緩解，美股四大指數上揚，台股目前連二日收紅，重返9800點防線，MACD柱狀體負值減少，技術面有好轉跡象，只是美國總統川普不惜政府關門，也要蓋美墨邊境圍牆，加上3、5年期美債殖利率倒掛且經濟成長趨緩，顯示經濟展望並不樂觀，且華為孟晚舟目前尚未完全脫險，美國不排除設法引渡入美，都將左右市場氣氛，也使得投資人持續保守。,2
2018-12-17T07:09:00.000Z,美股上周五重挫，惟美中貿易戰出現緩解聲浪，台股今日隨亞股展現抗跌韌性，由雙王大立光 (3008) 、台積電 (2330) 吹起反攻號角，推升指數開低後旋即由黑翻紅，並一度攻占9800點城池，飽受財務危機的集團股大同 (2371) 挾經營權爭奪戰題材爆量反彈，略為舒緩投資人不安情緒；因外資提前放長假，令市場交投清淡、追價意願薄弱，終場加權指數上漲13.37點為9787.53點，成交值縮至779.36億元，創近1個月以來新低。,-4
2018-12-17T07:09:00.000Z,　台股今日由蘋概股龍頭台積電 (2330) 、大立光 (3008) 扮演撐盤要角，緩解美股大跌帶來的衝擊，推升指數由黑翻紅。,3
2018-12-17T06:03:00.000Z,（中央社記者田裕斌台北2018年12月17日電）亞股今天在美股大跌的陰霾下走勢相對抗跌，台股開盤後甚至一度衝上9800點，不過由於外資即將放長假，多空交投趨於清淡，量能創近1個月以來新低。,-3
2018-12-16T23:57:00.000Z,（中央社記者田裕斌台北2018年12月17日電）美中貿易戰休兵90天之際，中國大陸與歐元區經濟出現警訊，美股再度出現跳水式大跌，分析師預估，外資將持續賣台股，前波低點9626點面臨跌破危機。,-6
2018-12-16T23:57:00.000Z,美股4大指數14日同步重挫，道瓊工業指數下跌496.87點，跌幅2.02%，收在24100.51點，NASDAQ指數下跌159.67點，跌幅2.26%，收在6910.67點，S&P 500指數下跌50.59點，跌幅1.91%，收在2599.95點，費城半導體指數下跌17.03點，跌幅1.43%，收在1177.57點。,-4
2018-12-18T07:21:00.000Z,市場擔憂聯準會升息計畫可能嚴重衝擊經濟和股市，令周一美股道瓊指數重挫500點，日韓等亞股今日同步拉回，台股在三王大立光 (3008) 、台積電 (2330) 及鴻海 (2317) 及金融股同步走疲下，指數一度大跌80點逼近9700大關，大同集團持續籠罩重整疑雲風暴，包括華映 (2475) 、綠能 (3519) 、福華 (8085) 再吞跌停，令市場籠罩低迷氣氛，所幸宏達電 (2498) 、泰碩 (3338) 、南亞科 (2408) 等奮力牽制空軍，終場加權股價指數下跌68.71點為9718.82點，成交值為941.91億元。,-9
2018-12-18T07:21:00.000Z,台股今日受到美股重挫拖累，呈現類股皆墨頹勢，所幸電子股尾盤略為回穩，令指數守穩9700點大關。,-2
2018-12-18T06:36:00.000Z,美股昨夜重挫，亞股今日跟跌，台股難獨善其身，早盤開低31.07點、以9756.46點開出，隨後在台積電 (2330) 、大立光 (3008) 、鴻海 (2317) 、國巨 (2327) 、華新科 (2492) 等重量級權值股皆墨的情勢下，大盤指數最低來到9701點，9700大關告急，所幸宏達電 (2498) 、泰碩 (3338) 、南亞科 (2408) 等奮力牽制空軍再坐大，終場加權指數收在9718.82點，下跌68.71點，總成交值增至941.91億元；店頭市場收在125.38點，下跌1.39點，總成交值292.66億元。,-5
2018-12-18T03:10:00.000Z,（中央社記者鍾榮峰台北2018年12月18日電）美股道瓊重挫，不過台股今天早盤跌幅收斂，量縮整理。,-4
2018-12-18T03:10:00.000Z,美股重挫，道瓊工業指數終場大跌507.53點，不過亞洲股市相對跌勢不顯著，台股守住9700點大關，盤中呈現跌幅收斂、量縮整理格局，游走在短期均線之下。,-2
2018-12-18T03:10:00.000Z,國泰證期顧問處協理簡伯儀表示，儘管美股道瓊重挫507點，但亞洲主要股市盤中表現穩健，中國大陸股市逆勢上揚，台股跌幅收斂，而由於外資法人放長假在即，預估今天台股量能大約在800億元左右。,-1
2018-12-18T02:36:00.000Z,美股道瓊指數昨夜重挫507點，影響台股開盤跌31.07點，為9756.46點，隨後大立光 (3008) 、台積電 (2330) 及鴻海 (2317) 等權值股走弱，空軍一度進逼9700大關，盤面上個股表現為主。,-3
2018-12-19T07:11:00.000Z,油價重挫及美國聯準會可能升息疑慮，衝擊隔夜美股指數漲幅受抑，台股今日由蘋概三天王台積電 (2330) 、大立光 (3008) 及鴻海 (2317) 與被動元件族群龍頭股國巨 (2327) 、華新科 (2492) 、禾伸堂 (3026) 聯手點火，力撐指數維持在9700點之上高檔整理，尾盤因台指期拉高結算，尾盤買單敲進台積電 (2330) 、大立光 (3008) 及鴻海 (2317) 等大型股，終場加權股價指數收在今日最高9783.21點，上漲64.39點，差1點站上5日線，成交值為883.06億元。,4
2018-12-19T06:11:00.000Z,周二美股止跌反彈，台股今早隨著部分亞股回穩，台積電 (2330) 及股王大立光 (3008) 走穩，金融股盤中翻紅上揚，台股開高走高，今日為台指期結算，台股多頭表態，臨收盤再拉16點，以最高點作收，漲64點至9783點，逼近5日線，成交值僅883億元。,3
