PublishDate,Sentence,Score
2018-03-01T04:11:00.000Z,三星為了避開這些阻撓，投入大量時間才開發出新技術。,0
2018-03-01T04:11:00.000Z,三星為了避開這些阻撓，投入大量時間才開發出新技術。,0
2018-03-08T02:55:00.000Z,分析師表示，台股今天成交值有機會突破1300億元，創3月以來單日最大量，顯見多空雙方在此膠著已久，盤勢尋求突破契機。,1
2018-03-19T04:02:00.000Z,中小型股力守，台股多空決戰11000點！上週五富時指數調整，因大量買單敲進台積電 (2330) 、國泰金 (2882) 、富邦金 (2881) 等權值股而神奇擺尾收紅的台股，今天就回歸現實，歷經夢幻拉抬的台積電今天一開盤就遭逢賣壓，讓台股指數以黑盤開出，不過矽晶圓、被動元件續夯，中美晶 (5483) 盤中強攻漲停板，合晶 (6182) 及嘉晶 (3016) 同樂強攻，國巨 (2327) 再創上市新高價，帶動華新科 (2492) 及禾伸堂 (3026) 同步走高，搭配生技股的寶齡 (1760) 等續強，台股指數在中場過後由黑翻紅，指數一度站上11050點，惟成交量略顯不足。,7
2018-03-20T02:05:00.000Z,  20.映泰 (2399) ：比特幣挖礦概念股再度崛起，不畏外資近3日賣超，早盤爆大量直飆逾8%，站穩短均。,-2
2018-03-27T02:07:00.000Z,  25.強茂 (2481) ：法人近5日買超3850張，列籌碼穩定股，早盤挾大量觸及漲停板，躍上46.4元波段新高價。,4
2018-03-29T07:15:00.000Z,台股今日受到大立光 (3008) 、聯發科 (2454) 、日月光 (2311) 等電子權值股以及金融股同步走疲拖累，盤中指數一度下探10815.46點，所幸生醫股力撐盤勢，使多空於平盤附近拉鋸，尾盤台積電 (2330) 、鴻海 (2317) 、大立光、國泰金 (2882) 、富邦金 (2881) 等權值股遭大單殺出，爆出86億元大量，終場加權指數下跌19.74點為10845.92點，成交值為1163.74億元。,-5
2018-03-29T07:15:00.000Z,台股今日受到大立光 (3008) 、聯發科 (2454) 、日月光 (2311) 等電子權值股以及金融股同步走疲拖累，盤中指數一度下探10815.46點，所幸生醫股力撐盤勢，使多空於平盤附近拉鋸，尾盤台積電 (2330) 、鴻海 (2317) 、大立光、國泰金 (2882) 、富邦金 (2881) 等權值股遭大單殺出，爆出86億元大量，終場加權指數下跌19.74點為10845.92點，成交值為1163.74億元。,-5
