PublishDate,Sentence,Score
2017-06-14T03:11:00.000Z,鴻海 (2317) 董事長郭台銘昨日批評政府行政效率低，台灣大 (3045) 董事長蔡明忠今(14)日出席股東會時表示，郭台銘的意見是提供政府很好的參考，他個人認為，台灣是一個開放的經濟體，政府還是該更鬆綁才對；他說，連同性婚姻都朝立法方向發展，台灣經濟體不能同步開放「是一件讓人很納悶的事」。,3
2017-06-14T02:26:00.000Z,（中央社記者吳家豪台北2017年6月14日電）台灣大哥大 (3045) 今天召開股東常會，對於股東提議鴻海可併購台灣大哥大，台灣大哥大董事長蔡明忠雖表示這並非單一股東意見可主導，卻也坦言若能與鴻海合作，會覺得是「天上掉下來的禮物」。,1
2017-06-14T02:26:00.000Z,蔡明忠表示，有股東建議如果鴻海 (2317) 董事長郭台銘出個好價錢，台灣大哥大可以考慮被鴻海集團旗下亞太電信 (3682) 併購，不過蔡明忠認為，這不是單一股東的意見可以決定或主導的事情。,1
2017-06-14T02:26:00.000Z,蔡明忠強調，台灣大哥大當然希望與郭台銘在各方面都有更深、更廣的合作，畢竟台灣這麼多企業當中，從繳稅多寡來看，第一名是台積電 (2330) ，第二名就是鴻海，兩家公司都由世界級的企業家領導。,5
2017-06-14T02:26:00.000Z,蔡明忠笑稱，他相信不只是台灣大哥大，所有台灣企業如果有機會能與鴻海合作，都會覺得是「天上掉下來的禮物」。,3
