PublishDate,Sentence,Score
2017-11-07T07:01:00.000Z,傳產股方面，工紙大廠榮成 (1909) 10月獲利登峰激勵股價大漲5%，帶動寶隆 (1906) 、正隆 (1904) 、華紙 (1905) 等造紙股人氣強強滾；隨著油價走高，激勵台塑 (1301) 、南亞 (1303) 、台化 (1326) 等塑膠股走揚，航運股因擔心成本增加表現疲軟，航空雙雄華航 (2610) 、長榮航(2168)雙雙熄火，貨櫃三雄長榮 (2603) 、陽明 (2609) 及萬海 (2615) 壓低整理。,8
2017-11-07T07:01:00.000Z,台股今日由台積電掛帥，聯發科、南亞科與台塑四寶等扮演輔攻角色，使盤勢開高之後欲小不易，終場加權股價指數收在10840.34點，再創27年收盤新高。,1
2017-11-08T07:03:00.000Z,台股今日在台積電、台塑 (1301) 與國泰金等權值股拉回下，多、空觀望氛圍濃厚，惟股王大立光領軍多方攻堅，使盤勢仍屹立在10800點之上強勢整理。,4
2017-11-08T06:12:00.000Z,原物料方面，台塑 (1301) 四寶營運佳但股價整理，中鋼 (2002) 走跌，大型股缺乏亮點，使得台股收盤未能再創27年新高。,0
2017-11-16T00:14:00.000Z,"　塑化指標股之一的台塑，10月合併營收達165.81億元，月減5.8％、但年增9.6％，股價昨收紅，單日成交量放大至6,826張，已突破5日線及月線，上攻挑戰季線意味濃厚，其他塑化及鋼鐵族群個股，如豐興、高興昌、燁興、榮化、台苯表現都優於大盤，漲幅達0.21～0.96％。",6
2017-11-27T07:35:00.000Z,"　統計處表示，台積電稅後淨利2,438億元居冠，之後依序為鴻海 (2317) 和台塑化 (6505) 。",0
2017-11-29T07:03:00.000Z,美股三大指數再創新高，激勵台股短多僅曇花一現，由於股王大立光開高殺低，使多方操作相對保守，另外，權值股台積電、鴻海 (2317) 、國泰金、富邦金與台塑 (1301) 等反彈乏力，也影響短多追價，致月線得而復失；惟內、外資法人短線青睞小型股，使店頭市場大漲收市相對強勢。,8
