PublishDate,Sentence,Score
2017-02-14T07:00:00.000Z,傳產股方面，國際銅價續揚，激勵華新 (1605) 挾量衝高，億泰 (1616) 、大亞 (1609) 攜手漲停，華電 (1603) 、華榮 (1608) 緊追在後，齊力扮演多頭主帥；第一銅 (2009) 亦爆量攻頂，帶動鋼鐵股走勢堅挺；食品股在禽流感疫情擴大下相對弱勢，國內兩家最大電宰雞廠大成 (1210) 續弱、卜蜂 (1215) 翻紅。,8
2017-02-14T06:59:00.000Z,美股續創高，亞股卻綠油油，台股大盤今日在大亞 (1609) 、車王電 (1533) 、泰碩 (3338) 、億泰 (1616) 等中小型股聯袂漲停衝鋒，挾以主要權值股台積電 (2330) 持平，鴻海 (2317) 、大立光 (3008) 小漲穩盤的支撐下，指數一度衝上9760.01點，惟隨後半導體指數受到旺宏 (2337) 、華邦電 (2344) 等大跌拖累翻黑，加上大同 (2371) 、中石化 (1314) 亦雙雙跌逾4%，面板雙虎仍疲弱不振，權值股士氣受挫，終場大盤指數僅小漲8.46點，收在9718.78點，總成交值放大至1120.78億元；店頭市場跌0.44點，收在131.15點，總成交值320.06億元。,-3
2017-02-14T06:59:00.000Z,華新 (1605) 、大亞、大山 (1615) 等線纜族群，元月因電力線纜報價大漲，合併營收逆勢成長，今股價紛紛走揚，其中大亞以7.11元漲停價作收，漲幅最搶眼。,7
2017-02-21T07:09:00.000Z,傳產股表現相對強勢，造紙股受惠國際紙漿、廢紙等原物料報價漲勢未歇，今日由華紙 (1905) 強勢漲停領軍，永豐餘 (1907) 、榮成 (1909) 、正隆 (1904) 等聯袂齊揚，推升類股指數大漲3.85%，盤面最火紅；倫敦銅價周一盤中回升至每公噸6000美元以上，激勵相關概念股走高，第一銅 (2009) 強鎖漲停、華榮 (1608) 觸頂，華新 (1605) 及大亞 (1609) 跟進大漲。,14
2017-02-21T02:39:00.000Z,倫敦銅價周一盤中回升至每公噸6000美元以上，外界預期中國需求持續增加將繼續推升銅價，激勵今日相關概念股走高，盤中第一銅 (2009) 強鎖漲停，華榮 (1608) 觸頂，華新 (1605) 及大亞 (1609) 也紛紛大漲。,10
