PublishDate,Sentence,Score
2018-03-01T07:23:00.000Z,升息憂慮陰霾籠罩，使周三美股三大指數同步重挫，台股今日跟隨亞股腳步壓回修正，在台積電 (2330) 、南亞科 (2408) 與台塑四寶等權值股走弱下，指數一度下探10709.69點，連續跌破季線及5日線關卡，惟股王大立光 (3008) 逆勢突圍，帶領中小型股向上助攻，使指數跌幅逐漸收斂，終場加權指數下跌29.68點為10785.79點，跌落10800點大關、仍守住季線及5日線，成交值縮為1285.62億元；櫃買指數開低走高，終場收在今日最高148.72點。,-1
2018-03-01T07:23:00.000Z,傳產股方面，油價連2日走跌衝擊塑化股表現，台塑四寶台化 (1326) 、台塑 (1301) 、南亞 (1303) 、台塑化 (6505) 全面下挫；貨櫃雙雄陽明 (2609) 及長榮 (2603) 受惠市況好轉及業績報捷，股價雙雙高飛；鋼鐵股受到鋼價第二季續漲確定，中鋼 (2002) 、中鴻 (2014) 、官田鋼 (2017) 、志聯 (2024) 等漲勢凌厲。,5
2018-03-01T07:23:00.000Z,台股今日受制於台積電開低疲軟，加上台塑四寶、南亞科等權值股表現弱勢，使早盤指數跌破5日線與季線，所幸中場過後在股王大立光領軍強彈下，帶領以中小型股為主的櫃買市場震盪走高，終場加權指數跌幅收斂，守穩於5日線及季線等關卡之上。,-1
2018-03-01T06:28:00.000Z,台塑四寶全面走跌，台塑 (1301) 、南亞 (1303) 、台塑化 (6505) 、台化 (1326) 等跌幅均在2%~2.5%，壓抑大盤表現，其餘二線塑化股方面，中石化 (1314) 、台達化 (1309) 、華夏 (1305) 、國喬 (1312) 等亦同步走跌。,-3
2018-03-01T02:45:00.000Z,   美國上週原油庫存上升幅度高於預期，產量創下高點，使得油價已連續2天呈現走跌，首當其衝的就是塑化股，台塑四寶全面走低，平均跌幅達2%，其中又以台化 (1326) 下挫約3.5%跌幅最深，也成為壓抑大盤指數的壓力之一。,-2
2018-03-02T07:18:00.000Z,　受到國際股市重挫影響，權值股今日普遍承壓，蘋概股天王大立光 (3008) 、台積電 (2330) 、鴻海 (2317) 及台塑四寶台塑 (1301) 、南亞 (1303) 、台化 (1326) 、台塑化 (6505) 與金控雙雄富邦金 (2881) 、國泰金 (2882) 同步走疲。,-1
2018-03-02T07:18:00.000Z,受制於美國總統川普將課鋼鋁關稅，市場擔憂引爆貿易戰，美股周四全面重挫，衝擊全球股市同步驚跌，台股在雙王台積電、大立光領跌以及台塑四寶、國泰金及富邦金等權值股表現弱勢下，拖累指數連續跌破5日線、季線及10700點等關卡。,-8
2018-03-01T07:23:00.000Z,升息憂慮陰霾籠罩，使周三美股三大指數同步重挫，台股今日跟隨亞股腳步壓回修正，在台積電 (2330) 、南亞科 (2408) 與台塑四寶等權值股走弱下，指數一度下探10709.69點，連續跌破季線及5日線關卡，惟股王大立光 (3008) 逆勢突圍，帶領中小型股向上助攻，使指數跌幅逐漸收斂，終場加權指數下跌29.68點為10785.79點，跌落10800點大關、仍守住季線及5日線，成交值縮為1285.62億元；櫃買指數開低走高，終場收在今日最高148.72點。,-1
2018-03-01T07:23:00.000Z,傳產股方面，油價連2日走跌衝擊塑化股表現，台塑四寶台化 (1326) 、台塑 (1301) 、南亞 (1303) 、台塑化 (6505) 全面下挫；貨櫃雙雄陽明 (2609) 及長榮 (2603) 受惠市況好轉及業績報捷，股價雙雙高飛；鋼鐵股受到鋼價第二季續漲確定，中鋼 (2002) 、中鴻 (2014) 、官田鋼 (2017) 、志聯 (2024) 等漲勢凌厲。,5
2018-03-01T07:23:00.000Z,台股今日受制於台積電開低疲軟，加上台塑四寶、南亞科等權值股表現弱勢，使早盤指數跌破5日線與季線，所幸中場過後在股王大立光領軍強彈下，帶領以中小型股為主的櫃買市場震盪走高，終場加權指數跌幅收斂，守穩於5日線及季線等關卡之上。,-1
2018-03-01T06:28:00.000Z,台塑四寶全面走跌，台塑 (1301) 、南亞 (1303) 、台塑化 (6505) 、台化 (1326) 等跌幅均在2%~2.5%，壓抑大盤表現，其餘二線塑化股方面，中石化 (1314) 、台達化 (1309) 、華夏 (1305) 、國喬 (1312) 等亦同步走跌。,-3
2018-03-01T02:45:00.000Z,   美國上週原油庫存上升幅度高於預期，產量創下高點，使得油價已連續2天呈現走跌，首當其衝的就是塑化股，台塑四寶全面走低，平均跌幅達2%，其中又以台化 (1326) 下挫約3.5%跌幅最深，也成為壓抑大盤指數的壓力之一。,-2
2018-03-02T07:18:00.000Z,　受到國際股市重挫影響，權值股今日普遍承壓，蘋概股天王大立光 (3008) 、台積電 (2330) 、鴻海 (2317) 及台塑四寶台塑 (1301) 、南亞 (1303) 、台化 (1326) 、台塑化 (6505) 與金控雙雄富邦金 (2881) 、國泰金 (2882) 同步走疲。,-1
2018-03-02T07:18:00.000Z,受制於美國總統川普將課鋼鋁關稅，市場擔憂引爆貿易戰，美股周四全面重挫，衝擊全球股市同步驚跌，台股在雙王台積電、大立光領跌以及台塑四寶、國泰金及富邦金等權值股表現弱勢下，拖累指數連續跌破5日線、季線及10700點等關卡。,-8
2018-03-05T07:11:00.000Z,台塑四寶股利超甜，配息上看1780億元，台塑 (1301) 、南亞 (1303) 、台化 (1326) 股價相對有撐。,1
2018-03-05T07:11:00.000Z,憂心川普恐掀貿易大戰黑天鵝變數，台股今日雖由台積電、台塑等權值股與被動元件、挖礦及生醫等概念股力挺多方，惟股王大立光與股后精測 (6510) 雙雙殺低，且金融與鋼鐵股演出不振，使盤勢開高殺低，失守半年線。,-3
2018-03-06T07:22:00.000Z,台股今日受惠美股周一勁彈激勵短多士氣，加上台積電領軍電子股吹反彈號角，以及金融與台塑四寶等權值股成功穩盤，使指數開高走高，連續收復10700點、五日線、季線、月線與半年線等關卡。,6
2018-03-07T07:22:00.000Z,傳產股方面，中裕 (4147) 挾愛滋新藥獲美FDA上市核准強攻漲停，帶動生醫股保瑞藥 (6472) 、生華科 (6492) 、智擎 (4162) 、浩鼎 (4174) 、基亞 (3176) 等群起攻之；台塑四寶上修Q1展望，台塑 (1301) 、南亞 (1303) 表現硬頸。,5
2018-03-07T06:03:00.000Z,  今日台股早盤仍硬挺，昨天大漲的台積電 (2330) 早盤仍有撐，隨著低檔買盤積極，日月光、鴻海等電子權值股，以及近來最強勢的挖礦股撼訊 (6150) 、青雲 (5386) 續攻，被動元件日電貿 (3090) 強勢上揚，加上大型金控的富邦金 (2881) 撐住金融股，以及台塑 (1301) 四寶走穩，台股早盤回升至10800點之上，守住月季線關卡。,6
2018-03-08T07:15:00.000Z,周三美股道瓊跌幅收斂、科技股反彈收高激勵，使台股周四在台積電、鴻海等電子股領軍衝高，加上聯發科 (2454) 、聯電 (2303) 、南亞科 (2408) 及台塑化 (6505) 等權值股力挺多方，推升指數成功收復月線、季線及10800點等關卡。,4
2018-03-12T07:14:00.000Z,台股今日受惠集團大股東、法人等市場大戶回籠，使周一指數開高走高，在台積電、鴻海、台塑四寶、國泰金、新光金、富邦金等權值股力挺多方下，連續收復10900點11000點，可望持續挑戰1月23日的11270點前波高點。,1
2018-03-20T07:15:00.000Z,臉書股價暴跌引發科技股賣壓，拖累周一美股三大指數重挫，台股早盤跟隨亞股腳步同步開低，在蘋概股三天王大立光 (3008) 、台積電 (2330) 、鴻海 (2317) 同步走弱下，多頭信心渙散，指數一度下探10981.04點，跌落11000點並摔出五日線，惟權值股聯發科 (2454) 、台塑 (1301) 、台化 (1326) 以及被動元件、挖礦概念與具轉機LED等題材股力挺多方，使多空於11000點拔河，終場加權指數下跌36.06點為11010.84點，守住11000點大關，成交值為1096.87億元。,-7
2018-03-21T06:22:00.000Z,美股三大指數止跌反彈，台股今早電子股及金融股穩揚，集中市場仍在1萬1千點之上強勢整理；尾盤大型股台塑化 (6505) 壓低，台股僅微漲0.23點，幾乎以平盤做收且是今日最低。,0
2018-03-22T07:06:00.000Z,"台股因台塑化 (6505) 肥手指事件券商申報6,400張錯帳，今日跳空漲停鎖死，帶動指數逆勢走高，盤中一度上漲逾百點，最高來到11120.20點，突破3月13日高點，惟盤中台積電 (2330) 、大立光 (3008) 、金控等大型股賣壓漸出下，指數由紅翻黑下探10975.33點，最後一盤再獲買盤拉抬，使指數跌幅略為收斂，終場加權指數下跌5.23點為11005.84點，險守11000點大關，成交值放大至1474.16億元。",3
2018-03-22T07:06:00.000Z,　FED如預期升息1碼，並暗示今年至少再調升2次，激勵金融股早盤由富邦金 (2881) 、國泰金 (2882) 及元大金 (2885) 等走揚，台塑化 (6505) 因肥手指事件券商申報6400張錯帳，早盤跳空漲停鎖死，帶動台股早盤逆勢走高。,9
2018-03-22T07:06:00.000Z,FED宣布升息1碼，加上台塑化在法人強力回補下整場鎖在漲停，使台股早盤一度大漲逾百點，無奈市場憂心中美貿易戰將開打，高檔獲利了結賣壓齊出籠，中場過後指數震盪翻黑，五日線與11100點得而復失，惟仍力守11000點之上。,3
2018-03-22T03:22:00.000Z,但台股在錯賣台塑化 (6505) 外資券商必須將昨日錯帳在今天盤中買回，台塑化直接跳空漲停，帶動台股跳空34.83點開出，並突破11100點，但盤中台積電 (2330) 、大立光 (3008) 、金控股等大型股出現壓力，指數突破3月13日高點後壓回，預估成交金額約1500億元。,3
2018-03-26T07:16:00.000Z,台股今日受惠股王大立光跌深反彈，與聯發科、國泰金、台塑化 (6505) 、中華電 (2412) 、台灣大 (3045) 等集團股力挺多方，使加權股價指數震盪翻紅，10800點失而復得。,1
2018-03-26T04:02:00.000Z, 　就技術面來看，受到中美貿易戰衝擊，上週五美股及亞股重挫，台股亦以下跌142點的10863點開出，整日指數呈現弱勢震盪，權值類股除台塑 (1301) 、台塑化 (6505) 收紅以外，皆全線下跌，台積電及大立光領跌下，終場加權股價指數以10823.33點作收，累計一週下跌204.37點，跌幅1.85%，週K收黑，終止連二紅，5日均量1303億元，價跌量穩，上櫃市場跌2.38%，收在150.62點，衝過10年新高後回檔；雖然上週五美股持續重挫，但因中美雙方態度轉為緩和，今天台股及亞股開低後緩步拉高，多空在10800點交戰；上週五台股呈現跳空下挫的弱勢震盪格局，指數失守季線支撐，雖然單看台股盤勢危機不大，11000點出現跳空缺口，但低點未破頸線，還留下影線，多頭抗擊利空，不過，2月5日跳空缺口未能補足之下形成新一重套牢賣壓，且外資法人甫啟動調節動作，若貿易戰難以有效轉圜，指數恐延續弱勢震盪格局。,-10
