PublishDate,Sentence,Score
2018-07-13T02:58:00.000Z,而台泥 (1101) 也有1.5%左右的漲幅，均為指數上攻增添動能。,4
2018-07-17T07:13:00.000Z,台股今日受制權王台積電、股王大立光與股后國巨表現不振，加上台塑四寶、中信金 (2891) 、台泥 (1101) 等集團也軟腳，盤中指數摔落10800點、五日線與月線，分析師表示，被動元件、MOSFET等相關概念股，成短線殺盤重心，惟大盤今最低點10758點，在年線之前即止跌，並守住月線關卡，顯示低檔年線支撐相對強韌，後市不必過分悲觀。,-6
2018-07-24T07:08:00.000Z,受惠外資等法人強勢回補被動元件、MOSFET等題材股，加上台塑 (1301) 、台化 (1326) 、台泥 (1101) 、亞泥 (1102) 、中鋼 (2002) 等傳產龍頭股強勢表態，使盤勢開低震盪走高，進逼「萬一」大關。,3
2018-07-24T06:33:00.000Z,塑膠與玻璃類股也都有不錯表現，類股指數同步大漲逾1%，水泥類股在台泥 (1101) 與亞泥 (1102) 股價同步大漲帶動下，類股指數更大漲5.13%。,5
2018-07-24T03:34:00.000Z,水泥類股也在台泥 (1101) 與亞泥 (1102) 股價同步大漲帶動下，類股指數更漲逾2%。,4
2018-07-25T07:13:00.000Z,台股今日受制鴻海除息表現不振，且台塑四寶、台積電、台泥 (1101) 、統一 (1216) 及日月光投控 (3711) 等集團股同步軟腳，終場加權股價指數收盤下挫29.6點，仍有守於五日線之上。,-2
2018-07-26T07:02:00.000Z,原物料傳產股有買盤挹注，中鋼 (2002) 全年獲利成長可期，邁向填息，台泥 (1101) 因大陸市場不淡，大漲2%。,7
2018-07-26T07:02:00.000Z,強勢股帶動下，台股終場收漲44.82點，為11010.61點。,4
2018-07-26T07:02:00.000Z,  大陸水泥市場淡季不淡，亞泥 (1102) 、台泥 (1101) Q3看旺，水泥股集體歡慶，嘉泥 (1103) 大漲7%以上，亞泥以5%漲幅緊追在後，台泥、信大 (1109) 、環泥 (1104) 全面向上，類股漲幅1.68%。,9
2018-07-26T07:02:00.000Z,台泥 (1101) 全年EPS有望衝破4元，今日除息1.5元、除權1元，股價一日完成填息，並朝填權路邁進。,5
2018-07-26T06:02:00.000Z,美股科技股財報叫好，且川普與歐盟貿易談判達成共識，今股匯齊揚，台幣兌美元一度升破30.5大關，台股開高震盪，儘管電子權值股偏弱，但被動元件、太陽能股等族群強勢，加上金融、傳產股除權行情支撐，指數站上11000點大關，終場台股收漲44.82點、報在11010.61點、成交量為1322.5億元。,7
2018-07-26T06:02:00.000Z,  傳產股今扮演重要撐盤要角，又以原物料族群為首，中鋼 (2002) 今日除息表現不俗，緩步邁向填息，水泥股多頭點火，儘管6~8月為傳統淡季，但大陸錯峰生產執行嚴格，台泥 (1101) 全年EPS有望衝破4元，今日除息1.5元、除權1元，盤中股價大漲一日完成填息，並朝填權路邁進，亞泥 (1102) 亦大漲5.5%以上。,11
2018-07-26T02:35:00.000Z,  非電子股方面，原物料傳產股今表現不俗，中鋼 (2002) 今除息，受惠全年獲利成長可期，外資持續加碼下，推升行情，大步邁向填息，台泥 (1101) 因大陸市場不淡，第三季營運有機會優於預期，今股價大漲逾3.5%。,10
2018-07-30T07:10:00.000Z,傳產龍頭股力挺多方，台泥 (1101) 、台塑 (1301) 、中鋼 (2002) 及永豐餘 (1907) 逆勢抗跌。,0
2018-07-30T06:18:00.000Z,股王及被動元件不振，台股終止日K連5紅！　美國科技股財報不如預期，上周五Nasdaq指數重挫，讓台灣電子股未開盤先烏雲罩頂，而知名蘋果分析師首次談MLCC，竟重創被動元件，股后—國巨 (2327) 、奇力新 (2456) 、華新科 (2492) 、光頡 (3624) 、禾伸堂 (3026) 、大毅 (2478) 及達方 (8163) 等多檔股票同步跌停作收，讓以低盤開出的台股盤中指數一度回測11000點，所幸，台積電 (2330) 在尾盤奮力收紅，蘋果概念股的台郡 (6269) 、和碩 (4938) 、鴻海 (2317) 及季報出色的日月光控股 (3711) 收高，搭配傳產龍頭股—台泥 (1101) 、台塑 (1301) 及永豐餘 (1907) 等力挺，台股指數在尾盤小幅拉升，守住11000點，但終止日K連5紅，終場加權股價指數為11033.54點，下跌42.24點，成交量為1252.08億元；OTC指數為150.09點，下跌2.03點，成交量為298.54億元。,-3
2018-07-31T03:22:00.000Z,傳產股今天普遍顯得疲軟，發行海外存託憑證的台泥 (1101) 股價開低走低，6月稅前盈餘大增的造紙股榮成 (1909) 頗有利多出盡的味道，股價在低檔盤旋，跌幅一度約3%。,-2
2018-07-31T03:22:00.000Z,傳產股今天普遍顯得疲軟，發行海外存託憑證的台泥 (1101) 股價開低走低，6月稅前盈餘大增的造紙股榮成 (1909) 頗有利多出盡的味道，股價在低檔盤旋，跌幅一度約3%。,-2
2018-07-30T07:10:00.000Z,傳產龍頭股力挺多方，台泥 (1101) 、台塑 (1301) 、中鋼 (2002) 及永豐餘 (1907) 逆勢抗跌。,0
2018-07-30T06:18:00.000Z,股王及被動元件不振，台股終止日K連5紅！　美國科技股財報不如預期，上周五Nasdaq指數重挫，讓台灣電子股未開盤先烏雲罩頂，而知名蘋果分析師首次談MLCC，竟重創被動元件，股后—國巨 (2327) 、奇力新 (2456) 、華新科 (2492) 、光頡 (3624) 、禾伸堂 (3026) 、大毅 (2478) 及達方 (8163) 等多檔股票同步跌停作收，讓以低盤開出的台股盤中指數一度回測11000點，所幸，台積電 (2330) 在尾盤奮力收紅，蘋果概念股的台郡 (6269) 、和碩 (4938) 、鴻海 (2317) 及季報出色的日月光控股 (3711) 收高，搭配傳產龍頭股—台泥 (1101) 、台塑 (1301) 及永豐餘 (1907) 等力挺，台股指數在尾盤小幅拉升，守住11000點，但終止日K連5紅，終場加權股價指數為11033.54點，下跌42.24點，成交量為1252.08億元；OTC指數為150.09點，下跌2.03點，成交量為298.54億元。,-3
