PublishDate,Sentence,Score
2018-11-20T07:12:00.000Z,大陸則不畏貿易戰搶拚5G商機，台灣通網概念股群起上攻，中磊 (5388) 看旺衝上漲停，仲琦 (2419) 、智易 (3596) 、譁裕 (3419) 、眾達-KY (4977) 均展雄風。,3
2018-11-21T07:13:00.000Z,美國打大陸禁售晶片，安控股再成今日台股猛將，奇偶 (3356) 再拉第二根漲停，慧友 (5484) 跟漲，中磊 (5388) 也可望受惠而股價高漲，晶睿 (3454) 、陞泰 (8072) 則盤中漲勢消風拉回平盤。,5
2018-11-21T03:38:00.000Z, 美股三大指數再度全面重挫，但費城半導體指數小幅上揚，台股中小型科技股像是矽晶圓的環球晶 (6488) 逆勢上漲，磊晶的漢磊 (3707) 、嘉晶 (3016) 同步走揚；網通的中磊 (5388) 股價領軍續強；加上台積電早盤跌落10月低點後迅速收斂跌幅甚至翻紅，帶動電子類股指數同步翻紅，以及亞股紛紛縮小跌幅。,4
2018-11-30T07:28:00.000Z,而感測器出貨爆發的矽創 (8016) 以及搶賺5G財的立積 (4968) 、宏觀 (6568) 、超眾 (6230) 、仲琦 (2419) 、智邦 (2345) 、正文 (4906) 、友訊 (2332) 、台揚 (2314) 、中磊 (5388) 等利多推升股價走高。,1
2018-11-30T02:22:00.000Z, 八大類股今全面走揚，中小型個股各領題材表現，有多檔投信轉買股走揚，包括矽創 (8016) 、強茂 (2481) 、原相 (3227) 、欣興 (3037) 等股價強勢，矽創更寫下波段新高，比特幣概念股世芯-KY (3661) 攻上漲停；5G商轉進入倒數，全球建設千億美元商機可期，仲琦 (2419) 、智邦 (2345) 、正文 (4904) 、友訊 (2332) 、台揚 (2314) 以及中磊 (5388) 等今全數股價走揚，就整體盤面來說，中小型個股相對活躍。,9
2018-11-30T07:28:00.000Z,而感測器出貨爆發的矽創 (8016) 以及搶賺5G財的立積 (4968) 、宏觀 (6568) 、超眾 (6230) 、仲琦 (2419) 、智邦 (2345) 、正文 (4906) 、友訊 (2332) 、台揚 (2314) 、中磊 (5388) 等利多推升股價走高。,1
2018-11-30T02:22:00.000Z, 八大類股今全面走揚，中小型個股各領題材表現，有多檔投信轉買股走揚，包括矽創 (8016) 、強茂 (2481) 、原相 (3227) 、欣興 (3037) 等股價強勢，矽創更寫下波段新高，比特幣概念股世芯-KY (3661) 攻上漲停；5G商轉進入倒數，全球建設千億美元商機可期，仲琦 (2419) 、智邦 (2345) 、正文 (4904) 、友訊 (2332) 、台揚 (2314) 以及中磊 (5388) 等今全數股價走揚，就整體盤面來說，中小型個股相對活躍。,9
