PublishDate,Sentence,Score
2017-07-04T06:51:00.000Z,國際股市漲跌不一，台股開盤受台積電 (2330) 、鴻海 (2317) 、面板雙虎等主要權值股走弱影響，下跌14.86點，以10397.93點開出，惟國泰金 (2882) 引領金融股力守高檔，加上航運、鋼鐵、造紙等傳產類股輪番上攻，盤初大盤指數一度重回高檔，無奈盤中鴻海跌幅擴大至3%，助長空頭氣焰，大盤指數碎步下行，終場集中市場下跌65.01點，收在10347.78點，10400關卡未能守住，總成交值同步縮減至919.98億元；店頭市場下跌0.36點，收在135.13點，總成交值221.7億元。,-2
2017-07-04T06:51:00.000Z,國際股市漲跌不一，台股開盤受台積電 (2330) 、鴻海 (2317) 、面板雙虎等主要權值股走弱影響，下跌14.86點，以10397.93點開出，惟國泰金 (2882) 引領金融股力守高檔，加上航運、鋼鐵、造紙等傳產類股輪番上攻，盤初大盤指數一度重回高檔，無奈盤中鴻海跌幅擴大至3%，助長空頭氣焰，大盤指數碎步下行，終場集中市場下跌65.01點，收在10347.78點，10400關卡未能守住，總成交值同步縮減至919.98億元；店頭市場下跌0.36點，收在135.13點，總成交值221.7億元。,-2
2017-07-10T07:10:00.000Z,英業達 (2356) 6月合併營收418.98億元，創41個月新高，月增21.27%，激勵今盤中股價衝上27.05元，登2014年8月來新高價，成交量同步暴增至4.4萬餘張，成為今日電腦族群領頭羊。,5
2017-07-10T06:55:00.000Z,股王—大立光 (3008) 登天價無用，台股殺尾月線得而復失！今天台股在上週五美國科技股絕地大反攻強勢上漲帶動下，指數以小紅開出，不過台積電 (2330) 除息後遲遲未填息，衝擊到中小型股除權息行情，建錩 (5014) 、強盛 (1463) 、奇力新 (2456) 、豐泰 (9910) 、麗嬰房 (2911) 、中鴻 (2014) 、智邦 (2345) 、遠傳 (4904) 、奇美材 (4960) 等走弱，讓台股由紅翻黑，所幸即將在13日舉行法說會的大立光 (3008) 及台積電股價回穩，尤其是大立光轉強，不僅重登5000元關卡，尾盤時更攻上5095元，再創台股新天價，中壽 (2823) 及碩禾 (3691) 等盤中股價強攻漲停板，鴻海 (2317) 、美律 (2439) 等收高，讓台股一度重回月線。,6
2017-07-10T03:42:00.000Z,  今天台股以平高盤開出，盤中雖然受到傳產股的豐泰 (9910) 、麗嬰房 (2911) 、中鴻 (2014) 等，以及智邦 (2345) 、遠傳 (4904) 、奇美材 (4960) 等下跌衝擊，台股指數一度由紅翻黑，但6月合併營收表現優於預期，將於本周舉行法說會的大立光 (3008) 率先轉強，重登5000元關卡，並直逼上市新高價，且台積電、鴻海及美律 (2439) 走高，帶動台股指數止穩，守住10300點，多空在月線附近激戰，截至11點25分為止，加權股價指數為10307.26點，上漲10.01點，成交量為491.73億元；OTC指數為134.37點，上漲0.2點，成交量為133.03億元。,0
2017-07-18T03:58:00.000Z,"美國5月新屋中間價(未經季節性因素調整)年增16.8%(月增11.5%)至345,800美元、創1963年開始統計以來最高紀錄，年增率創2015年9月以來新高、月增率則是創下2014年10月以來新高。",4
2017-07-21T03:45:00.000Z,根據過往數據顯示，每當台股年線乖離率超過11%，短期修正率將會提高，如2017年6月26日(11.20%)、2014年7月15日(11.57%)、2013年5月21日(10.56%)，都有一波修正走勢。,0
2017-07-27T07:05:00.000Z,傳產股方面，油電燃氣、水泥、造紙、塑膠、紡織、橡膠與汽車股同步大漲逾1%，鋼鐵股因鋼價漲聲四起，中鋼 (2002) 、中鴻 (2014) 、燁輝 (2023) 、第一銅 (2009) 火力全開。,2
