PublishDate,Sentence,Score
2018-08-03T07:10:00.000Z,被動元件族群上演多空對決，國巨 (2327) 7月獲利篤定逾1個股本，並重申景氣無虞，股價終見止跌回穩，激勵光頡 (3624) 、奇力新 (2456) 、大毅 (2478) 、信昌電 (6173) 、日電貿 (3090) 強勢反彈，禾伸堂 (3026) 、華新科 (2492) 則弱勢收黑。,1
2018-08-03T07:10:00.000Z,被動元件族群上演多空對決，國巨 (2327) 7月獲利篤定逾1個股本，並重申景氣無虞，股價終見止跌回穩，激勵光頡 (3624) 、奇力新 (2456) 、大毅 (2478) 、信昌電 (6173) 、日電貿 (3090) 強勢反彈，禾伸堂 (3026) 、華新科 (2492) 則弱勢收黑。,1
2018-08-14T07:15:00.000Z,美中貿易戰僵持，周一美股三大指數漲跌互見，台股昨日跌破年線支撐後，今日在電子權值股台積電 (2330) 領軍上攻，加上水泥、食品及鋼鐵等傳產股攜手點火，帶動指數順利收復年線，並站上10800點關卡，盤中受到指標股國巨 (2327) 向上拉抬，帶動被動元件族群大毅 (2478) 、禾伸堂 (3026) 、日電貿 (3090) 聯手反彈，以及金融股翻揚激勵下，使指數一路向上走高，終場加權指數上漲75.31點為10824.23點，成交值為1355.97億元。,8
2018-08-14T07:15:00.000Z,　盤面上，蘋果三劍客台積電 (2330) 今日扮演多頭先鋒，領漲台股收復年線失土，股王大立光震盪收平，鴻海 (2317) 受到Q2財報利空衝擊下殺近3%；被動元件股龍頭國巨 (2327) 午盤過後人氣回籠急拉大漲6%，帶動大毅 (2478) 、禾伸堂 (3026) 、日電貿 (3090) 、信昌電 (6173) 等強勢反彈。,4
2018-08-27T07:09:00.000Z,而挑戰股后成功的國巨開高走高，也激勵類股包括華新科、禾伸堂、信昌電 (6173) 、立敦 (6175) 、大毅 (2478) 、智寶 (2375) 、日電貿 (3090) 、鈞寶 (6155) 與立隆 (2472) 等多大漲。,6
