PublishDate,Sentence,Score
2017-12-12T07:04:00.000Z,中華民國工商協進會今天上午於台北花園酒店召開工商早餐會，由行政院長賴清德與工商協進會理事長林伯豐共同主持，共8位首長、10位副主委及次長出席，與國內20幾位企業界代表面對面溝通，出席者包含台積電 (2330) 董事長張忠謀、台灣大董事長蔡明忠、王道銀行董事長駱錦明、義美食品董事長高志尚及新光金控董事長吳東進等。,0
2017-12-12T04:40:00.000Z,中華民國工商協進會今天上午於台北花園酒店召開工商早餐會，由行政院長賴清德與工商協進會理事長林伯豐共同主持，包含財經首長及重要內閣，共8位首長、10位副主委及次長出席，與國內20幾位企業界代表面對面溝通，出席者包含台積電 (2330) 董事長張忠謀、台灣大 (3045) 董事長蔡明忠、王道銀行 (2897) 董事長駱錦明、義美食品董事長高志尚及新光金控 (2888) 董事長吳東進等。,1
2017-12-14T05:22:00.000Z,蘋果季報顯示，2017年度第4季美洲營收年增14%(季增13%)至230.99億美元、高居各市場之冠，遙遙領先排名第二的歐洲(130.09億美元)以及排名第三的大中華地區(98.01億美元)。,4
2017-12-22T07:10:00.000Z,　蘋果三天王大立光 (3008) 、台積電 (2330) 、鴻海 (2317) 今日同步收高，帶領台股重返月線之上，觸控面板廠TPK-KY (3673) 、GIS-KY (6456) 雙雙走跌較為弱勢；其餘權值股表現方面，台達電 (2308) 、中華電 (2412) 、聯發科 (2454) 同步走揚，宏碁 (2353) 今年來毛利率守穩10%以上、登上近13年來新高，營運轉型站穩腳步，激勵股價爆量鎖漲停，宏達電 (2498) 受到VR一體機市場明年上看150萬台鼓舞，股價聞訊大漲4%。,9
2017-12-25T07:12:00.000Z,外資放長假，台北股市持續橫盤震盪，權值股多無明顯表現，台積電 (2330) 、中華電 (2412) 力守平盤；鴻海 (2317) 、國泰金 (2882) 、富邦金 (2881) 與聯發科 (2454) 等則多小跌整理；台塑四寶除台塑化 (6506) 平盤作收外，另外三寶台塑 (1301) 、南亞 (1303) 與台化 (1326) 小漲作收。,2
