PublishDate,Sentence,Score
2017-01-19T08:01:00.000Z,根據麥肯錫全球研究院(MGI)最新發布的報告，當前許多國家正面臨生產力成長率疲弱不振、人口結構老化等問題，機器人、人工智慧(AI)以及機器學習的普及化可望提振全球經濟表現。,2
2017-01-19T08:01:00.000Z,MGI預估，2015-2065年期間自動化將可令全球生產力成長率平均年增0.8-1.4%。,4
2017-01-23T11:21:00.000Z,（中央社台北2017年1月23日電）記憶體封測廠力成 (6239) 董事長蔡篤恭表示，支持一例一休，但期盼政府可放寬加班時數上限。,1
2017-01-23T11:21:00.000Z,他並表示，紫光入股案破局沒有影響力成，雙方仍有合作意願。,0
2017-01-23T11:21:00.000Z,力成下午舉辦法說會，對於一例一休與紫光案破局，蔡篤恭表示最新看法。,0
2017-01-23T11:21:00.000Z,談到一例一休，蔡篤恭表示，力成與產業界都支持修訂勞基法，但期盼政府可放寬加班時數上限到50小時至60小時，以提高半導體產業對於員工加班時數安排的彈性。,2
2017-01-23T11:21:00.000Z,蔡篤恭說，一例一休法令通過，力成每月薪資成本將增加新台幣3000萬元，但力成樂見員工可以享受薪資增加的成果。,4
2017-01-23T11:21:00.000Z,談到紫光入股案破局，蔡篤恭表示，中國大陸是重要市場，力成對合作仍抱開放態度，雙方仍有繼續合作的意願，目前還沒有規劃，紫光入股未成，對力成沒有影響。,3
