PublishDate,Sentence
2017-03-28T07:01:00.000Z,台境 (8476) 上櫃初登場蜜月行情剽悍，受惠獲利成長動能強勁，激勵多頭士氣如虹，帶動股價狂飆4成。
2017-03-28T02:55:00.000Z,  盤面上，台境 (8476) 今日以每股40元上櫃，多頭挾著新化廠取得S類代碼，有助公司擴大接單，獲利成長動能強勁，多頭士氣如虹，晨盤股價最高衝至60元，大漲50%，蜜月行情十分強悍。
2019-08-26T06:33:00.000Z,大陸及美國在上週五加大互祭關稅力道，不僅加稅的產業擴大至美國汽車零組件等，加稅的幅度也擴大，上週五美股應聲倒地，亞股及台股未開盤就「綠雲」罩頂，今天台股一開盤就跳空下挫，蘋果主要供應商—大立光 (3008) 、台積電 (2330) 成為法人減碼標的，近期內資強力拉抬的散熱也遭逢獲利了結賣壓，泰碩 (3338) 、雙鴻 (3324) 等個股股價股價走弱，僅有環天科 (3499) 、淳紳 (4529) 、台境 (8476) 、天蔥 (2740) 及凱崴 (5498) 等少數銅板股個股逆勢以漲停板作收。
2021-12-07T08:31:08.000Z,榮福總經理張耿榕表示，已與台境企業簽訂契約，進軍土壤污染整治，參與高雄煉油廠轉型計劃，也就是台積電 (2330) 高雄廠土地整治，整體契約金額約新台幣24.9億元。
2022-01-04T01:20:27.000Z,受到美國股市開平走高大漲246點激勵，台北股市今（4）日早盤以跳高125點的強勁走勢開出，延續開紅盤漲勢，早盤漲幅一度擴大至200點，最高點位來到18476點再創歷史新高，台積電（2330）則受惠ADR狂漲7％激勵，跳空大漲17元，股價最高來到649元，持續挑戰前高；操盤人表示，短線操作留意指數高檔震盪即將加劇，著墨技術面偏多標的，避開機構法人開始調節的族群與技術面轉弱標的。
