PublishDate,Sentence
2019-12-30T07:18:00.000Z,上週外資買超112.2754億元，投信賣超15.8793億元，自營商買超31.1419億元，三大法人買超127.53億元。
2020-01-30T06:59:22.000Z,今日，收盤跌696.97點，指數11421.74點，成交值2754.15億元。
2020-01-30T06:59:00.000Z,今日，收盤跌696.97點，指數11421.74點，成交值2754.15億元。
2020-01-30T06:29:00.000Z,台股受到武漢肺炎疫情影響，加上春節期間國際指數下跌，鼠年開盤日跟進補跌，指數開低走低，跌幅一路擴大，終場以11421.74點作收，下跌696.97點，跌幅5.75％，成交金額2754.15億元。
2020-01-30T06:29:00.000Z,　恐慌性賣壓今天一開盤立刻宣洩，盤中毫無止跌跡象，鴻海 (2317) 盤中跌停，引爆電子股進一步下殺，台積電 (2330) 收在當日最低，跌幅4.95％，而類股跌幅超過7％包括水泥、玻陶、汽車、觀光、光電、電子零件、其他電子等類股，導致台股跌點將近700點，今天集中市場量能亦爆出2754億元，是2007年7月27日以來最大量。
2020-03-10T08:07:32.000Z,2020年受惠中美貿易戰和緩，新年第二天(1月3日)台股即衝上萬二、12197.64寫下波段高點，但在金鼠年開紅盤(1月30日)，因新冠肺炎攪局，終場大跌696.97點，量能更爆出2754億元，為2007年7月27日來最大量。
