PublishDate,Sentence
2021-08-23T07:40:00.000Z,"台積電美國新廠位於美西的亞利桑那州鳳凰城，預計斥資120億美元(約新台幣3,360億元)興建，現正進行建廠工程，將於2024年量產。"
2021-08-23T03:13:11.000Z,而根據最新預估，以台積電2021年至2023年資本支出約1000億美元推算，預估到2024年就可能營收翻倍，可能較原先預估時間提早一年。
2021-08-25T05:38:35.000Z,此外，英特爾已成為台積電第一大客戶，未來還會有包括蘋果等其他重量級客戶，即台積電3奈米幾乎會囊括全球多數客戶訂單；且台積電2奈米製程預計2024年如期進入量產計畫，可看出台積電目前在整體技術藍圖可實現性高於三星和英特爾，評估台積電仍會穩坐全球晶圓代工龍頭地位。
2021-08-27T00:24:36.000Z,新建廠房目標在2024年投產，將生產用於影像感應器及車用的晶片。
2021-09-13T03:03:13.000Z,此外，傳晶圓代工龍頭台積電初步規劃赴高雄建2座12吋晶圓廠，第一期晶圓廠完工時間為2024年，第二期預計在2025年後完工。
2021-09-13T00:32:24.000Z, 假若此案可順利成行，台積電可望興建二座廠區，預計分兩期，第一期是月產四萬片，以先進製程中的7奈米和6奈米為主，完工時間為2024年，2025年量產，第二期則是月產能僅二萬片，主要受限於土地面積限制，以建置22與28奈米成熟製程為主。
2021-09-12T23:42:13.000Z,若投資計畫確認，第一期晶圓廠完工時間為2024年，2025年才會進入量產。
2021-09-12T23:42:13.000Z,中油高雄煉油廠於2015年底關廠，整治廠址面積169.5公頃，高雄市政府希望爭取台積電落腳高雄，土壤整治期程縮短到2023年完成，台積電著手進行投資規畫，將在土壤整治結束後才會啟動建廠，預計在當地興建2座12吋晶圓廠，第一期月產能4萬片的7奈米及6奈米晶圓廠將在2024年完工、2025年後進入量產，第二期月產能2萬片的28奈米及22奈米晶圓廠將會在2025年後完工。
2021-10-13T01:42:00.000Z,該座半導體新工廠目標在2024年度開始生產汽車、工業機器人所不可或缺的2X奈米(nm)運算用晶片產品。
2021-10-14T11:51:17.000Z,台積電目前已獲客戶和日本政府強力承諾支持，預計2022年開始建廠，2024年底量產，初步規劃以22奈米及28奈米製程技術製造。
2021-10-14T08:52:00.000Z,該廠將採用22/28奈米技術進行晶圓製造，預計2022年開始建造，並於2024年底量產。
2021-10-14T07:25:54.000Z,台積電(2330)於上季法說會表示日本晶圓廠處於盡職調查階段，今日法說會正式拍板決定赴日本投資設立晶圓製造廠，預計2022年開始建廠，初步規劃將於2024年量產，以22奈米至28奈米特殊製程為主。
2021-10-14T07:25:54.000Z,日本晶圓廠預計2022年啟動建廠計畫，將於2024年量產。
2021-10-15T05:29:00.000Z,該座新廠將採用22/28奈米技術進行晶圓製造，預計2022年開始建造，並於2024年底量產。
2021-10-15T05:29:00.000Z,"該座半導體新工廠將位於Sony影像感測器工廠附近、將招聘2,000名員工，目標在2024年度開始生產汽車、工業機器人所不可或缺的2X奈米(nm)運算用(邏輯)晶片產品。"
2021-10-15T01:45:35.000Z,另外，台積電正式拍板決定赴日本投資設立晶圓製造廠，預計2022年開始建廠，初步規畫以22奈米至28奈米特殊製程為主，將於2024年量產。
2021-10-16T01:40:00.000Z,"台積電14日宣布將在日本建立一座特殊製程晶圓廠，專注成熟及特殊製程如22/28奈米製程，2022年建廠，最快2024年量產，台積電今年資本支出300億美元，已經明顯激勵設備廠營運創高，未來三年將投資1,000億美元，市場更預期不排除再上調。"
2021-10-18T05:46:00.000Z,"該廠將採用台積電最先進5奈米製程，定於2024年開始量產，月產能約20,000片。"
2021-10-17T23:10:00.000Z,該座新廠將採用22/28奈米(nm)技術進行晶圓製造，預計2022年開始建造，並於2024年底量產。
2021-10-17T23:10:00.000Z,"該座半導體新工廠將位於Sony影像感測器工廠附近、將招聘2,000名員工，目標在2024年度開始生產汽車、工業機器人所不可或缺的2X奈米(nm)運算用(邏輯)晶片產品。"
2021-10-20T03:31:21.000Z,產業分析師表示，台積電在全球設廠的動作上，已經採取相當謹慎的評估，但因興建晶圓廠需要相當的技術與資本累積，從建廠到投產至少需要二年時間，以美、日、德等投資案明朗期程約2022年起算，正式投產約在2024年左右，廠房興建期間，剛好碰到進入全球通膨循環，雖然開發中國家如新加坡、韓國、紐西蘭等國已率先採取升息，已開發國家歐美日尚未有調高利息動作，但通膨壓力已經蠢蠢欲動，建廠資本支出勢必伴隨通膨攀升，將會是台積電獲利上的一個隱憂。
2021-10-21T07:59:00.000Z,由鴻海永齡、台積電、慈濟共同捐贈的BNT疫苗已陸續抵台，鴻海創辦人郭台銘先前也在臉書發文表示，自己已完成階段性任務了；隨著郭董退出幕前，外界相當關切郭台銘的下一步規劃，不少人猜測可能出馬競選2024年總統大選，而民眾黨立委蔡壁如談及「柯郭配」一事，也在政壇引起話題。
2021-10-21T07:59:00.000Z,」另外，黃光芹詢問，聽說當時郭台銘與蔡英文見面時，曾有人要求郭台銘簽署不選2024總統的聲明；劉宥彤回應，因為她並沒有實際參與，「不能證實有沒有這份東西，也不曉得是什麼」，但她相信不會有人會逼郭台銘的，且如果真的有這份聲明，「那也會是郭董真心誠意希望這個(承諾不選總統)不會形成採購疫苗的阻礙。
2021-10-24T23:39:24.000Z,雖然全球半導體廠均拉高資本支出擴充產能，但設備交期大幅拉長到9個月以上，導致2021～2022年的產能擴增幅度有限，在預期晶片缺貨問題恐延續到2023～2024年的情況下，台積電在與客戶洽談2022年新合約時決定調漲晶圓代工價格，成熟製程價格調漲15～20％，先進製程價格調漲約10％，2022年的晶圓出貨開始適用新價格。
2021-10-28T09:27:51.000Z,台積電 (2330) 本月14日正式拍板決定赴日本投資設立晶圓製造廠，預計2022年開始建廠，初步規劃以22奈米至28奈米特殊製程為主，將於2024年量產。
2021-10-27T23:09:00.000Z,該座新廠將採用22/28奈米(nm)技術進行晶圓製造，預計2022年開始建造，並於2024年底量產。
2021-10-29T00:13:20.000Z,台積電在10月初曾透露將在日本興建一座晶片廠的計畫，預計明年動工，最快在2024年底前開始量產。
2021-10-28T23:36:15.000Z, 台積電本月稍早曾表示，它將在日本建立一個製造工廠，預計將從2024年年底開始生產主要用於汽車的半導體。
2021-10-28T22:44:00.000Z,該座新廠將採用22/28奈米(nm)技術進行晶圓製造，預計2022年開始建造，並於2024年底量產。
2021-10-30T01:14:43.000Z,隨著半導體製程將於2024年進入埃米時代，台積電的建廠動向受到業界及市場矚目，市場傳出台積電下一座先進製程晶圓廠可望落腳台中，現在中科Fab 15廠旁的興農高爾夫球場及軍方用地已納入考慮，台積電若取得用地，將用於建置2奈米以下先進製程的超大型晶圓廠區，並分為第一期到第四期建廠計畫，等於會在當地興建4座12吋晶圓廠。
2021-10-30T01:14:43.000Z,台積電Fab 20廠區將分為第一期到第四期、共興建4座12吋晶圓廠，預計2024年下半年進入量產。
2021-11-01T00:43:10.000Z,  共同社報導，台積電新工廠預計將於2024年投產，正考慮在索尼子公司位於熊本縣菊陽町的工廠旁興建，豐田汽車集團的零部件巨頭電裝公司(Denso)也考慮參與。
2021-11-03T08:22:24.000Z,（中央社記者潘智義台北2021年11月3日電）李長榮化學工業總經理劉文龍今天表示，在美國亞利桑那州、台灣中部科學園區分別新建電子級異丙醇產線，均為年產能3萬噸，也都預計2024年量產。
2021-11-03T08:22:24.000Z,榮化規劃，亞利桑那州的的電子級異丙醇廠投資1億美元，預計2024年第1季試量產，當年度產能即可正式開出；中科廠投資新台幣19億元，因收購日本光學液晶材料大廠JSR株式會社旗下台灣捷時雅邁科公司的台灣中科工廠資產，需要交接時間，明年才動工蓋電子級異丙醇廠，但量產時間一樣在2024年。
2021-11-03T23:51:29.000Z,晶圓代工龍頭台積電在美國亞利桑那州設立的5奈米12吋晶圓廠已進入建廠階段，預計2024年開始量產。
2021-11-03T23:51:29.000Z,台積電2020年5月宣布將於美國亞利桑那州興建且營運一座5奈米12吋晶圓廠，該晶圓廠將於2021年動工，於2024年開始量產，規畫月產能為2萬片晶圓。
2021-10-30T01:14:43.000Z,隨著半導體製程將於2024年進入埃米時代，台積電的建廠動向受到業界及市場矚目，市場傳出台積電下一座先進製程晶圓廠可望落腳台中，現在中科Fab 15廠旁的興農高爾夫球場及軍方用地已納入考慮，台積電若取得用地，將用於建置2奈米以下先進製程的超大型晶圓廠區，並分為第一期到第四期建廠計畫，等於會在當地興建4座12吋晶圓廠。
2021-10-30T01:14:43.000Z,台積電Fab 20廠區將分為第一期到第四期、共興建4座12吋晶圓廠，預計2024年下半年進入量產。
2021-10-29T00:13:20.000Z,台積電在10月初曾透露將在日本興建一座晶片廠的計畫，預計明年動工，最快在2024年底前開始量產。
2021-10-28T23:36:15.000Z, 台積電本月稍早曾表示，它將在日本建立一個製造工廠，預計將從2024年年底開始生產主要用於汽車的半導體。
2021-10-28T22:44:00.000Z,該座新廠將採用22/28奈米(nm)技術進行晶圓製造，預計2022年開始建造，並於2024年底量產。
2021-11-01T00:43:10.000Z,  共同社報導，台積電新工廠預計將於2024年投產，正考慮在索尼子公司位於熊本縣菊陽町的工廠旁興建，豐田汽車集團的零部件巨頭電裝公司(Denso)也考慮參與。
2021-11-03T08:22:24.000Z,（中央社記者潘智義台北2021年11月3日電）李長榮化學工業總經理劉文龍今天表示，在美國亞利桑那州、台灣中部科學園區分別新建電子級異丙醇產線，均為年產能3萬噸，也都預計2024年量產。
2021-11-03T08:22:24.000Z,榮化規劃，亞利桑那州的的電子級異丙醇廠投資1億美元，預計2024年第1季試量產，當年度產能即可正式開出；中科廠投資新台幣19億元，因收購日本光學液晶材料大廠JSR株式會社旗下台灣捷時雅邁科公司的台灣中科工廠資產，需要交接時間，明年才動工蓋電子級異丙醇廠，但量產時間一樣在2024年。
2021-11-03T23:51:29.000Z,晶圓代工龍頭台積電在美國亞利桑那州設立的5奈米12吋晶圓廠已進入建廠階段，預計2024年開始量產。
2021-11-03T23:51:29.000Z,台積電2020年5月宣布將於美國亞利桑那州興建且營運一座5奈米12吋晶圓廠，該晶圓廠將於2021年動工，於2024年開始量產，規畫月產能為2萬片晶圓。
2021-11-08T04:39:42.000Z,台積電熊本廠將於2022年開始興建，2024年進入量產，主要提供22奈米至28奈米技術生產晶片。
2021-11-08T01:56:50.000Z,若一切順利，這座新晶圓廠將在2024投入生產行列。
2021-11-07T23:34:32.000Z, 熊本工廠預計將為汽車、相機圖像傳感器和其他受全球晶片短缺影響的產品生產半導體，並可能在2024年投產。
2021-11-09T13:18:37.000Z,（中央社記者張建中新竹2021年11月9日電）晶圓代工廠台積電 (2330) 今天正式決議確定在高雄設立晶圓廠，規劃於中油高雄煉油廠舊址建造，預計2022年動工，2024年開始量產。
2021-11-09T13:18:37.000Z,台積電赴高雄投資設廠傳言成真，台積電今天表示，因應市場需求，已決議將於高雄設立生產7奈米及28奈米製程的晶圓廠，預計於2022年開始動工，並於2024年開始量產。
2021-11-09T03:25:00.000Z,據了解，除蘋果、Intel排入N3合作名單，繪圖晶片大廠NVIDIA下世代GPU將回歸5奈米製程，後續也將導入N3製程；AMD(超微)已向台積電預定N5、N3家族產能，推估將在2023~2024間採用N3E量產Zen 5架構處理器，顯示HPC客戶將持續擔綱台積電種要成長動能。
2021-11-10T09:11:00.000Z,台灣房屋集團趨勢中心執行長張旭嵐表示，台積電是台灣產業發展指標，不僅扮演產業推手，落腳之處也成為房市向上發展的風向球，如今確定設廠，無疑是讓高雄房市發展吃下一顆定心丸，預計在2024年員工正式進駐前，房價不排除再迎來1到2成的增幅。
2021-11-10T08:23:29.000Z,台積電預計2022年動工、2024年量產，高雄市長陳其邁今天在市議會受訪表示，將在明年中交地，且高雄電力供應無虞，水的部分，今年在旱災最嚴重時，高雄是最快翻轉水情的城市。
2021-11-10T08:22:00.000Z,台積電昨（9）日拋出震撼彈，宣布將赴高雄設置7奈米及28奈米製程晶圓廠，預計於明（2022）動工、2024年量產，一改先前對「不承認也不否認」的低調態度，消息一出，立刻引爆話題，有內行人更指出，雖然台積電有機會拉高整體高雄薪資水平，但恐怕會對日月光徵才造成影響。
2021-11-10T08:22:00.000Z,（示意圖／翻攝自台積電官網）不少網友則認為，台積電赴高雄設廠，除了當地房價會受到影響，也可望提升當地平均薪資，不過在人才招募上，恐排擠封測大廠日月光，直言「有GG（台積電）誰還會去神教（日月光）」、「當地多少工程師準備跳槽了，不過2024才上線」、「神教頂尖的人才一定會跳的，多少有影響吧」、「會挖產品跟品管吧，製程設備應該不會」、「日月光慘了，好人才要被搶光」、「我看不用挖，自己跑去面試的比較多」。
2021-11-10T06:31:23.000Z,張旭嵐說，過去產業園區促進區域不動產發展的案例頗多，包括內科點燃了內湖和大直房市和商辦市場，竹科帶旺竹北成為新天龍國，都在在凸顯了科園新貴對房市和商圈的帶動作用，因此在台積電有意設廠之際，不少置產族群，就率先嗅到了楠梓、橋頭等地未來的租賃和購屋買氣，早早出手卡位，如今拍板敲定，在2024年員工正式進駐生產之際，房價不排除再迎來一到兩成的增幅。
2021-11-10T06:03:15.000Z,晶圓代工廠台積電昨天正式宣布，將在高雄設立晶圓廠，規劃於中油高雄煉油廠舊址建造，預計2022年動工，2024年開始量產。
2021-11-10T06:03:15.000Z,台積電拍板赴高雄設廠，在2024年員工正式進駐生產之際，房價不排除再迎來1到2成增幅，高雄房市價量表現仍以市場需求為支撐，只要區域地段佳、機能優多能獲得置產族懷抱。
2021-11-11T09:57:21.000Z,為因應美國客戶需求，台積電已決定前往美國亞利桑那州投資興建5奈米晶圓廠，目前依計畫進行，預計2022年下半年移入機台，第一期廠房將於2024年第1季開始生產，月產能2萬片。
2021-11-11T08:56:00.000Z,台積電楠梓新廠預計2022年動工，2024年投產，周邊商圈房市也晉升「積動股」，根據中信房屋分析，今年以來高雄建物買賣移轉棟數各月交易表現除了農曆春節及疫情嚴峻期間的兩個月外，均較去年為佳，累計移轉棟數亦呈現正成長格局，年增率僅次於台南。
2021-11-11T06:34:04.000Z,由於台積電日前宣布將落腳高雄，在中油煉油廠舊址建造7奈米與28奈米晶圓廠，預計明年動工、2024年量產，民進黨立委賴瑞隆認為，對高雄市產業轉型邁出重要一步，並詢問王美花看法。
2021-11-11T06:15:34.000Z,高雄即將發大財？台積電日前正式宣布，將於楠梓的中油煉油廠設立新廠，預計2022年動工，2024年投產，使高雄新廠周邊商圈晉升房市「積動股」！
2021-11-11T00:39:37.000Z,台股指標台積電股價已連4日穩坐600元大關，帶動電子族群人氣回籠，近期相關消息頻傳，包括日前終於證實，將在高雄設立生產7奈米、28奈米製程的晶圓廠，預計2022年動工、2024年量產。
2021-11-11T00:22:09.000Z,台灣房屋集團趨勢中心執行長張旭嵐表示，台積電是台灣產業發展指標，護國神山不但扮演產業推手，其落腳之處，往往也成為房市向上發展的風向球，依照往年產業園區、科技園區帶動區內房價的經驗，預期台積電2024年員工正式進駐生產之際，房價不排除再迎來一～二成的增幅。
2021-11-16T05:48:00.000Z,"據調查公司Research and Markets指出，2024年CDMO市場規模預估將擴大至2,410億美元、將較2020年增加約5成。"
2021-11-16T05:48:00.000Z,"富士軟片目前已和多家大型製藥公司進行商談，目標在2024年度將CDMO事業營收提高至2,000億日圓、將達2020年度的約2倍水準，且之後的目標是以年成長20%的速度呈現增長。"
2021-11-15T23:13:00.000Z,該座新廠將在2022年開始興建、2024年底之前開始進行生產，月產能為4.5萬片(以12吋晶圓換算)。
2021-11-17T02:46:00.000Z,該座新廠將在2022年開始興建、2024年底之前開始進行生產，月產能為4.5萬片(以12吋晶圓換算)。
2021-11-21T02:53:09.000Z,以成熟製程為主的車用半導體短缺狀況也未緩解，資策會產業情報研究所（MIC）資深產業分析師何心宇預估，車用晶片缺貨狀況將持續到明年、部分車廠更悲觀預期延續到2024年。
2021-11-24T08:50:51.000Z,高通在上周發布業績後表示，公司對大客戶蘋果提高晶片自產率已有準備，預期當2023年版的iPhone手機推出時，高通只會供應蘋果20%的數據機晶片，而到了2024財年底，蘋果占高通的數據機晶片銷售比率將下滑至「低個位數」。
2021-11-24T03:14:00.000Z,究竟，目前業界是如何看待兩強競爭?又有什麼觀察重點呢?傳三星斥資170億美金 擬在美設3奈米廠根據多家外媒報導，三星將投資170億美金、選在德州泰勒市(Taylor)作為美國第二座晶圓廠的設廠地點，且已獲得當地政府高額補貼的承諾，目標2024年量產。
2021-11-23T23:51:17.000Z,"半導體晶圓廠資本支出外溢效應發酵，外資相繼調升台積電2021～2023年合計資本支出預估達1,080至1,120億美元後，凱基投顧指出，矽晶圓供需吃緊，漲價趨勢至少延續到2024年，新一輪新建矽晶圓產能已然展開，矽晶圓產業蓄勢待發，進入為期三年以上的超級週期，看好台廠環球晶、中美晶、合晶受惠最深，初評「買進」，股價預期分別是1,000、299及90元。"
2021-11-23T23:51:17.000Z,此外，2022年到2024年全球矽晶圓產業的12吋價格將連續三年攀升，累積漲幅保守看三成，最高達五成；其中2022年時12吋、8吋將調漲一至二成及5～15％，推升漲價主要為供需景俏及反應生產成本，凱基投顧認為12吋矽晶圓2022年到2023年的供需缺口2.2％、4.9％。
2021-11-26T04:46:00.000Z,（圖／AP）與台積電在亞利桑那州興建的5奈米晶圓廠相同，這兩座晶圓廠都預期在2024年量產，而從金額來看，台積電專案投資金額落在120億美元，較三星減少50億。
2021-11-30T23:39:10.000Z,法人預期台積電2023年及2024年營收將受惠於3奈米產能逐步開出而續創新高紀錄。
2021-12-02T00:20:00.000Z,據報導，台積電熊本工廠計畫2022年動工、2024年底之前開始進行生產，而該建廠時間表和NAND Flash廠鎧俠(Kioxia)、DRAM廠美光(Micron)的新工廠計畫的時間相重疊，屆時勢將掀起人才爭奪大戰，加上Omicron變種病毒擴散、各國加強行動管制，而此也恐對台積電熊本工廠徵才造成影響。
2021-12-03T06:54:00.000Z,同時劉德音也透露，目前美國亞利桑那州廠按照進度進行，預計於2022年下半年移入機台，2024年Q1量產，第一期月產2萬片，以5奈米為主，指出基辛格的一番話，不影響台積電在美投資。
2021-12-03T06:33:28.000Z,台積電在美國亞利桑那州的5奈米十二吋晶圓廠，今年開工興建，預計2024年開始進入量產，第一期月產能可達二萬片。
2021-12-03T06:27:04.000Z,依據台積電先前說明，台積電美國亞利桑那晶圓廠已經動工，計畫2022年下半年移入機台，第一期廠房預計2024年量產，5奈米月產能2萬片。
2021-12-03T06:07:49.000Z,據台積電規劃，亞利桑那州廠將於2022年下半年移入機台，2024年第1季量產，第一期月產2萬片，以5奈米為主。
2021-12-03T06:07:49.000Z,台積電日本廠預計2022年開始建廠，2024年底量產，以22奈米及28奈米特殊製程為主。
2021-12-04T02:42:35.000Z,劉德音表示，台積電在美設5奈米12吋廠，不會受英特爾執行長基辛格說法影響，台積電將於2022年下半年移入機台，2024年第一季量產，第一期月產能達2萬片。
2021-11-30T23:39:10.000Z,法人預期台積電2023年及2024年營收將受惠於3奈米產能逐步開出而續創新高紀錄。
2021-12-02T00:20:00.000Z,據報導，台積電熊本工廠計畫2022年動工、2024年底之前開始進行生產，而該建廠時間表和NAND Flash廠鎧俠(Kioxia)、DRAM廠美光(Micron)的新工廠計畫的時間相重疊，屆時勢將掀起人才爭奪大戰，加上Omicron變種病毒擴散、各國加強行動管制，而此也恐對台積電熊本工廠徵才造成影響。
2021-12-03T06:54:00.000Z,同時劉德音也透露，目前美國亞利桑那州廠按照進度進行，預計於2022年下半年移入機台，2024年Q1量產，第一期月產2萬片，以5奈米為主，指出基辛格的一番話，不影響台積電在美投資。
2021-12-03T06:33:28.000Z,台積電在美國亞利桑那州的5奈米十二吋晶圓廠，今年開工興建，預計2024年開始進入量產，第一期月產能可達二萬片。
2021-12-03T06:27:04.000Z,依據台積電先前說明，台積電美國亞利桑那晶圓廠已經動工，計畫2022年下半年移入機台，第一期廠房預計2024年量產，5奈米月產能2萬片。
2021-12-03T06:07:49.000Z,據台積電規劃，亞利桑那州廠將於2022年下半年移入機台，2024年第1季量產，第一期月產2萬片，以5奈米為主。
2021-12-03T06:07:49.000Z,台積電日本廠預計2022年開始建廠，2024年底量產，以22奈米及28奈米特殊製程為主。
2021-12-04T02:42:35.000Z,劉德音表示，台積電在美設5奈米12吋廠，不會受英特爾執行長基辛格說法影響，台積電將於2022年下半年移入機台，2024年第一季量產，第一期月產能達2萬片。
2021-12-06T08:56:25.000Z,台積電的熊本廠預計2022年開始建廠、2024年量產，可望獲該基金補助一半資金約4000億日圓。
2021-12-07T01:52:54.000Z,整體而言，台積電不僅5與3奈米製程市占率保持高昂，7奈米製程家族供應更是相當吃緊，必須在2023～2024年擴建更多產能。
2021-12-09T05:21:00.000Z,不只如此，小摩相信，超微可能會在2023年或2024年再度跟三星合作，生產3奈米GPU。
2021-12-09T05:21:00.000Z,報告指出，台積電有望在2022年、2023年及2024年跟高通敲定半導體代工合約。
2021-12-09T03:02:00.000Z,JX金屬指出，將投資約140億日圓興建濺鍍靶材新工廠、預計2023年度下半年(2024年3月底前)開始進行生產，藉此將濺鍍靶材產能較現行(和2020年度相比)擴增80%；壓延銅箔新廠投資額為160億日圓、預計2024年度上半年(2024年9月底前)開始進行生產，藉此將壓延銅箔產能較現行提高25%。
2021-12-09T03:02:00.000Z,該座新廠將在2022年開始興建、2024年底之前開始進行生產，月產能為4.5萬片(以12吋晶圓換算)。
2021-12-10T00:52:05.000Z,高雄捷運岡山路竹延伸線的「岡山車站」RK1標機電系統統包工程9日簽約，副市長林欽榮代表府方出席時直言「趕快啟動，否則對不起台積電」；RK1預計2024年中可先通車營運，將帶動北高雄產業廊帶7.5萬的就業與進駐人口。
2021-12-10T00:52:05.000Z,捷運局表示，「岡山車站」RK1土建及軌道工程已施工中，此次機電系統標決標後，預計岡山站可在2024年中先行通車營運，第2階段的RK2至RK6的車站則以2027年底為通車營運目標。
2021-12-11T01:22:28.000Z,整體而言，台積電不僅5與3奈米製程市占率保持高昂，7奈米製程家族供應吃緊，必須在2023～2024年擴建更多產能。
2021-12-14T12:34:31.000Z,葉獻文表示，英特爾近來在設計與製造速度落後AMD，季辛格接任後，採取多元化策略，既自己設計製造、也買保險（委外代工），先前的發言，難免讓台積電對這個代工案是否繼續有疑慮，推估季辛格應是想來修正，且敲定台積電3奈米的訂單，預計3奈米應是2024年供貨。
2021-12-14T08:34:46.000Z,葉獻文表示，英特爾執行長季辛格此次來台是要談3奈米委外代工的部分，預估真正的產出要到2024年。
2021-12-15T10:16:10.000Z,保德信大中華投資團隊副總經理葉獻文說，季辛格這次來台，主要是為敲定與台積電3奈米代工合作計畫，台積電應於2024年開始供應3奈米。
