PublishDate,Sentence
2021-02-23T23:12:00.000Z,MoneyDJ新聞 2021-02-24 07:12:01 記者 蔡承啟 報導全球最大晶圓代工廠台積電(2330)去年宣布將在美國亞利桑那州興建先進半導體工廠，預計2021年內動工、2024年開始生產5nm(奈米)製程產品，預估總投資額達120億美元。
2021-03-01T07:01:40.000Z,台積電2奈米初期建廠將維持三座廠的超大型晶圓廠（GigaFab）建置，預計2奈米將於3奈米量產第二年的2023年進入試產，2024年進入量產，屆時台積電2奈米仍會是當時全球最先進的邏輯製程技術。
2021-03-01T07:01:40.000Z,台積電2奈米初期建廠將維持三座廠的超大型晶圓廠（GigaFab）建置，預計2奈米將於3奈米量產第二年的2023年進入試產，2024年進入量產，屆時台積電2奈米仍會是當時全球最先進的邏輯製程技術。
2021-03-04T23:56:17.000Z,台積電2奈米之後的電晶體架構將轉向環繞閘極（GAA）的奈米片（nano-sheet）架構，業界預期2024年應可開始生產，EUV技術已可支援到1奈米。
2021-03-08T03:14:33.000Z,日本媒體指出，這有助製造2奈米以下線寬、規劃應用在2024年後的新一代先進半導體。
2021-03-08T03:14:33.000Z,報導指出，與之前電晶體相比，CFET結構的電晶體性能高、面積小，有助製造2奈米以下線寬的新一代半導體；此次開發的新型電晶體，預計應用在2024年以後的先進半導體。
2021-03-21T23:42:35.000Z,有關台積電在美國設廠進度部份，台積電已啟動在美國亞利桑那州5奈米12吋廠建廠計畫，該廠於2021年動工，於2024年開始量產，規畫月產能為2萬片晶圓，但台積電預期該廠在缺乏足夠的周邊供應商群聚效應情況下，營運成本可能偏高。
2021-03-24T03:37:42.000Z,英特爾執行長季辛格（Pat Gelsinger）宣布一系列發展計畫，將斥資200億美元在美國亞利桑那州新建2座晶圓廠，預計2024年量產7奈米或更先進晶片，並設立代工服務部門，將為其他半導體廠代工製造晶片。
2021-03-24T03:35:00.000Z,intel美國新廠 業界推估月產能約3萬片上下根據英特爾發布的新聞稿，新任執行長格辛格(Pat Gelsinger)週二直播的有幾大重點，首先是公司預計於亞利桑那州斥資近200億美元打造兩座新廠，預計2024年投產，新廠將有能力生產 7 奈米製程。
2021-03-24T03:35:00.000Z,對比台積電已成功量產5奈米 (以電晶體密度來看，台積電5奈米大約等於intel的7奈米)、3奈米預計2022年下半年量產，再加上新廠產能2024年才可以到位，因此intel必須仰賴更多外部產能。
2021-03-26T06:42:37.000Z,從目前製程技術來看，intel英特爾表示7奈米製程技術發展順利，下半年就可進入完成設計(tape in)的階段，但進度仍較預期落後，其3奈米預計2022年下半年量產，再加上新廠產能2024年到位，因此intel必須仰賴更多外部產能。
2021-03-27T01:52:36.000Z,凱基投顧董事長朱晏民分析，美國科技股25日回穩，外資開始回頭買台積電，市場評估，英特爾擬建晶圓廠的衝擊並沒有那麼大，從技術面進程看，英特爾技術落後台積電一個世代、人才也拚不過台積電，這些短期都難以追上，即使有影響，至少也要等到2023～2024年之後，「大家回頭一看，才猛然發現台積電被錯殺了」。
2021-04-13T02:36:12.000Z,台積電亞利桑那州5奈米廠將於今年動工，預計2024年量產，規劃月產能2萬片晶圓，投資金額約120億美元。
2021-04-13T00:49:23.000Z,台積電亞利桑那州5奈米廠將於今年動工，預計2024年量產，規劃月產能2萬片晶圓，投資金額約120億美元，估計將創造超過1600個高科技專業工作機會，並在半導體產業生態系統中間接創造上千個工作機會。
2021-04-15T10:29:29.000Z,有關海外布局，魏哲家表示，美國亞利桑那州5奈米廠將於今年動土建廠，預計2024年量產，將服務全球客戶。
2021-04-19T02:46:45.000Z,此座廠房將採用台積電的N5技術，規劃月產能為2萬片晶圓，預計於2024年開始量產。
2021-04-20T13:30:35.000Z,晶圓代工廠台積電決定赴美國亞利桑那州設立5奈米廠，相關建廠時程，台積電僅對外表示將於今年動土建廠，2024年量產，月產能2萬片。
2021-04-22T05:29:01.000Z,此外，美國亞利桑那州5奈米廠將於今年動土建廠，預計2024年量產，將服務全球客戶。
2021-04-25T04:25:26.000Z,台南仁德再生水廠預計2023年底、2024年初開始供水。
2021-04-27T03:24:08.000Z,晶圓代工廠台積電以台灣為主要生產基地，因應美國製造的趨勢，去年決定赴美國亞利桑那州設立5奈米廠；台積電美國新廠將於今年動土建廠，2024年量產，月產能2萬片。
2021-05-04T08:43:40.000Z,不過，台積電魏哲家於4月法人說明會中曾針對亞利桑那州廠進度提出說明，他說，亞利桑那州廠正按照計畫執行，於今年動工，第一期廠房預計於2024年開始量產5奈米技術，月產能為2萬片。
2021-05-04T08:38:38.000Z,（中央社台北2021年5月4日綜合外電報導）台積電去年宣布，將在美國亞利桑那州興建一座先進晶圓廠，採5奈米製程，預計2021年動工，2024年量產。
2021-05-04T08:38:38.000Z,台積電將在亞利桑那州鳳凰城興建一座12吋晶圓廠，預期2024年開始生產5奈米製程產品，台灣經濟部投資審議委員會已於去年12月審查通過。
2021-05-04T08:43:40.000Z,不過，台積電魏哲家於4月法人說明會中曾針對亞利桑那州廠進度提出說明，他說，亞利桑那州廠正按照計畫執行，於今年動工，第一期廠房預計於2024年開始量產5奈米技術，月產能為2萬片。
2021-05-04T08:38:38.000Z,（中央社台北2021年5月4日綜合外電報導）台積電去年宣布，將在美國亞利桑那州興建一座先進晶圓廠，採5奈米製程，預計2021年動工，2024年量產。
2021-05-04T08:38:38.000Z,台積電將在亞利桑那州鳳凰城興建一座12吋晶圓廠，預期2024年開始生產5奈米製程產品，台灣經濟部投資審議委員會已於去年12月審查通過。
2021-05-04T23:46:09.000Z,魏哲家表示，台積電亞利桑那州晶圓廠按照計畫執行，於今年動工，第一期廠房預計於2024年開始量產5奈米製程，月產能達2萬片。
2021-05-24T03:52:09.000Z,李旭暘預測，到了2024年(全年度)，台積電的股息將增至每股新台幣12元。
2021-05-29T01:55:12.000Z,與Meteor Lake同屬第14代Core處理器的還有將於2024年推出的Lunar Lake，也會將部份小晶片區塊交由台積電代工。
2021-05-30T08:25:15.000Z,在海外投資部分，台積電已宣布在美國亞利桑那州興建和營運一座先進晶圓廠，將採用台積電5奈米技術，規劃月產能為2萬片晶圓，預計於2024年開始量產。
2021-06-02T12:32:01.000Z,較為外界感到意外的是，魏哲家宣布美國亞利桑那州5奈米廠第1期已在興建中，動工時程較市場預期快，不過仍將如期於2024年量產。
2021-06-02T05:55:10.000Z,至於美國亞利桑那州廠第1期正興建中，預計2024年量產。
2021-06-02T03:21:22.000Z,市場甚為關心的台積電(2330)美國廠進度一事，台積電總裁魏哲家今早在自家的年度線上技術論壇中揭露，旗下美國亞歷桑納廠區目前興建中，預計2024年量產，直接導入5奈米製程。
2021-06-02T03:21:22.000Z, 魏哲家也提到，由於預計5奈米需求長期旺盛，自去年量產以來，5奈米出貨量已超過50萬片，台積電將位於亞利桑那州廠晶圓21廠納為5奈米的生產基地之一，目前興建中，預計2024年開始量產。
2021-06-02T02:39:00.000Z,此外，5奈米晶圓21廠在美國亞利桑納州鳳凰城興建中，預計2024年量產。
2021-06-03T08:02:42.000Z, 美系外資指出，處理器(CPU)的3D封裝技術將增加ABF載板產能消耗，今年將看到ABF需求更為強勁；而AT&S最近宣布擴增ABF載板產能資本支出規劃，將砸17億歐元，在東南亞為兩個HPC客戶提供ABF產能，至於新產能預估2024年投產，顯示ABF產業需求趨勢仍看好。
2021-06-03T04:49:00.000Z,這座廠房將照原定計畫，於2024年開始量產採用5奈米製程技術的晶片。
2021-06-03T02:32:16.000Z,此外，台積電美國亞利桑那州5奈米廠開始興建，預計2024年開始量產。
2021-06-03T02:32:16.000Z,台積電美國亞利桑那州廠第1期正興建中，預計2024年量產。
2021-06-02T23:43:14.000Z,至於美國亞利桑那州5奈米晶圓廠已開始興建，2024年以月產能2萬片量產計畫不變。
2021-05-30T08:25:15.000Z,在海外投資部分，台積電已宣布在美國亞利桑那州興建和營運一座先進晶圓廠，將採用台積電5奈米技術，規劃月產能為2萬片晶圓，預計於2024年開始量產。
2021-05-29T01:55:12.000Z,與Meteor Lake同屬第14代Core處理器的還有將於2024年推出的Lunar Lake，也會將部份小晶片區塊交由台積電代工。
2021-06-02T12:32:01.000Z,較為外界感到意外的是，魏哲家宣布美國亞利桑那州5奈米廠第1期已在興建中，動工時程較市場預期快，不過仍將如期於2024年量產。
2021-06-02T05:55:10.000Z,至於美國亞利桑那州廠第1期正興建中，預計2024年量產。
2021-06-02T03:21:22.000Z,市場甚為關心的台積電(2330)美國廠進度一事，台積電總裁魏哲家今早在自家的年度線上技術論壇中揭露，旗下美國亞歷桑納廠區目前興建中，預計2024年量產，直接導入5奈米製程。
2021-06-02T03:21:22.000Z, 魏哲家也提到，由於預計5奈米需求長期旺盛，自去年量產以來，5奈米出貨量已超過50萬片，台積電將位於亞利桑那州廠晶圓21廠納為5奈米的生產基地之一，目前興建中，預計2024年開始量產。
2021-06-02T02:39:00.000Z,此外，5奈米晶圓21廠在美國亞利桑納州鳳凰城興建中，預計2024年量產。
2021-06-03T08:02:42.000Z, 美系外資指出，處理器(CPU)的3D封裝技術將增加ABF載板產能消耗，今年將看到ABF需求更為強勁；而AT&S最近宣布擴增ABF載板產能資本支出規劃，將砸17億歐元，在東南亞為兩個HPC客戶提供ABF產能，至於新產能預估2024年投產，顯示ABF產業需求趨勢仍看好。
2021-06-03T04:49:00.000Z,這座廠房將照原定計畫，於2024年開始量產採用5奈米製程技術的晶片。
2021-06-03T02:32:16.000Z,此外，台積電美國亞利桑那州5奈米廠開始興建，預計2024年開始量產。
2021-06-03T02:32:16.000Z,台積電美國亞利桑那州廠第1期正興建中，預計2024年量產。
2021-06-02T23:43:14.000Z,至於美國亞利桑那州5奈米晶圓廠已開始興建，2024年以月產能2萬片量產計畫不變。
2021-06-11T12:48:42.000Z,台積電目前已在亞利桑那州興建該公司20多年來在美第一座晶片廠，預計2024年量產，生產目前最先進的5奈米晶片，這些晶片用於蘋果公司（Apple）最新一代iPhone和麥金塔（Mac）電腦處理器。
2021-06-13T10:01:02.000Z,在海外布局，台積電已開始在美國亞利桑那州建5奈米廠，預計西元2024年量產、月產能2萬片，並決定在日本茨城縣筑波市設立材料研發中心、預計今年完成，將可加強和日本生態系夥伴在三維晶片（3DIC）材料方面的探索。
2021-06-22T04:15:00.000Z,台積電也展開2奈米製程技術的研發工作，目標是在2024年量產。
2021-06-30T00:35:36.000Z, 而對於增資美國子公司一事，漢唐董事長陳朝水對外揭露，目的是要擴大漢唐在美國半導體市場的布局，並不會侷限在單一特定廠商；台積電的亞利桑那廠區已經開始動工興建，預計2024年量產。
2021-06-30T00:35:36.000Z, 而對於增資美國子公司一事，漢唐董事長陳朝水對外揭露，目的是要擴大漢唐在美國半導體市場的布局，並不會侷限在單一特定廠商；台積電的亞利桑那廠區已經開始動工興建，預計2024年量產。
2021-07-11T08:34:54.000Z,在海外布局，除了南京廠外，台積電已開始在美國亞利桑那州建5奈米廠，預計2024年量產、月產能2萬片，並決定在日本茨城縣筑波市設立材料研發中心、預計今年完成，將可加強和日本生態系夥伴在三維晶片（3DIC）材料方面的探索。
2021-07-11T01:57:48.000Z,至於台積電海外布局，台積電美國亞利桑那州5奈米12吋廠已開始動工，預計2024年量產，後續是否進一步設立先進封測廠，就近提供客戶完整服務，備受關注。
2021-07-13T08:46:00.000Z,台積電、永齡基金會採購BNT疫苗報捷，對此，名嘴黃越綏表示，若郭台銘個人還有意願的話，此舉有望替他先取得2024國民黨總統候選人的最高民調，再戰總統大選。
2021-07-13T08:46:00.000Z,」黃越綏分析，郭台銘先前曾想代表國民黨參選2020總統大選，但當時在黨內初選敗給韓國瑜，捐贈疫苗一舉「無疑可替他先取得2024國民黨總統候選人的最高民調」。
2021-07-15T12:31:21.000Z,劉德音說，亞利桑那州廠已經動工，計劃在2022年下半年移入機台，第一期廠房預計2024年第1季開始以5奈米製程生產，月產能2萬片。
2021-07-15T11:13:19.000Z,第一期廠房2024年第一季開始以5奈米製程生產每月2萬片的晶圓，屆時台積電的5奈米家族依然將是美國最先進的商用量產技術。
2021-07-15T08:23:46.000Z,美國設廠方面，台積電已公布在美國亞利桑那州廠設廠，目前P1廠區已開始建廠，預計2022年下半年裝機，將導入5奈米製程，2024年第一季量產，月產能可達二萬片，後續則將根據需求決定是否建P2廠區。
2021-07-25T02:53:19.000Z,目前台積電不僅開始在美國亞利桑那州興建12吋晶圓廠，預計2024年第1季以5奈米製程生產，月產2萬片，台積電還計劃在中國大陸南京廠擴建28奈米產能，並評估在日本設晶圓製造廠。
2021-07-27T05:29:02.000Z,英特爾在Intel 3之後，將進入「埃米(即0.1奈米)世代」，並改採RibbonFET全新電晶體架構，Intel 20A預計2024年逐步量產。
2021-07-28T23:56:00.000Z,不過，對台積電來說，Intel既是重要的客戶，又是野心勃勃的競爭者，究竟法人及業界是如何看這場「非零和」賽局呢？Intel製程更名 與台積較勁意味濃厚英特爾27日將製程技術節點重新命名，先前稱為10nm Enhanced SuperFin的製程節點改名為Intel 7，以及前稱Intel 7奈米改名為Intel 4；在採用FinFET(鰭式場效電晶體)架構的Intel 3問世後，接著將進入「埃米（即0.1奈米）世代」，採用RibbonFET全新架構的Intel 20A，目標2024年量產，而高通（Qualcomm）為潛在客戶。
2021-07-28T23:56:00.000Z,在更名之前，以電晶體密度來看，據業界評估，Intel 10nm Enhanced SuperFin大約等於台積電7-5奈米，而Intel 的7奈米約為5~3奈米，雙方都預計在2024年量產GAA製程。
2021-07-28T23:56:00.000Z,目前台積電3奈米確定選擇沿用FinFET，而三星3奈米將改採GAA，兩家目標2022年下半年量產；而Intel 20A則是2024年。
2021-07-31T08:44:47.000Z,亞利桑那州廠今年已開始動工，預計2024年量產，月產能2萬片。
2021-07-31T01:10:30.000Z,台積電在先進製程布局上，除了正在放量生產的5奈米製程之外，2022年將會有3奈米、4奈米製程進入量產，至於2奈米製程則預計在2024年下半年將會進入量產，因此成為全球科技大廠在晶圓製程的主要合作夥伴，台積電的布局動向也備受全球關注。
2021-08-01T01:10:21.000Z,護國神山台積電設廠一直是國內外市場焦點，知情人士透露，高雄市政府總動員正在向台積電招手，「雙方已有共識，正跟時間賽跑」，預定2022年2月將中油高雄煉油廠舊址中一區、完成污染整治的26.74公頃土地，交給台積電興建7奈米廠，預計2024年量產。
2021-08-01T01:10:21.000Z,消息人士稱，中油高雄煉油廠舊址面積約238公頃，其中約77公頃的行政區沒有污染，有污染的廠區約161.63公頃，分為16個工區，其中第三工區由工務局辦理發包，已於日前截標，其它的工區也將陸續招標，未來將由工務局監督，在2023年底高雄煉油廠全區將完成整治工作，並由環保局驗證污染整治成效，以便2024年3月解除管制。
2021-08-01T01:10:21.000Z,分區開發的策略目標，是在2022年2月將面積大約26.74公頃的第三工區完成整治，交給台積電設立7奈米廠，2024年量產。
2021-08-02T07:32:07.000Z, 台積電的新竹科學園區寶山二期擴建計畫環評過關，這是台積電的Fab 20晶圓廠，是2奈米生產基地，也是台積電第一個奈米層片（nanosheet）架構的超大型晶圓廠（GigaFab），預計2022年上半年建廠，2024年量產，規劃興建4期廠房。
2021-08-02T04:00:17.000Z,全球晶圓代工龍頭台積電(2330)，新竹科學園區寶山二期擴建計畫環評過關，預計2022年上半年建廠，2024年量產；而這意味著，半導體製程於2024年進入埃米（angstorm）時代，台積電與英特爾也將正式開啟環繞閘極（GAA）電晶體架構的新世代戰役。
2021-08-02T04:00:17.000Z, 台積電新竹科學園區寶山二期擴建計畫環評過關，近期將展開土地取得程序，這是台積電2奈米的生產基地，取名為Fab 20晶圓廠，預計2022年上半年建廠，2024年量產，規劃興建4期廠房，也會是台積電第一個奈米層片（nanosheet）架構的超大型晶圓廠（GigaFab）。
2021-08-02T04:00:17.000Z, 而英特爾日前甫宣布重返晶圓代工市場，也揭露自家製程技術推進的規劃，尤其重點在於2024年進入埃米（angstorm）時代並推出Intel 20A（2奈米）製程，將採用RibbonFET電晶體架構技術並進入量產，於2024年和2025年分別量產2奈米和1.8奈米製程，同時也提到，獲得高通等客戶的代工訂單。
2021-08-02T04:00:17.000Z, 至於台積電部分，其在2奈米製程，採取和英特爾同樣的奈米層片的環繞閘極電晶體架構，預計量產時間和英特爾一樣是2024年，而近期在土地取得上順利，並將開始動工興建等，值得注意的是，雖然英特爾和台積電將開始另一波的新環繞閘極電晶體架構戰役，但英特爾一開始量產2奈米，產能依舊以供應自家晶片所需，僅有台積電可以快速供應蘋果、超微、博通、聯發科(2454)等大廠產能，業界認為，依舊將是台積電能最快速搶食市場商機。
2021-08-02T03:03:15.000Z,台積電Fab 20晶圓廠位於研發晶圓廠旁，共將興建4期廠房，預計2024年開始進入量產，將是台積電首座導入全新世代架構2奈米製程的超大型晶圓廠。
2021-08-02T03:03:15.000Z,設備業者指出，台積電為2奈米製程打造的Fab 20超大型晶圓廠，2022年可開始動工興建，前2期廠房預估會在2023年下半年完工並展開裝機作業，2024年下半年可望進入量產階段，2奈米4期廠房全部完工量產時程約在2025～2026年，總產能將逾10萬片規模。
2021-08-01T23:40:21.000Z,台積電Fab 20晶圓廠位於研發晶圓廠旁，共將興建4期廠房，預計2024年開始進入量產，將是台積電首座導入全新世代的奈米層片（nanosheet）架構2奈米製程的超大型晶圓廠（GigaFab）。
2021-08-01T23:40:21.000Z,設備業者指出，台積電為2奈米製程量身打造的Fab 20超大型晶圓廠，將分為4期廠房逐步動工，前2期廠房預估會在2023年下半年完工並展開裝機作業，2024年下半年可望進入量產階段，2奈米4期廠房全部完工量產時程約落在2025～2026年，總月產能將逾10萬片規模。
2021-07-31T08:44:47.000Z,亞利桑那州廠今年已開始動工，預計2024年量產，月產能2萬片。
2021-07-31T01:10:30.000Z,台積電在先進製程布局上，除了正在放量生產的5奈米製程之外，2022年將會有3奈米、4奈米製程進入量產，至於2奈米製程則預計在2024年下半年將會進入量產，因此成為全球科技大廠在晶圓製程的主要合作夥伴，台積電的布局動向也備受全球關注。
2021-07-28T23:56:00.000Z,不過，對台積電來說，Intel既是重要的客戶，又是野心勃勃的競爭者，究竟法人及業界是如何看這場「非零和」賽局呢？Intel製程更名 與台積較勁意味濃厚英特爾27日將製程技術節點重新命名，先前稱為10nm Enhanced SuperFin的製程節點改名為Intel 7，以及前稱Intel 7奈米改名為Intel 4；在採用FinFET(鰭式場效電晶體)架構的Intel 3問世後，接著將進入「埃米（即0.1奈米）世代」，採用RibbonFET全新架構的Intel 20A，目標2024年量產，而高通（Qualcomm）為潛在客戶。
2021-07-28T23:56:00.000Z,在更名之前，以電晶體密度來看，據業界評估，Intel 10nm Enhanced SuperFin大約等於台積電7-5奈米，而Intel 的7奈米約為5~3奈米，雙方都預計在2024年量產GAA製程。
2021-07-28T23:56:00.000Z,目前台積電3奈米確定選擇沿用FinFET，而三星3奈米將改採GAA，兩家目標2022年下半年量產；而Intel 20A則是2024年。
2021-08-01T01:10:21.000Z,護國神山台積電設廠一直是國內外市場焦點，知情人士透露，高雄市政府總動員正在向台積電招手，「雙方已有共識，正跟時間賽跑」，預定2022年2月將中油高雄煉油廠舊址中一區、完成污染整治的26.74公頃土地，交給台積電興建7奈米廠，預計2024年量產。
2021-08-01T01:10:21.000Z,消息人士稱，中油高雄煉油廠舊址面積約238公頃，其中約77公頃的行政區沒有污染，有污染的廠區約161.63公頃，分為16個工區，其中第三工區由工務局辦理發包，已於日前截標，其它的工區也將陸續招標，未來將由工務局監督，在2023年底高雄煉油廠全區將完成整治工作，並由環保局驗證污染整治成效，以便2024年3月解除管制。
2021-08-01T01:10:21.000Z,分區開發的策略目標，是在2022年2月將面積大約26.74公頃的第三工區完成整治，交給台積電設立7奈米廠，2024年量產。
2021-08-02T07:32:07.000Z, 台積電的新竹科學園區寶山二期擴建計畫環評過關，這是台積電的Fab 20晶圓廠，是2奈米生產基地，也是台積電第一個奈米層片（nanosheet）架構的超大型晶圓廠（GigaFab），預計2022年上半年建廠，2024年量產，規劃興建4期廠房。
2021-08-02T04:00:17.000Z,全球晶圓代工龍頭台積電(2330)，新竹科學園區寶山二期擴建計畫環評過關，預計2022年上半年建廠，2024年量產；而這意味著，半導體製程於2024年進入埃米（angstorm）時代，台積電與英特爾也將正式開啟環繞閘極（GAA）電晶體架構的新世代戰役。
2021-08-02T04:00:17.000Z, 台積電新竹科學園區寶山二期擴建計畫環評過關，近期將展開土地取得程序，這是台積電2奈米的生產基地，取名為Fab 20晶圓廠，預計2022年上半年建廠，2024年量產，規劃興建4期廠房，也會是台積電第一個奈米層片（nanosheet）架構的超大型晶圓廠（GigaFab）。
2021-08-02T04:00:17.000Z, 而英特爾日前甫宣布重返晶圓代工市場，也揭露自家製程技術推進的規劃，尤其重點在於2024年進入埃米（angstorm）時代並推出Intel 20A（2奈米）製程，將採用RibbonFET電晶體架構技術並進入量產，於2024年和2025年分別量產2奈米和1.8奈米製程，同時也提到，獲得高通等客戶的代工訂單。
2021-08-02T04:00:17.000Z, 至於台積電部分，其在2奈米製程，採取和英特爾同樣的奈米層片的環繞閘極電晶體架構，預計量產時間和英特爾一樣是2024年，而近期在土地取得上順利，並將開始動工興建等，值得注意的是，雖然英特爾和台積電將開始另一波的新環繞閘極電晶體架構戰役，但英特爾一開始量產2奈米，產能依舊以供應自家晶片所需，僅有台積電可以快速供應蘋果、超微、博通、聯發科(2454)等大廠產能，業界認為，依舊將是台積電能最快速搶食市場商機。
2021-08-02T03:03:15.000Z,台積電Fab 20晶圓廠位於研發晶圓廠旁，共將興建4期廠房，預計2024年開始進入量產，將是台積電首座導入全新世代架構2奈米製程的超大型晶圓廠。
2021-08-02T03:03:15.000Z,設備業者指出，台積電為2奈米製程打造的Fab 20超大型晶圓廠，2022年可開始動工興建，前2期廠房預估會在2023年下半年完工並展開裝機作業，2024年下半年可望進入量產階段，2奈米4期廠房全部完工量產時程約在2025～2026年，總產能將逾10萬片規模。
2021-08-01T23:40:21.000Z,台積電Fab 20晶圓廠位於研發晶圓廠旁，共將興建4期廠房，預計2024年開始進入量產，將是台積電首座導入全新世代的奈米層片（nanosheet）架構2奈米製程的超大型晶圓廠（GigaFab）。
2021-08-01T23:40:21.000Z,設備業者指出，台積電為2奈米製程量身打造的Fab 20超大型晶圓廠，將分為4期廠房逐步動工，前2期廠房預估會在2023年下半年完工並展開裝機作業，2024年下半年可望進入量產階段，2奈米4期廠房全部完工量產時程約落在2025～2026年，總月產能將逾10萬片規模。
