PublishDate,Sentence
2017-06-27T10:34:00.000Z,證交所表示，6月28日將有志聯 (2024) 、互盛電 (2433) 、華票 (2820) 、遠見 (3040) 、總太 (3056) 、永新-KY (4557) 、台塑化等7檔股票辦理除息交易；其中，台塑化發行市值將減少約新台幣571億元。
2017-10-30T06:59:00.000Z,傳產股跌多漲少，鋼鐵股志聯 (2024) 第四季可望受惠中鋼 (2002) 漲價效應，今年營運相較去年穩定，股價噴出大漲近4%相對耀眼。
2017-11-20T06:57:00.000Z,大陸鋼廠開平高盤，中鋼 (2002) Q1盤價有撐，近期股價多於低檔整理，以官田鋼 (2017) 、志聯 (2024) 以及威致 (2028) 等低價股表現相對強勢。
2018-02-02T07:11:00.000Z,非電子股方面，以原物料概念的造紙股正隆 (1909) 、榮成 (1909) 、永豐餘 (1907) ，以及鋼鐵股佳大 (2033) 漲停、中鋼構 (2013) 、豐興 (2015) 、志聯 (2024) 較有表現。
2018-02-02T07:11:00.000Z,非電子股方面，以原物料概念的造紙股正隆 (1909) 、榮成 (1909) 、永豐餘 (1907) ，以及鋼鐵股佳大 (2033) 漲停、中鋼構 (2013) 、豐興 (2015) 、志聯 (2024) 較有表現。
2018-02-23T07:06:00.000Z,傳產股方面，造紙股重獲買盤關愛，正隆 (1904) 、華紙 (1905) 、寶隆 (1906) 、永豐餘 (1907) 、榮成 (1909) 等放量大漲，帶動類指飆升逾5%盤面最火；中鋼 (2002) Q2盤價續看漲，帶動鋼鐵股新鋼 (2032) 、志聯 (2024) 、海光 (2038) 、佳大 (2033) 紅通通。
2018-03-01T07:23:00.000Z,傳產股方面，油價連2日走跌衝擊塑化股表現，台塑四寶台化 (1326) 、台塑 (1301) 、南亞 (1303) 、台塑化 (6505) 全面下挫；貨櫃雙雄陽明 (2609) 及長榮 (2603) 受惠市況好轉及業績報捷，股價雙雙高飛；鋼鐵股受到鋼價第二季續漲確定，中鋼 (2002) 、中鴻 (2014) 、官田鋼 (2017) 、志聯 (2024) 等漲勢凌厲。
2018-03-01T06:28:00.000Z,  鋼鐵股則為今逆勢走揚族群，中鋼 (2002) 第二季內銷鋼品盤價持續開漲，使得鋼鐵股受到買盤追捧，中鋼 (2002) 、中鴻 (2014) 、官田鋼 (2017) 、志聯 (2024) 等今漲勢凌厲。
2018-03-01T07:23:00.000Z,傳產股方面，油價連2日走跌衝擊塑化股表現，台塑四寶台化 (1326) 、台塑 (1301) 、南亞 (1303) 、台塑化 (6505) 全面下挫；貨櫃雙雄陽明 (2609) 及長榮 (2603) 受惠市況好轉及業績報捷，股價雙雙高飛；鋼鐵股受到鋼價第二季續漲確定，中鋼 (2002) 、中鴻 (2014) 、官田鋼 (2017) 、志聯 (2024) 等漲勢凌厲。
2018-03-01T06:28:00.000Z,  鋼鐵股則為今逆勢走揚族群，中鋼 (2002) 第二季內銷鋼品盤價持續開漲，使得鋼鐵股受到買盤追捧，中鋼 (2002) 、中鴻 (2014) 、官田鋼 (2017) 、志聯 (2024) 等今漲勢凌厲。
2018-03-05T07:11:00.000Z,川普對鋼品課徵關稅恐引發貿易大戰，鋼鐵股中鋼 (2002) 、官田鋼 (2017) 、燁輝 (2023) 、志聯 (2024) 等哀鴻遍野，中鴻 (2014) 重摔跌停。
2018-03-09T07:10:00.000Z,傳產股方面，水泥雙雄台泥 (1101) 、亞泥 (1102) 攜手領軍水泥股類指大漲1%表現尤佳；鋼鐵股仍受川普簽署實施鋼鋁進口關稅影響低檔盤旋，中鴻 (2014) 、豐興 (2015) 、志聯 (2024) 、大成鋼 (2027) 表現弱勢。
2018-04-02T07:10:00.000Z,清明長假壓抑買盤，台股今日在10900點附近偏空震盪，個股漲跌互見，風電概念股-上緯控投 (3708) 漲停作收，虛擬貨幣概念股-撼訊 (6150) ，以及微星 (2377) 、海光 (2038) 、志聯 (2024) 、承啟 (2425) 同樣在盤中亮紅燈，但上週強勢的國巨 (2327) 等被動元件個股及中小型股股價賣壓湧出，股價急轉直下。
2018-04-02T07:10:00.000Z,清明長假壓抑買盤，台股今日在10900點附近偏空震盪，個股漲跌互見，風電概念股-上緯控投 (3708) 漲停作收，虛擬貨幣概念股-撼訊 (6150) ，以及微星 (2377) 、海光 (2038) 、志聯 (2024) 、承啟 (2425) 同樣在盤中亮紅燈，但上週強勢的國巨 (2327) 等被動元件個股及中小型股股價賣壓湧出，股價急轉直下。
2018-06-01T04:51:00.000Z,IHS Markit估計，2017年車用半導體市場將成長15%至337億美元，估計2017~2024年間車用半導體市場每年將擴大6.7%，2024年市值增至580億美元。
2018-06-01T04:51:00.000Z,IHS Markit估計，2017年車用半導體市場將成長15%至337億美元，估計2017~2024年間車用半導體市場每年將擴大6.7%，2024年市值增至580億美元。
2018-08-07T02:34:00.000Z, 3.志聯 (2024) ：上半年EPS 0.5元，優於去年同期，昨獲外資小幅買超，帶動早盤股價漲逾2.5%。
2019-09-06T07:11:00.000Z,金融、鋼鐵類股亦有撐盤，上海商銀 (5876) 、永豐金 (2890) 、元大金 (2885) 、國泰金 (2882) 、世紀鋼 (9958) 、志聯 (2024) 等均面容紅潤。
2019-10-21T08:05:00.000Z,　根據DIGITIMES Research預測，2019年5G智慧型手機出貨估不及千萬支，在各廠競相推出下，2020年出貨將爆炸性成長近20倍，達1.75億支，隨著全球愈來愈多地區電信商提供5G服務、已商轉的5G網路涵蓋範圍不斷擴大，5G手機最低價格將持續下探，至2024年5G手機佔整體智慧型手機出貨量比重將接近一半。
2020-01-06T02:52:36.000Z,此外，備受矚目的台塑集團近年最大投資案，由台塑化 (6505) 、台化 (1326) 合力推動的美國路州石化一貫布局已召開公聽會，現處環評最後調整作業階段，預計可望在首季前期達陣，力朝2022～2024年相繼完工投產目標邁進，在利多消息鼓舞下，今日台塑 (1301) 、南亞 (1303) 、台化 (1326) 力守高檔，台塑化 (6505) 連拉兩根長紅棒，強取半年線及百元大關。
2020-01-10T07:05:59.000Z,台股周五開漲38.64點在12009.27點，蘋概三雄領軍，帶動指數重返12000行情，一度走揚至12038.21點，惟上檔有月線反壓，多空在萬二關卡糾結，台積電亦盤中翻黑，萬二得而復失、大盤曾翻黑震盪，而選前尾盤百億元買盤助陣，成功收復月線、萬二整數關，站上所有短均線，終場收漲54.02點或0.45%，報12024.65點，大選前觀望，成交金額略縮至1274.02億元。
2020-01-10T07:05:00.000Z,台股周五開漲38.64點在12009.27點，蘋概三雄領軍，帶動指數重返12000行情，一度走揚至12038.21點，惟上檔有月線反壓，多空在萬二關卡糾結，台積電亦盤中翻黑，萬二得而復失、大盤曾翻黑震盪，而選前尾盤百億元買盤助陣，成功收復月線、萬二整數關，站上所有短均線，終場收漲54.02點或0.45%，報12024.65點，大選前觀望，成交金額略縮至1274.02億元。
2020-01-10T06:40:00.000Z,台股開盤由大立光 (3008) 、鴻海 (2317) 領軍，指數跳空上漲開出，雖然台積電 (2330) 盤中一度走弱，但尾盤強彈，三王聯手拉抬下，加權股價指數今天以12024.65點作收，上漲54.02點，漲幅0.45％，不過，大選前觀望氣氛，成交金額持續萎縮至1274.08億元。
2020-01-10T06:24:00.000Z,（中央社記者江明晏台北2020年1月10日電）美股3大指數再創新高，但台股受到總統大選前觀望氣氛濃厚，今天開高震盪，尾盤拉高，終場上漲54.02點，收在12024.65點，收復月線與12000點整數關卡，但週線收黑。
2020-01-10T06:24:00.000Z,台股昨天大漲逾150點後，今天開高震盪，尾盤拉高，加權股價指數終場上漲54.02點，收在12024.65點，漲幅0.45%，成交值1274.08億元，收復月線12003點。
2020-03-12T09:14:39.000Z,"
5.台積電 (2330) ：每股成交價293.35元，成交量6萬9000股，成交金額2024萬1150元。"
2020-04-21T11:17:39.000Z,（中央社記者鍾榮峰台北2020年4月21日電）晶圓代工龍頭台積電 (2330) 預估，2019年至2024年不含記憶體的半導體業年複合成長率可望達5%，晶圓代工成長將比半導體業更強勁。
2020-04-21T11:17:39.000Z,"
不過，台積電依然看好不含記憶體的半導體業長期發展，預期自2019年至2024年，不含記憶體的半導體業年複合成長率可望達5%。"
2020-05-15T09:30:16.000Z,"
以台積電宣布的時程來看，2024年才開始量產5奈米，台灣今年就會開始量產5奈米，3奈米廠今年動工，2奈米也會留在台灣，目前規劃都還是延續，所以屆時台灣廠至少領先美國廠兩個世代，顯示台積電還是將最先進、最有價值的研發留在台灣。"
2020-05-15T08:13:56.000Z,統一投顧董事長黎方國指出，台積電 （2330） 宣告赴美設立5奈米晶圓廠，月產能2萬片（20K/wpm），預計2024年量產。
2020-05-15T08:13:56.000Z,該廠預計於2021年動工，並於2024年開始量產。
2020-05-15T08:13:56.000Z,"
二、2021~2029年投資金額120億元，但該廠將於2024年量產，因此資本支出將集中在2021～2024年間，假設該期間佔80％，2021～2024年每年平均增加約24億元資本支出，資本支出佔營收比重預估將落在35～40％，高於台積電過去30～35％，導致折舊壓力增加。"
2020-05-15T08:13:56.000Z,"
統一投顧指出，對於半導體設備廠而言，為利多，但台積電亞利桑那州新廠預計2024年量產，設備移入最快要到2023年，時間點較晚。"
2020-05-15T07:10:10.000Z,權值股方面，重磅消息莫過於，台積電將挾帶著120億美元資金，前進美國亞利桑那州興建晶圓廠，估計於2024年開始量產，利多消息帶動股價上漲5元或1.71%，以298元作收。
2020-05-15T02:55:43.000Z,"
台股今整場聚焦台積電擬砸120億美元，在美國亞利桑那州設立5奈米先進製程晶圓廠，預計2024年進入量產，今開高走高、上漲逾1%，收復季線，其餘權值股方面，大立光 (3008) 開高震盪，股價於盤上小漲；鴻海 (2317) 即將在今日召開線上法說會，被視為產業重要風向球，股價保守觀望，下挫逾1%；聯發科 (2454) 則在盤上震盪小漲，開盤即躍上5日線；和碩 (4938) 重挫逾5.5%。"
2020-05-15T02:29:19.000Z,"
台新投顧表示，台積電今（15）日宣布有意在美國設立先進晶圓廠，主要與美國聯邦政府及亞利桑那州政府共同合作；該廠將採用5奈米技術，規劃月產能2萬片，將於2021年動工，2024年量產，總資本支出約120億美元（2021～2029年合計）。"
2020-05-15T01:27:58.000Z,台積電 (2330) 今(15)日宣布，在美國聯邦政府及亞利桑那州的支持下，擬砸120億美元，於美國設立一座先進晶圓廠，主要採用5奈米製程，預計2024年進入量產。
2020-05-15T01:27:58.000Z,"
台積電此座將設立於亞利桑那州的廠房將採用5奈米製程技術生產半導體晶片，規劃月產能為20,000片晶圓，將直接創造超過1600個高科技專業工作機會，並間接創造半導體產業生態系統中上千個工作機會，該晶圓廠將於2021年動工，於2024年開始量產。"
2020-05-15T01:08:25.000Z,"
台積電指出，該晶圓廠將於2021年動工，於2024年開始量產。"
2020-05-15T01:06:44.000Z,該晶圓廠將於2021年動工，於2024年開始量產。
2020-05-16T01:08:43.000Z,"
對於政治味道太濃厚的中美貿易戰，台積電的聲明顯得非常「不沾鍋」，僅表示，此座廠房將採用台積電的5奈米製程技術生產，規劃月產能為2萬片晶圓，將直接創造超過1,600個高科技專業工作機會，該廠將於2021年動工，於2024年開始量產。"
2020-05-18T03:44:53.000Z,台積電(TSMC)於5月15日宣布將於美國亞利桑那州新建一座12吋先進晶圓廠，預計2021年動工，2024年開始量產，規劃以5奈米製程生產半導體晶片，月產能為2萬片；此專案投資金額約為120億美元，於2021開始分為九年攤提。
2020-05-18T02:02:11.000Z,"
台積電上周五宣布將於美國亞利桑那州新建一座12吋先進晶圓廠，預計2021年動工，2024年開始量產，規劃以5奈米製程生產半導體晶片，月產能為2萬片；台積電股價上周五於台股收高，外資轉為買超8841張，但上周外資仍賣超台積電46426張。"
2020-05-21T02:05:44.000Z,"
另外，台積電上周五宣布將於美國亞利桑那州新建一座12吋先進晶圓廠，預計2021年動工，2024年開始量產，規劃以5奈米製程生產半導體晶片，月產能為2萬片，此投資金額約120億美元，於2021開始分為9年攤提。"
2020-05-20T23:36:20.000Z,"
身為全球晶圓代工龍頭的台積電是蘋果等美國科技大廠的供應商，上周宣布赴美設廠的重大投資計劃，總投資規模高達120億美元，預計2021年動工，2024年完工。"
2020-06-01T23:53:43.000Z,"
除了台灣的產能擴增，為了解決美國制裁華為事件，已經宣布將在美亞利桑那州興建且營運一座先進晶圓廠，技術為5奈米製程，2021年動工，2024年量產。"
2020-06-01T23:53:43.000Z,"
除了台灣的產能擴增，為了解決美國制裁華為事件，已經宣布將在美亞利桑那州興建且營運一座先進晶圓廠，技術為5奈米製程，2021年動工，2024年量產。"
2020-06-09T06:32:30.000Z,"
台積電於5月15日宣布，擬在美國亞利桑那州興建且營運一座先進晶圓廠，將採用5奈米製程，預計2021年動工、2024年量產，總投資金額約120億美元。"
2020-06-09T05:07:47.000Z,此外，4奈米進度正常也已經和客戶在洽談，並會在2024年大量產。
2020-06-15T04:54:48.000Z,台積電日前宣布，擬在美國亞利桑那州設廠，預計2021年動工，2024年量產，初步規劃月產能2萬片。
2020-06-15T04:54:48.000Z,台積電日前宣布，擬在美國亞利桑那州設廠，預計2021年動工，2024年量產，初步規劃月產能2萬片。
2020-07-16T08:59:45.000Z,針對美國擴大對華為海思管制一事，台積電提到，會依照法律規定行事，目前在等待法規的最後定調版本；而就赴美國設廠的部分，已經有選定可能的位子，會帶供應鏈一起去，預計在2024年開始投入5奈米的量產。
2020-07-16T08:59:45.000Z,"
最後就美國建廠一事，台積電與美國多次溝通後，的確有意向去美國建廠，獲得美國聯盟及當地州政府支援，也會帶供應鏈一起去，解決成本差距問題，預計2024年開始生產，初期便導入5奈米，產能規劃為月產2萬片。"
2020-08-09T04:37:52.000Z,"
為確保製程技術持續領先，台積電2019年已領先半導體產業研發2奈米製程技術，台積電目前尚未宣布量產時間，不過，依台積電每2年推進一個世代製程技術推算，2奈米可望於2024年量產。"
2020-08-25T09:05:14.000Z,"
台積電規劃美國亞利桑那州廠2024年量產5奈米製程，屆時台灣廠區已量產3奈米，可見台灣是台積電先進製程發展重心。"
2020-08-25T03:54:10.000Z,"
劉佩真表示，台積電明年進入3奈米市場、2022年3奈米量產，2023至2024年2奈米進入環繞閘極（GAA）製程，顯見台積電不論是訂單能見度、技術藍圖，都讓客戶很有信心，並讓台積電堅信未來接單無虞。"
2020-08-26T02:24:09.000Z,業界評估，台積電2奈米可望在2024年進入生產階段。
2020-08-27T09:49:36.000Z,"
台積電積極擴充新產能，除在台灣南部投資購地，也啟動在台、美新建廠計畫，在美亞歷桑那州投資約 3600 億元設立 5 奈米廠，2021 投資動工、2024 年投片，王年清接受訪問時指出，迅得已建立產線生產&nbsp;5 奈米製程自動化倉儲設備，正進一步等待客戶端設廠規劃。"
2020-09-22T02:03:11.000Z,供應鏈透露，台積電2奈米有別於3奈米與5奈米採用鰭式場效電晶體（FinFET）架構，而是改採全新的環繞閘極（GAA）製程，使用多橋通道場效電晶體（MBCFET）架構，研發進度超前，法人預期2023年下半即可風險性試產，2024年正式量產。
2020-09-23T07:07:42.000Z,"
劉德音指出，台積電今年開始量產的5奈米以南科為主要基地，接著，2022年3奈米量產也是在台南，因此到了2024年至2025年期間，台積電約60-70%的產能都在台南。"
2020-09-23T06:28:12.000Z,"
台積電今年5奈米大量生產，2022年3奈米量產，劉德音說，2024年至2025年台積電將有6到7成產能在南部。"
2020-09-29T03:50:55.000Z,IC Insights預估到2024年，中國IC製造仍有50%來自海外，包括SK海力士、三星、台積電等。
2020-09-29T03:50:55.000Z,IC Insights預估到2024年，中國IC製造仍有50%來自海外，包括SK海力士、三星、台積電等。
2020-10-20T02:03:51.000Z,未來該廠將有三分之一用於新設備代工，三分之二支援備品製造，估計新廠完工後3年，約2024~2025年備品產能將較目前達倍增。
2020-10-31T02:30:25.000Z,台積電5月中旬閃電宣布將赴美國亞利桑那州蓋5奈米晶圓廠，規畫投入120億美元資本支出（約台幣3480億元）預計於2021年動工、2024年量產。
2020-11-03T03:03:31.000Z,"
台積電今年5月宣布，有意於美國亞利桑那州興建一座5奈米12吋晶圓廠，預計2021年動工，2024年量產，規畫月產能2萬片。"
2020-11-03T02:11:33.000Z,"
台積電今年5月宣布，有意於美國亞利桑那州興建且營運一座5奈米12吋晶圓廠，預計2021年動工，2024年量產，規劃月產能2萬片。"
2020-10-31T02:30:25.000Z,台積電5月中旬閃電宣布將赴美國亞利桑那州蓋5奈米晶圓廠，規畫投入120億美元資本支出（約台幣3480億元）預計於2021年動工、2024年量產。
2020-11-03T03:03:31.000Z,"
台積電今年5月宣布，有意於美國亞利桑那州興建一座5奈米12吋晶圓廠，預計2021年動工，2024年量產，規畫月產能2萬片。"
2020-11-03T02:11:33.000Z,"
台積電今年5月宣布，有意於美國亞利桑那州興建且營運一座5奈米12吋晶圓廠，預計2021年動工，2024年量產，規劃月產能2萬片。"
2020-11-10T11:27:55.000Z,"
台積電今年5月宣布有意於亞利桑那州興建且營運一座5奈米12吋晶圓廠，預計2021年動工，2024年量產，月產能2萬片。"
2020-11-10T11:27:55.000Z,台積電表示，亞利桑那州廠將依原訂計畫於2021年動工，2024年量產。
2020-11-10T23:57:12.000Z, 台積電於今年5月宣布有意於美國亞利桑那州興建且營運一座5奈米12吋晶圓廠，預計2021年動工，2024年量產，月產能2萬片。
2020-11-10T23:57:12.000Z,台積公司表示，亞利桑那州廠將依原訂計畫於2021年動工，2024年量產。
2020-11-19T09:52:12.000Z,台積電亞利桑那州鳳凰城廠預計2021年動工，2024年量產5奈米製程，月產能2萬片晶圓。
2020-11-19T04:24:40.000Z,依台積電規畫，鳳凰城新廠將於2021年動工，預定2024年開始生產。
2020-11-19T04:24:40.000Z,依台積電規畫，鳳凰城新廠將於2021年動工，2024年量產5奈米製程，月產能2萬片晶圓。
2020-11-19T02:47:28.000Z,依台積電規劃，鳳凰城新廠將於2021年動工，2024年量產5奈米製程，月產能2萬片晶圓；預估2021年至2029年新廠專案支出將約120億美元。
2020-11-20T06:05:00.000Z,  Business Korea 20日報導，獨立分析師和諮詢公司Omdia預測，2020年全球晶圓代工營收將年增13.5%至682億美元，2021年~2024年還將進一步成長至738億美元、805億美元、873億美元、944億美元。
2020-11-19T23:45:39.000Z,根據協議內容，台積電將在當地投資120億美元興建5奈米晶圓廠，最快明年初動土興建，2024年進入量產。
2020-11-19T23:45:39.000Z,"台積電日前董事會已通過，將在亞利桑那州設立資本額35億美元的全資子公司，亞利桑那州鳳凰城通過台積電的開發協議，協議內容包括台積電會在當地興建晶圓廠，未來5年創造1,900個全職工作機會，新廠2021年初動工，預計2024年開始生產。"
2020-11-19T23:45:39.000Z,設備業者預期，台積電美國5奈米晶圓廠2024年量產後，除了為美國政府機構生產所需特殊應用晶片（ASIC），也能就近為蘋果、英特爾、超微、高通、輝達等美國大客戶生產晶圓，許多新晶片的開發及試產也可望在當地進行，縮減晶片由設計到量產的前置時間。
2020-12-23T10:14:26.000Z,預計在 2024 年展開營運。
2020-12-23T03:14:00.000Z,  據報導，台積電美國新廠將生產目前最先進的5奈米產品，不過實際進行量產要等到2024年，而屆時3~2奈米產品已進入量產階段、5奈米已非最先進，也就是說，即便對象是美國、台積電也不願意如此輕易交出最關鍵技術，可以說，台積電的真正心聲是不想被美中任一方所束縛，因此日本有意提供給台積電「第3個選項」。
2020-12-23T22:59:00.000Z,MoneyDJ新聞 2020-12-24 06:59:44 記者 蔡承啟 報導台灣投審會於12月22日通過台積電(2330)在美國亞利桑那州鳳凰城設置一座12吋晶圓廠的投資案，此晶圓廠預計2024年上半年開始生產5nm(奈米)製程產品。
2020-12-23T22:59:00.000Z,"該座美國新廠預計2024年啟用生產，據台積電指出，最終預計會聘用超過1,600人以上員工。"
2020-12-27T10:39:03.000Z,經濟部能源局公告，2022年到2023年應備總供電容量增加近100萬瓩，2024年到2025年進一步大增257.6萬瓩。
2020-12-28T10:34:19.000Z,不過，台積電今年開始在台南量產 5 奈米製程，2022 年開始，3 奈米也會在台南，等同 2024 年至 2025 年，台積電約 60-70% 的產能都在台南。
2020-12-28T07:57:46.000Z,另外，劉德音指出，今年以前台積電在台灣布局大致達到平衡，只是隨著5奈米今年大量生產，3奈米將於2022年量產，2024年至2025年台積電將有6到7成產能在南部。
2020-12-28T06:45:28.000Z,劉德音表示，今年以前台積電在台灣布局大致達到平衡，只是隨著5奈米今年大量生產，3奈米將於2022年量產，2024年至2025年台積電將有6到7成產能在南部。
2020-12-29T14:17:26.000Z,台積電量產5奈米製程產品，也同時布局更先進晶圓製程，董事長劉德音日前表示，今年以前台積電在台灣布局大致達到平衡，只是隨著5奈米今年大量生產，3奈米將於2022年量產，2024年至2025年台積電將有6到7成產能在南部。
2020-12-31T09:15:17.000Z, 台積電今年也為市場投下震撼彈，宣布將在美國亞利桑那州設 5 奈米晶圓代工廠，預計斥資約 120 億美元，規劃月產能 2 萬片，預計 2021 年動工、2024 年量產，成為台積電在美國的第二個生產基地。
2020-12-31T09:15:17.000Z, 台積電今年也為市場投下震撼彈，宣布將在美國亞利桑那州設 5 奈米晶圓代工廠，預計斥資約 120 億美元，規劃月產能 2 萬片，預計 2021 年動工、2024 年量產，成為台積電在美國的第二個生產基地。
2021-01-14T11:41:09.000Z,至於海外布局，台積電美國亞利桑那州5奈米廠預計2024年量產，第一期廠房月產能2萬片，後續將視市場狀況、經濟情勢與政府支持情況而定。
2021-01-15T02:32:45.000Z,(圖: 亞果遊艇提供)安平港悅椿軒估 2024 年完工營運 定位國際級成功人士專屬遊艇渡假宅展望未來，由於台南市長黃偉哲看好安平遊艇碼頭發展情景，不少建商陸續進駐台南安平港周遭，齊力推動市政新灣區發展，看準此趨勢，亞果董事會於去年 12 月通過最新決議重大投資計劃，將以租地委建方式預計投入 9 億元進行安平商港設施第一、二期開發結構體工程，用以發展度假中心。
2021-01-15T02:32:45.000Z,不同於現有的檳城悅椿度假村、普吉島樂古浪悅椿度假村、蘭珂悅椿度假村，台灣安平港悅椿軒將是悅榕集團中唯一擁有水上休憩遊艇碼頭的度假村，已於去年 11 月動土，預計 2024 年完工營運，全區會員住宅皆導入酒店式管理系統，定位為府城新灣富人區濱海遊艇度假宅，提供有私人管家服務、船艇休憩。
2021-01-24T03:02:52.000Z,根據工研院產業科技國際策略發展所資料，去年全球車用半導體市場規模年減12.2%，不過先進駕駛輔助系統（ADAS）半導體反而年成長10.5%，電動車用晶片年成長10.6%；預估到2024年，全球車用電子半導體市場規模可到639億美元，占全球半導體市場比重約10.8%，年複合成長率約9.3%，預估到2024年所有車用半導體產品將呈現正成長趨勢。
2021-01-24T23:52:29.000Z,"詹家鴻估計，台積電為供應英特爾未來CPU委外代工所需，2023年前建立每月3～4萬片的3奈米產程，大約占英特爾2023、2024年CPU製造量的10～15％，假設3奈米晶圓價格為20,000美元，計算下來占台積電營收比重為8～10％。"
2021-01-27T23:44:45.000Z,晶圓代工龍頭台積電(2330)設廠計畫已獲投審會核准，預計今年於美國亞利桑那州動工興建一座5奈米12吋晶圓廠，2024年開始量產。
2021-01-27T23:44:45.000Z,"台積電已宣布將於美國亞利桑那州興建且營運一座5奈米12吋晶圓廠，該廠將於2021年動工，於2024年開始量產，規畫月產能為2萬片晶圓，2021年至2029年在此專案上的支出約120億美元，將直接在當地創造超過1,600個高科技專業工作機會，並間接創造半導體產業生態系統中上千個工作機會。"
2021-02-21T02:11:53.000Z,劉佩真指出，不管英代爾、格羅方德，都落後台積電，像英代爾7奈米晶片量產要到2023或2024年，可是台積電技術藍圖明確，3奈米明年就要量產，大單也都在握，「美國雖對供應鏈做盤點，但想看到效果沒那麼快，短期內撼動不了台積電地位」。
