PublishDate,Sentence
2021-12-15T01:48:00.000Z,此段影片讓業界猜測，基辛格是想修正之前的發言留下好印象，並親自確認預計在2024年量產的3奈米訂單。
2021-12-15T01:48:00.000Z,對此，有不少業界傳言指出，基辛格此行是想彌補過失，修正之前發言，並希望能夠向台積電爭取更多先進製程產能，包括7奈米及6奈米、5奈米、4奈米及預計2024年量產的3奈米等，其中3奈米部分，甚至希望能像蘋果一樣，為英特爾打造「專線」產能，確保出貨沒問題。
2021-12-14T23:46:02.000Z,2.當沖證交稅稅率減半優惠年底到期，立法院朝野黨團14日協商證交稅條例修正草案達成共識，決定按照行政院版本，將優惠延長三年，實施至2024年12月31日，稅率維持千分之1.5，力拚17日院會完成三讀。
2021-12-16T09:12:00.000Z,鴻海今年EPS可望超過9元，假設它未來3年每年獲利成長15%，2024年EPS即可達到13.3元。
2021-12-15T23:09:00.000Z,該座新廠將在2022年開始興建、2024年底之前開始進行生產，月產能為4.5萬片(以12吋晶圓換算)。
2021-12-20T10:56:58.000Z,台積電將與日本索尼半導體解決方案公司合資，在日本熊本縣設晶圓廠，預計2022年啟動建廠計畫，初步規劃以22奈米及28奈米特殊製程為主，將於2024年量產。
2021-12-20T07:08:42.000Z,上週五(17)由於輝瑞(Pfizer)宣布，針對2~4歲兒童低劑量疫苗研究進展欠佳，疫情可能要遞延至2024才結束，加上美國疫情確診遽升，拜登(Joe Biden)出面警告東記可能有重症、死亡仍應留意醫療系統資源，增加短線觀望。
2021-12-21T03:41:37.000Z,台積電預計2022年啟動日本建廠，並以22奈米及28奈米特殊製程為主，將於2024年量產。
2021-12-21T03:00:39.000Z,另外，經濟部投資審議委員會昨天通過台積電赴日建廠申請，台積電預計2022年啟動建廠，並以22奈米及28奈米特殊製程為主，將於2024年量產。
2021-12-23T00:07:27.000Z,"攸關南部半導體產業S廊帶最重要的一塊拼圖，中油高雄煉油廠舊址29.83公頃特種工業區，22日由高雄市都委會審議通過，變更為產業專用區案，未來將提供台積電進駐，做為第一期設廠用地，台積電高雄廠預計2022年動工，並於2024年開始量產，可望增加1,500人就業機會，年產值約1,576億元。"
2021-12-23T00:07:27.000Z,"其中，高煉廠原行政區55.49公頃土地，設置循環技術及材料研發專區的都計變更案，已於今年10月6日經市都委會審議通過，高市府第二階段續依國家產業政策指導及產業創新條例，先行勘選中油高煉廠污染整治工程第3區土地，提供台積電作為設置第一期晶圓廠用地，預計2022年動工，並於2024年開始量產，可望增加1,500人就業機會，年產值約1,576億元。"
2021-12-26T01:27:32.000Z,台積電還計畫在中油高雄煉油廠舊址設立晶圓廠，2022年開始動工，2024年量產7奈米及28奈米製程。
2021-12-26T01:27:32.000Z,海外方面，台積電美國亞利桑那州5奈米晶圓廠第1期正興建中，預計2024年量產。
2021-12-26T01:27:32.000Z,台積電也將在日本熊本縣設立特殊技術晶圓廠，預計2022年開始建廠，2024年生產22奈米及28奈米製程。
2021-12-26T23:39:19.000Z,台積電同時預計在竹科寶山興建Fab 20超大型晶圓廠，分為P1～P4共4座晶圓廠，將成為2奈米生產重鎮，預期2024年後開始進入量產。
2021-12-26T23:39:19.000Z,台積電日前已決定在高雄設立28奈米及7奈米共2座晶圓廠，2024年後進入生產階段。
2021-12-30T00:14:45.000Z,法人指出，從台積電2022年竹南先進封測廠、2024年高雄中油舊址量產7奈米及28奈米，以及最先市場傳出的2奈米廠鎖定台中設址，台積電持續擴大資本支出，包括弘塑、家登等台積電供應鏈廠商，將反映成長題材，吸引資金動能。
2021-12-31T02:50:02.000Z,台積電不僅衝刺先進製程技術，3奈米製程將於明年下半年量產，2奈米預計2025年量產；台積電同時積極擴充特殊製程產能，計畫在中油高雄煉油廠舊址設立晶圓廠，2024年量產7奈米及28奈米製程。
2021-12-31T02:50:02.000Z,海外擴產部分，台積電在美國亞利桑那州投資設立的5奈米晶圓廠，預計2024年量產；在日本熊本縣設立特殊技術晶圓廠，預計2024年生產22奈米及28奈米製程。
2021-12-31T02:50:02.000Z,力積電也在銅鑼建置新晶圓廠，預計2023年下半年開始貢獻部分產能，2024年將挹注月產能3.5萬至4萬片，到2024至2025年才會啟動第2期廠房建置。
2021-12-31T02:50:02.000Z,因應未來需求持續成長，台勝科董事會決議通過斥資新台幣282.6億元，在雲林麥寮台塑工業園區內擴建12吋矽晶圓廠，期望於2024年量產。
