PublishDate,Sentence
2018-01-05T07:06:00.000Z,中小型題材股擔任撐盤要角，水泥、玻璃、造紙、運輸四大傳產股表現突出；網通族群受惠5G題材，正文 (4906) 大漲7%，股價突破30元大關，智邦 (2345) 、明泰 (3380) 等盤堅，市場信心不退，尾盤指數拉高，最終收漲31.17點，為10879.8點。
2019-11-29T05:06:00.000Z,近兩天，外資共買超台積電4371張，但本周以來四個交易日，外資仍賣超台積電共6119張。
2019-11-29T05:06:00.000Z,近兩天，外資共買超台積電4371張，但本周以來四個交易日，外資仍賣超台積電共6119張。
2021-02-24T11:33:17.000Z,（中央社記者張建中新竹2021年2月24日電）台積電 (2330) 今天外資持續賣超，累計連續5個交易日共賣超4萬6119張，股價延續弱勢表現，開低走低，收在新台幣625元，失守633元月線關卡。
2021-02-24T11:33:17.000Z,據統計，外資於17日買超台積電8960張，隨後連續5個交易日共賣超4萬6119張，外資籌碼鬆動是影響台積電股價走低的主因。
2021-05-23T01:59:48.000Z,台中市長盧秀燕指出，朝陽師生經快篩1168人，陽性共29人，經PCR進一步篩檢均為陰性，這波病毒跟彰化不同的是，主要傳播範圍在夜唱團成員、同學、室友與家人，沒有擴大傳染之虞，但仍持續追蹤篩檢。
