PublishDate,Sentence
2017-01-23T06:57:00.000Z,　盤面上，權值股漲跌互見，台積電強登季線之上，大立光創高後拉回整理，鴻海 (2317) 擬赴美設面板廠股價小漲作收；上月獲利亮眼的玉晶光 (3406) 跳空漲停，帶動光燿科 (3428) 、亞光 (3019) 等同步走高；銅箔基板需求強勁，台光電 (2383) 再攻漲停改寫上市新高，聯茂 (6213) 及台燿 (6274) 股漲同歡；車用零組件廠在朋程 (8255) 大漲帶動胡連 (6279) 等聯袂勁揚；NOR Flash喊漲，華邦電 (2344) 爆量攻頂、旺宏 (2337) 跟進大漲半根停板。
2017-05-15T07:00:00.000Z,第1季季報揭露近尾聲，重量級大廠法說會釋出的下半年營運展望普遍不差，台股在鴻海 (2317) 、可成 (2474) 、TPK-KY (3673) 等蘋概股領軍下，配合季報表現亮眼的胡連 (6279) 、美桀 (5255) 及生醫股安成藥 (4180) 、中天 (4128) 等強攻漲停，帶動指數震盪走高，盤中順利站穩萬點關卡，再創波段新高，尾盤獲買盤進場拉抬，終場加權指數上漲50點為10036.82點，收在今日最高點，並創下17年新高，成交值縮至867.14億元，稍嫌美中不足。
2017-05-15T07:00:00.000Z,季報出色及營運展望佳個股表現搶眼，胡連 (6279) 、美桀 (5255) 、GIS-KY (6456) 、奇力新 (2456) 、旺詮 (2437) 盤中皆攻上漲停。
2017-05-22T07:09:00.000Z,川普政治風暴漸遠，上周五美股強勢反彈，台股在520後首個交易日以平高盤開出，績優及具題材中小型股扮演多頭攻堅要角，裕融 (9941) 、晶達 (4995) 、江申 (1525) 、岳豐 (6220) 、正文 (4906) 等亮燈漲停，GIS-KY (6456) 、胡連 (6279) 、中美晶 (5483) 等強勢大漲，帶動指數重登5日線，尾盤大單敲進鴻海 (2317) 、台積電 (2330) 及大立光 (3008) 等蘋概股，終場加權指數上漲49.64點為9997.26點，收在今日最高點，再度逼近萬點大關，成交值為701.72億元。
2017-05-22T07:09:00.000Z,　盤面上，蘋果三劍客鴻海 (2317) 、台積電 (2330) 及大立光 (3008) 擔任穩盤要角，Tesla概念股及車用零組件領軍喊衝，江申 (1525) 率先攻頂，貿聯-KY (3665) 、和大 (1536) 、健和興 (3003) 、順德 (2351) 、胡連 (6279) 等同步攻高；績優及具題材中小型股火力全開，裕融 (9941) 、晶達 (4995) 、岳豐 (6220) 、正文 (4906) 等強攻漲停；太陽能族群受到油價走高與綠色債券注資加持，中美晶 (5483) 、合晶 (6182) 、嘉晶 (3016) 、太極能 (4934) 、新日光 (3576) 、昇陽科 (3561) 及綠能 (3519) 集體放閃。
2017-05-22T06:47:00.000Z,　台股今天隨全球股市擺脫川普政治風暴，由Tesla概念股及車用零組件個股領軍，江申 (1525) 率先強攻漲停板，貿聯-KY (3665) 、和大 (1536) 、健和興 (3003) 、順德 (2351) 等Tesla供應商，以及胡連 (6279) 等同步收高，讓市場多頭再起，中場過後，績優及具題材的中小型股裕融 (9941) 、晶達 (4995) 、岳豐 (6220) 、華擎 (3515) 、中和 (1439) 、康樂-KY (4154) 、京晨科 (6419) 及新鉅科 (3630) 等強攻漲停板作收，台積電 (2330) 、大立光 (3008) 及台塑化 (6505) 亦在尾盤強勢收高，讓台股指數以今天最高點作收，順利站回5日線，逼近萬點關卡，惟美中不足是今天成交量仍是不足，僅700多億元，終場加權股價指數為9997.26點，上漲49.64點，成交量為701.72億元；OTC指數收盤為132.93點，上漲0.4點，成交量為238.24億元。
2017-05-22T03:53:00.000Z,　今天台股以平高盤開出，績優及具題材的中小型股持續扮演台股多頭攻堅要角，裕融 (9941) 、晶達 (4995) 、江申 (1525) 等強攻漲停板，GIS-KY (6456) 、胡連 (6279) 、岳豐 (6220) 、正文 (4906) 、中美晶 (5483) 等強勢大漲，車用零組件帶頭衝，搭配鴻海 (2317) 、台積電 (2330) 及大立光 (3008) 穩盤，讓台股指數站回5日線，截至11點25分為止，加權股價指數為9985.19點，上漲37.57點，成交量為421.12億元；OTC指數為133.07點，上漲0.54點，成交量為148.64億元。
2017-07-05T07:14:00.000Z,自動駕駛車概念股：胡連 (6279) 、和大 (1536) 、建準 (2421) 、江申 (1525) 、貿聯-KY (3665) 。
2018-01-19T10:15:00.000Z,證交所統計，本週集中交易市場總成交金額新台幣6947.79億元，全體上市股票成交金額6279.58億元，股票成交量週轉率2.09%。
2018-11-05T03:58:00.000Z,　不過上周被軋空手，來不及搶反彈的買盤勇於進場，搶買穩懋 (3105) 、康控-KY (4943) 、玉晶光 (3406) 等跌深的蘋概股，以及胡連 (6279) 、台光電 (2383) 、聯茂 (6213) 等中小型股，帶動OTC指數相對抗跌，台股指數也力守9800點，截至11點35分為止，加權股價指數為9819.77點，下跌86.82點，成交量為644.57億元；OTC指數為118.15點，下跌0.35點，成交量為143.77億元。
2018-12-28T07:09:00.000Z,被動元件龍頭股國巨 (2327) 、華新科 (2492) 虎頭蛇尾開高走低；電動車族群貿聯-KY (3665) 、美琪瑪 (4721) 、胡連 (6279) 催油門。
2018-12-28T02:51:00.000Z,電動車族群如貿聯-KY (3665) 、美琪瑪 (4721) 、胡連 (6279) 等今天股價續強；部分擁5G題材的PCB股如台光電 (2383) 、先豐 (5349) 、台燿 (6274) 、聯茂 (6213) 等今天也持續強勢。
2018-12-28T07:09:00.000Z,被動元件龍頭股國巨 (2327) 、華新科 (2492) 虎頭蛇尾開高走低；電動車族群貿聯-KY (3665) 、美琪瑪 (4721) 、胡連 (6279) 催油門。
2018-12-28T02:51:00.000Z,電動車族群如貿聯-KY (3665) 、美琪瑪 (4721) 、胡連 (6279) 等今天股價續強；部分擁5G題材的PCB股如台光電 (2383) 、先豐 (5349) 、台燿 (6274) 、聯茂 (6213) 等今天也持續強勢。
2019-01-15T07:07:00.000Z,汽車零組件業力甩中國車市衰退陰霾，江興鍛 (4528) 、智伸科 (4551) 、胡連 (6279) 、英利-KY (2239) 催油門。
2019-08-14T02:50:00.000Z,美國宣布延後對部分中國貨品加徵10%關稅，美股止跌反彈，道瓊工業指數終場勁揚372.54點，漲幅1.44%，收在26279.91點。
2020-05-12T07:01:16.000Z,汽車零組件成為人氣焦點所在，麗清 (3346) 4月營收月增194.07%，股價鎖在漲停板27.55元、胡連 (6279) 昨獲三大法人買超計808張，也亮漲停燈；同致 (3552) 也在漲停之列。
2021-07-07T00:46:58.000Z,※券商推薦股：南電(1)、陽明(1)、百和(1)、元大台灣50ETF(1)、榮成(1)、中鴻(1)、聚鼎(1)、騰輝電子-KY(1)、大立光(1)、日月光(1)、欣興(1)、台光電(1)、台郡(1)、晶技(1)、智伸科(1)、胡連(1)、同致(1)、同欣電(1)、朋程(1)、國巨(1)。
2021-07-07T00:46:58.000Z,大立光、台積電、日月光、景碩、欣興、台光電、台郡、晶技、智伸科、胡連、同致、同欣電、強茂、朋程、國巨。
2021-08-18T05:14:49.000Z,儘管近期電子股雜音不斷，不過亞系外資在最新出爐的報告中表示， 由於產業緊缺的狀況將持續到明年上半年，看好具備議價優勢、布局高端相關廠商，點名看好台積電(2330)、信驊(5274)、鴻海(2317)、欣興(3037)、胡連(6279)等，重申「買進」評等，目標價分別維持上看825元、2600元、160元、175元及170元。
2021-08-18T05:14:49.000Z, 亞系外資指出，半導體2023年之前沒有特別新增產能，會以汽車需求優先，預估汽車供應鏈狀況相對較好，由於分配減少、季節性效應讓IC供應緊缺到明年上半年，而SDI和胡連等高端應用預估不會受到短缺影響。
2021-08-18T05:14:49.000Z, 亞系外資強調看好具備議價能力優勢及布局高端相關的廠商，點名看好台積電、信驊、鴻海、欣興、胡連等個股，評等都維持「買進」。
