PublishDate,Sentence,Score
2017-11-07T07:01:00.000Z,傳產股方面，工紙大廠榮成 (1909) 10月獲利登峰激勵股價大漲5%，帶動寶隆 (1906) 、正隆 (1904) 、華紙 (1905) 等造紙股人氣強強滾；隨著油價走高，激勵台塑 (1301) 、南亞 (1303) 、台化 (1326) 等塑膠股走揚，航運股因擔心成本增加表現疲軟，航空雙雄華航 (2610) 、長榮航(2168)雙雙熄火，貨櫃三雄長榮 (2603) 、陽明 (2609) 及萬海 (2615) 壓低整理。,8
2017-11-15T05:58:00.000Z,永豐餘 (1907) 第3季獲利亮眼，今天上漲2.07%，收12.35元，帶動造紙指數上漲1.23%；華紙 (1905) 漲1.4%，收10.85元；正隆 (1904) 開高走低，下跌0.29%，收17.05元。,0
2017-11-15T02:29:00.000Z,永豐餘 (1907) 第3季獲利亮眼，今天大漲3.31%，報12.5元，帶動造紙指數上漲約1%；華紙 (1905) 漲幅逾1%，正隆 (1904) 小漲約0.3%。,6
2017-11-27T04:22:00.000Z,電子股失靈，資金轉向傳產股，正值第4季歐、美及華人圈年節銷售旺季下，紙類需求旺盛一路到明年農曆年前，造紙類股今天表現相對優異，開低走高，盤中最高上漲1.21%，主要是控股角色的永豐餘和子公司華紙 (1905) ，以及另一家工紙大廠榮成上漲撐住類股。,3
2017-11-27T04:22:00.000Z,永豐餘子公司華紙第3季稅後淨利歸屬於母公司為1.72億元，季成長6.4%，年成長233.6%，EPS 0.16元；前3季EPS 0.43元，年增105% 。,2
2017-11-27T04:22:00.000Z,華紙指出，第4季漿紙市場需求依舊緊俏，預期短期國際漿價依舊穩健向上，若文化用紙報價可反映成本順利調漲，預期第4季營收審慎樂觀。,7
2017-11-27T04:22:00.000Z,永豐餘今天股價開高走高，盤中最高13.1元，漲幅2.75%，非常接近9月底創下13.15元的兩年多以來波段新高，成交量8000多張；華紙開高走高，最高11.15元，漲幅0.9%，成交量近700張；榮成開低翻紅走高，盤中最高43.2元，漲幅2.37%，成交量4000多張。,6
