PublishDate,Sentence,Score
2018-10-03T07:15:00.000Z,金融股普遍回檔，國泰金 (2882) 、富邦金 (2881) 、中信金 (2891) 齊步收低。,0
2018-10-03T02:57:00.000Z,截至10時43分，加權股價指數下跌14點、為10905.63點、成交值新台幣463.83億元，量能再見萎縮，分析師估計，今天成交值恐不到千億元，讓台股仍深陷盤整泥沼中，其中，電子權值股僅靠台積電 (2330) 撐盤，金融股表現則是相對弱勢，尤以中信金 (2891) 跌幅超過1%壓力最大。,-9
2018-10-19T06:07:00.000Z, 金融股方面，今類股走勢呈現漸入佳境，終場有開發金 (2883) 、中信金 (2891) 、國泰金 (2882) 、華南金 (2890) 、第一金 (2892) 等收紅。,3
2018-10-23T06:04:00.000Z,金控股國泰金 (2882) 收在49.3元，跌1.99%，富邦金 (2881) 收在49.55元，跌0.9%，中信金 (2891) 收在20.95元，跌0.71%。,-1
2018-10-24T10:42:00.000Z,台灣永續指數10大成分股包含台積電 (2330) 、鴻海 (2317) 、聯發科 (2454) 、南亞 (1303) 、國泰金 (2882) 、富邦金 (2881) 、中華電 (2412) 、中信金 (2891) 、統一 (1216) 、中鋼 (2002) 等電金傳產3大族群權值股。,0
2018-10-24T06:14:00.000Z,金控股國泰金 (2882) 收在49.75元，漲0.9%，富邦金 (2881) 收在49.15元，跌0.8%，中信金 (2891) 收在20.4元，跌2.6%。,0
2018-10-24T03:15:00.000Z,金控股國泰金 (2882) 、富邦金 (2881) 在平盤下整理，中信金 (2891) 來到20.5元，跌2.1%。,-1
2018-10-25T02:10:00.000Z, 金融股中大型金控股全面走跌，國泰金 (2882) 、開發金 (2883) 、元大金 (2885) 等跌幅逾2%，其中國泰金股價也創近一年新低，新光金 (2888) 、兆豐金 (2886) 、中信金 (2891) 、台新金 (2887) 、富邦金 (2881) 等跌幅也在1.5%~2%。,-1
