PublishDate,Sentence,Score
2017-01-20T07:15:00.000Z,國巨 (2327) 旗下凱美電機 (5317) 公開收購大毅 (2478) 股權，市場看好收購案綜效，大毅股價跳空漲停鎖死，凱美盤中亦強攻漲停板，國巨大漲突破70元，創下2016年8月19日以來新高。,10
2017-01-20T06:29:00.000Z,凱美宣布將公開收購大毅，大毅股價直接跳空漲停鎖住，凱美早盤也以漲停開出，不過陷入劇烈震盪，終場以平盤作收，至於國巨則是驚驚漲，終場大漲逾 6%，站上 70 元大關。,5
2017-01-23T06:41:00.000Z,至於凱美與大毅的收購大戰開打，大毅再拉出第 2 根漲停，凱美則是僅維持小漲。,1
2017-01-24T06:54:00.000Z,　權值股今日扮演多頭先鋒，指標股大立光 (3008) 登天價、台積電 (2330) 守高檔，玉晶光 (3406) 今日再攻漲停，短短8個交易日大漲66.5%，為今年最火紅電子股；奇力新 (2456) 上下游垂直整合，合併旺詮 (2437) 、國巨 (2327) 子公司飛磁，帶動股價聯袂衝高，旺詮漲停鎖到底；大毅 (2478) 祭庫藏股放量攻頂，超越凱美 (5317) 公開收購價24.76元，為凱美公開收購案添增變數；欣普羅 (6560) 今年營運不看淡，上櫃首日飆漲逾倍，蜜月行情火辣辣。,12
2017-01-24T02:54:00.000Z,大毅庫藏股發威，今放量續強，盤中一度漲停26.65元，股價一舉超越凱美 (5317) 宣布的公開收購價24.76元，為凱美公開收購案添增變數。,5
