PublishDate,Sentence,Score
2017-03-01T06:55:00.000Z,傳產股方面，航運股陽明 (2609) 挾低價轉機題材衝高大漲，激勵類股逆勢收紅；鋼鐵股龍頭中鋼 (2002) 第二季內銷盤價持續大漲，帶動盛餘 (2029) 、中鴻 (2014) 、聚亨 (2022) 、燁興 (2007) 、海光 (2038) 等紅光滿面。,8
2017-03-01T06:55:00.000Z,傳產股方面，航運股陽明 (2609) 挾低價轉機題材衝高大漲，激勵類股逆勢收紅；鋼鐵股龍頭中鋼 (2002) 第二季內銷盤價持續大漲，帶動盛餘 (2029) 、中鴻 (2014) 、聚亨 (2022) 、燁興 (2007) 、海光 (2038) 等紅光滿面。,8
2017-03-07T00:07:00.000Z,"　麥格理資本證券台股策略分析師Jeffrey Ohlweiler指出，台股先前站上9,800點後，之所以被視為進入「危險區」，在於本世紀台股有4次站上9,800點，分別為：一、2000年2月17日的10,202點，但之後回檔修正54％；二、2007年10月29日的9,810點，但之後3個月回測23％；三、2015年4月27日的9,973點，但之後4個月回測26％；2017年這次則是第四次。",1
2017-03-09T07:06:00.000Z,鋼鐵類股受龍頭中鋼跌逾 1% 拖累，聚亨、第一銅、燁興、盛餘、豐興、允強、東明 - KY、海光、美亞等也都下跌超過 1%。,-5
2017-03-16T07:06:00.000Z,電子股在台積電 (2330) 、大立光 (3008) 、鴻海 (2317) 、玉晶光 (3406) 領漲下，推升類股指數逼近400點，衝上2007年11月以來新高。,3
2017-03-16T03:12:00.000Z,電子股在台積電、大立光 (3008) 、鴻海 (2317) 等權值股揚升，電子類股指數逼近400點，來到2007年11月以來新高。,0
2017-03-18T02:46:00.000Z,受惠英國富時指數（FTSE）季度權重調整生效，國際資金昨（17）日鎖定科技股急拉台股尾盤，帶動電子股指數上漲0.9％、收在402.14點，創下2007年12月以來新高。,5
2017-03-24T07:02:00.000Z,鋼鐵股繼續回檔修正，中鴻 (2014) 賣壓重，跌幅達2%，燁興 (2007) 、燁輝 (2023) 、盛餘 (2029) 、允強 (2034) 皆下跌逾1%，賣壓沈重。,-5
