PublishDate,Sentence,Score
2018-10-02T07:16:00.000Z,美墨加三國貿協格局確立，帶動隔夜美股道指、標普收高，台股在連3日站上「萬一」關卡後，今日受到台積電 (2330) 偏弱影響，導致市場信心不足，電子、金融、傳產龍頭股跟進殺低，包括鴻海 (2317) 、聯發科 (2454) 、國泰金 (2882) 、開發金 (2883) 、台塑四寶等紛遭空頭襲擊同步軟腳，使指數不但摔落萬一關卡並持續擴大下挫逾百點，10900點大關岌岌可危，終場加權指數下跌132.17點為10919.63點，成交值為1058.74億元。,1
2018-10-19T06:07:00.000Z, 金融股方面，今類股走勢呈現漸入佳境，終場有開發金 (2883) 、中信金 (2891) 、國泰金 (2882) 、華南金 (2890) 、第一金 (2892) 等收紅。,3
2018-10-23T00:02:00.000Z,上週外資在集中市場賣超414.49億元，賣超開發金6.30萬張最多，另買超臺企銀1.59萬張最多。,1
2018-10-23T00:02:00.000Z,"上週外資自集中市場賣超最多的前三名上市公司為：第一名：開發金：買進42,566千股，賣出105,563千股，賣超62,997千股。",0
2018-10-25T02:10:00.000Z, 金融股中大型金控股全面走跌，國泰金 (2882) 、開發金 (2883) 、元大金 (2885) 等跌幅逾2%，其中國泰金股價也創近一年新低，新光金 (2888) 、兆豐金 (2886) 、中信金 (2891) 、台新金 (2887) 、富邦金 (2881) 等跌幅也在1.5%~2%。,-1
2018-10-31T07:12:00.000Z,非電族群在台塑四寶及金融股富邦金 (2881) 、開發金 (2883) 、玉山金 (2884) 等並肩領軍下，出現類股齊揚榮景，盤面上僅美食-KY (2723) 領跌的觀光股獨憔悴。,0
