PublishDate,Sentence,Score
2017-07-03T06:01:00.000Z,上演除息行情的金融股表現撐盤，富邦金 (2881) 漲0.86%、收46.85元；國泰金 (2882) 漲1.04%、收48.6元；兆豐金 (2886) 漲1.19%、收25.6元；中信金 (2891) 漲0.25%、收20元。,1
2017-07-03T06:01:00.000Z,上演除息行情的金融股表現撐盤，富邦金 (2881) 漲0.86%、收46.85元；國泰金 (2882) 漲1.04%、收48.6元；兆豐金 (2886) 漲1.19%、收25.6元；中信金 (2891) 漲0.25%、收20元。,1
2017-07-05T07:14:00.000Z,  高殖利率概念股：第一金 (2892) 、兆豐金 (2886) 、中信金 (2891) 、華碩 (2357) 和光寶科 (2301) 等。,0
2017-07-11T10:36:00.000Z,金融股也獲外資買盤加持，中信金 (2891) 買超張數達1.2萬張，國泰金 (2882) 、元大金 (2885) 、新光金 (2888) 、兆豐金 (2886) 、永豐金 (2890) 都排在今天外資買超前25名。,4
2017-07-18T07:07:00.000Z,金融股維持高檔震盪，開發金 (2883) 、兆豐金 (2886) 相對有撐，國泰金 (2882) 、中信金 (2891) 、新光金 (2888) 同步走跌。,1
2017-07-18T02:35:00.000Z,金融權值股表現較弱，僅兆豐金 （2886） 持穩盤上，富邦金 （2881） 、國泰金 （2882） 、中信金 （2891） 均下跌約0.5％。,-2
2017-07-24T06:57:00.000Z,金融股擺尾收紅，兆豐金 (2886) 、台新金 (2887) 、永豐金 (2890) 相對強勢。,3
2017-07-24T06:57:00.000Z,台股受惠電子、金融雙擺尾，包括台積電、鴻海、大立光與和碩 (4938) 等蘋概股，與兆豐金等力挺多方，使盤勢開低震盪趨堅。,2
