PublishDate,Sentence,Score
2017-07-12T00:57:00.000Z,日期：2017年 7月12日※本日焦點股昇華、直得、微星、玉晶光、群聯、網龍、研華、創意、力成、亞德客-KY、鴻準、致伸、科誠、譜瑞-KY、致茂、京鼎、東隆興、群創、仁寶、實威、鎧勝-KY※昨日盤勢解析德國五月份出口數據強勁，中國生產者物價指數年增率來到5.5%，激勵能源礦業類股領漲，週一西歐三大指數收高。,7
2017-07-17T03:16:00.000Z,美股強強滾，台股緩步攻抵10450點！　上周四，台積電 (2330) 及大立光 (3008) 同步舉行法說會，內容卻差強人意，壓抑到上周五台股走勢，不過由於美股連兩天強勢創高，且外資未改變對台積電及大立光正面看法，加上上櫃股王—精測 (6510) 率先創高，中小型股強強滾，化解了台股下探的疑慮，今天台股指數在台積電及大立光回穩與上周五美股收高帶動下，今天以高盤開出，盤中富堡 (8929) 、康樂-KY (4154) 、系微 (6231) 等強攻漲停板，佳邦 (6284) 、祥碩 (5269) 、智邦 (2345) 、濱川 (1569) 、新光鋼 (2031) 、全新 (2455) 、益航 (2601) 、京鼎 (3413) 等中小型股走強，台股指數一度攻高至10490點，不過，上周創高的金融類股及觀光類股走弱，拖累台股指數，台股指數在中場過後緩步走弱，截至10點55分為止，加權股價指數為10459.98點，上漲16.07點，成交量為538.61億元；OTC指數為137.17點，上漲0.53點，成交量為152.95億元。,-2
2017-07-27T07:05:00.000Z,　電子股方面，鴻海集團飛鷹計畫啟航，未來4年在美斥資百億美元興建面板廠，激勵鴻海 (2317) 聞訊走揚，鴻家軍京鼎 (3413) 、廣宇 (2328) 雙雙攻頂，樺漢 (6414) 、群創 (3481) 、乙盛-KY (5243) 等整齊走高；面板雙虎群創 (3481) 、友達 (2409) 上半年合計大賺432.85億元，帶動股價雙雙勁揚；股王大立光 (3008) 、台積電 (2330) 、日月光 (2311) 等權值股表現亦佳；聯電 (2303) 因Q3展望持平，昨夜ADR重挫5.08%，拖累今日爆量下殺7%，並摔出5日線、月線。,5
2017-07-27T06:48:00.000Z,  盤面上，鴻海集團將啟動在美投資，今日集團個股大漲慶祝，鴻海收在117.5元、漲幅1.73%，京鼎 (3413) 、廣宇 (2328) 則連袂攻頂，表現亮眼。,7
2017-07-27T05:52:00.000Z,鴻海集團股今天股價表現亮眼，除鴻海上漲2元，京鼎 (3413) 更強攻漲停，達220.5元，創上市來新高價，廣宇 (2328) 也漲停，達30.05元，群創 (3481) 漲0.4元，漲幅2.75%，鴻準 (2354) 漲0.9元，漲幅0.99%，為盤面焦點。,5
2017-07-27T02:50:00.000Z,鴻海股價一度達118.5元，漲3元，鴻海集團股也同步走高，京鼎 (3413) 漲19元，漲幅達9.47%，廣宇 (2328) 漲2.45元，漲幅8.95%，鴻準 (2354) 漲1.3元，漲幅1.42%，群創 (3481) 漲0.55元，漲幅3.78%，為盤面焦點。,4
