PublishDate,Sentence,Score
2017-11-07T07:01:00.000Z,傳產股方面，工紙大廠榮成 (1909) 10月獲利登峰激勵股價大漲5%，帶動寶隆 (1906) 、正隆 (1904) 、華紙 (1905) 等造紙股人氣強強滾；隨著油價走高，激勵台塑 (1301) 、南亞 (1303) 、台化 (1326) 等塑膠股走揚，航運股因擔心成本增加表現疲軟，航空雙雄華航 (2610) 、長榮航(2168)雙雙熄火，貨櫃三雄長榮 (2603) 、陽明 (2609) 及萬海 (2615) 壓低整理。,8
2017-11-07T02:10:00.000Z,（中央社記者韋樞台北7日電）華航 (2610) 第3季吃下傳統營運旺季，客貨運需求成長的大補丸，第3季母公司淨利29.52億元，前3季稅後每股盈餘(EPS) 0.17元虧轉盈，不過今天股價卻帶量開低走低，盤中跌逾半根。,-1
2017-11-07T02:10:00.000Z,華航第3季合併營業淨利新台幣37.02億元，合併稅前淨利36.7億元，合併稅後淨利30.51億元；第3季歸屬母公司淨利29.52億元，相較去年同期5.12億元，增加近5倍；EPS 0.54元，較去年同期0.09元大幅成長。,2
2017-11-07T02:10:00.000Z,華航第3季為暑假旺季，不但客運需求強勁，貨運市場更受惠於電子商務的貿易需求，以及台積電 (2330) 南京廠的建設，大量設備載往南京，大陸各大機場無法及時轉運的貨物也由華航載往台灣再轉送歐美，使得貨運班班客滿，穩定復甦。,3
2017-11-07T02:10:00.000Z,華航股價從10月底以來逐步下滑，今天開低帶量走低，跌幅一度達6%，盤中最低11.15元，成交量迅速擴大逾2萬張。,-3
