PublishDate,Sentence,Score
2018-06-11T07:07:00.000Z,台股受到國際利空消息干擾，包括G7峰會不歡而散，FED將再度調息，與中美貿易磨擦未見轉寰契機，使全球貿易大戰陰霾揮之不去，致今日盤勢攻堅乏力；在蘋果鏈台積電、鴻海雙雙走疲，統一、兆豐金 (2886) 、台泥 (1101) 與南亞 (1303) 等權值股表現不振下，終場指數收跌7.19點。,-8
2018-06-11T07:07:00.000Z,分析師表示，台股今日表現相對亞股弱勢，以中小型股為主的櫃買指數表現較佳，後續若新台幣升值趨勢不變、配合中小型股再次轉強，指數仍有持續創高機會，預估本周將於11000～11300點區間高檔震盪。,2
2018-06-11T06:39:00.000Z,市場關注川金會等國際局勢發展，台股加權指數今早開高後，受調節賣壓出籠拉回翻黑，在權值股表現偏弱，被動元件、MOSFET、矽晶圓領軍下，指數於平盤上下高檔震盪。,1
2018-06-11T06:39:00.000Z,分析師預期，台股震盪整理後仍有向上攻高條件，預估將於11000～11300點區間高檔震盪，並須留意國際政經局勢消息面影響。,3
2018-06-11T05:53:00.000Z,（中央社記者韓婷婷台北2018年6月11日電）台股今天雖在美股上漲下開高，但由於權值股不給力，盤中以具題材的中小型股表現較為凸出，但指數僅能在平盤附近震盪，多頭依舊無法站上5日線11173點。,1
2018-06-11T05:53:00.000Z,分析師表示，台股今天表現在亞股中相對弱勢，以中小型股為主的櫃買指數表現較強，顯見內資還在場中，具有題材性的中小型股依舊有表現空間，短線雖因逼近前高11270點出現反壓，但指數在高檔有撐，本週還是有挑戰新高的契機。,-1
2018-06-11T05:31:00.000Z,金融監督管理委員會主委顧立雄表示，國內投信發行ETF的種類相當多元，截至4月底，國內共有10家投信管理及發行ETF，發行檔數達118檔，占整體投信基金規模17%，上市ETF交易量新台幣6500億元，則占台股整體交易量7%。,1
2018-06-11T03:25:00.000Z,（中央社記者韓婷婷台北2018年6月11日電）雖然美股走揚激勵亞股表現不差，但與台股連動性強的費城半導體指數下挫，影響台股蘋概三王走勢偏弱，台股開高走低，尋求11000點整數關卡支撐，被動元件仍是最強族群。,1
2018-06-11T03:25:00.000Z,分析師表示，雖然美股上漲作收，但科技股走勢偏弱，尤其是費城半導體指數下跌0.85%，蘋果(Apple)股價也自高點回落，影響台股中蘋概股走勢，不過漲價族群強勢依舊，被動元件由國巨 (2327) 領軍，包括智寶 (2375) 、奇力新 (2456) 、信昌電 (6173) 聯袂漲停，矽晶圓指標環球晶 (6488) 也大漲超過3%。,2
2018-06-11T03:25:00.000Z,法人指出，台股短線跌破5日線11170點，出現漲多休息的態勢，不過，由於主流族群續強，外資有由空轉多的跡象，指數可望在11000點出現強勁支撐，本週還有大立光股東會、美國預料升息、川金會等議題，都將影響短線盤勢。,2
2018-06-11T03:19:00.000Z,台股加權指數今早開盤上漲12.57點、以11168.99點開出，一度上漲30.25點至11168.99點，惟隨後拉回翻黑，一度下跌37.61至1118.81點，再度出現開高走低的高檔盤整格局。,-2
2018-06-11T00:33:00.000Z,台股上周五（8日）伴隨國際股市拉回，居高思危氣氛轉濃，引發獲利了結賣壓出籠，外資終結連5買，轉賣超37億餘元，而8大官股券商一如往常與外資對作，終結連5賣，轉為買超7.46億元，大舉敲進鴻海 （2317） 及台積電 （2330） 等蘋概股、權值股。,0
2018-06-11T00:33:00.000Z,　富邦投顧董事長蕭乾祥指出，蘋概股目前雖然整體氣勢尚未轉強，但台股經過高檔震盪整理由，仍有機會由蘋概股領軍反彈，另被動元件及DRAM族群，也仍是盤面主流。,4
2018-06-12T07:15:00.000Z,市場聚焦今日於新加坡登場的世紀川金會，亞股呈現漲跌互見，台股在股王大立光 (3008) 熄火，股后國巨 (2327) 觸跌停衝擊下，指數一度跌破11100點、下探11088.53點，盤面以二線光學股、矽晶圓及MOSFET概念股表現相對亮眼，最後一盤在台積電 (2330) 擺甩拉抬下，終場加權指數下跌4.44點為11144.79點，成交值增為1796.12億元。,-2
2018-06-12T07:15:00.000Z,市場觀望川金會結果，台股今日震盪收小黑，近期包括川金會及美國聯準會和歐洲央行都將召開決策會議，加上新興市場貨幣如阿根廷披索、土耳其幣等相繼重貶，恐將影響短期盤勢，目前台股指數接近前波高點，技術面指標KD逢高檔死亡交叉，短線不排除回測10日線與11000點支撐。,1
2018-06-12T07:15:00.000Z,就籌碼面觀之，外資今日轉為賣超，恐影響台股動能表現，選股方面，可留意具有題材性的中小型股及股東會行情。,1
2018-06-12T06:45:00.000Z,全球聚焦兩大狂人川普以及金正恩在新加坡的世紀川金會，台股開低後震盪，盤中一度面臨11100的攻防戰，終場台股收跌4.44點、報在11144.79點、成交量為1796.11億元。,-3
2018-06-12T06:45:00.000Z,  全球聚焦川金會，台股今一度陷入觀望，指數最低達11088點，失守11100大關，權值股今依舊無發揮領軍作用，股王大立光 (3008) 今股東會登場，通過配發現金股利72.5元，寫下歷史新高，董事長林恩平也喊話，多鏡頭仍為趨勢，7月訂單更滿，惟今股價不賞臉，收在4400元，跌幅2.4%；台積電 (2330) 午盤後股價翻紅，收漲1.3%，報在229元；鴻海 (2317) 亦小漲0.3%，收在87.7元；面板雙虎友達 (2409) 、群創 (3481) 則是小漲作收，今相對穩盤。,3
2018-06-12T06:45:00.000Z,  此外，目前台股指數接近前波高點，技術面來說KD逢高檔死亡交叉，短線不排除回測10日線與11000點支撐。,0
2018-06-12T02:01:00.000Z,川金會今於新加坡登場，美股漲多跌少，僅費城半導體指數收跌，台股今開盤跌9.21點，加權股價指數報在11140.02點，台股指數持續陷入糾結整理，目前台股下檔支撐已向上墊高至月線約10938點位置，短線預計盤堅格局不變。,2
2018-06-12T02:01:00.000Z,  今台股資金依舊逗留在中小型個股，成交量前三名依序為華邦電 (2344) 、中環 (2323) 、華晶科 (3059) ，華晶科受惠營運題材加上私募等消息交持下，股價再度攀上新高，最高達39.75元，除華晶科外，其餘二線光學股中佳凌 (4976) 連兩日攻上漲停，股價創下新高，玉晶光 (3406) 漲幅逾3%，揚明光 (3504) 、先進光 (3362) 走高等亦走揚；矽晶圓族群今也扮演強勢指標股之一，漢磊 (3707) 大漲逾8%，合晶 (6128) 大漲逾7%，中美晶 (5483) 漲幅也逾3%；被動元件方面，儘管龍頭股國巨 (2327) 拉回第三支黑K，但智寶 (2375) 、華容 (5328) 漲停，大毅 (2478) 漲幅逾7%；MOSFET概念股，富鼎 (8261) 再奔漲停，大中 (6435) 續創新高，股價大漲逾8%，杰力 (6299) 、尼克森 (3317) 也同步續揚。,15
2018-06-12T02:01:00.000Z,  以就籌碼面來說，目前外資買超金額尚未明顯放大，恐影響台股動能表現，選股方面，可留意具有題材性的中小型股，以及股東會行情。,5
2018-06-13T07:10:00.000Z,聯準會宣布決議前市場謹慎觀望，周二美股漲跌互見，台股今日由雙王大立光 (3008) 及台積電 (2330) 聯手領軍，指數多持穩於11100點以上呈現小漲格局，雖被動元件、光碟、MOSFET族群漲多回檔，所幸國泰金 (2882) 、富邦金 (2881) 等金融股與台泥 (1101) 、南亞 (1303) 等傳產龍頭股擔任穩盤要角，使市場人氣持續熱絡，終場加權指數上漲28.42點為11173.21點，成交值1763.54億元，成交值增為1796.12億元。,6
2018-06-13T07:10:00.000Z,台股今日受惠雙王台積電、大立光力挺多方，加上國泰金、富邦金等金融股穩盤，而台泥 (1101) 、南亞 (1303) 等傳產龍頭股扮演輔攻角色，加上風電概念股於前波適度整理後強勢攻堅，使被動元件、矽晶圓與MOSFET等族群拉回不致人氣潰散。,5
2018-06-13T06:31:00.000Z,美股仍在高檔，科技股續強，台股由股王大立光 (3008) 以及台積電 (2330) 走揚領軍，鴻海 (2317) 收高；蘋概三王齊揚，加權指數穩在11100點以上，收盤漲28點至11173點，成交值1763億元。,5
2018-06-13T06:31:00.000Z,  台股早盤由電金大型權值股穩盤，早盤呈現震盪小漲的格局，雖被動元件族群漲多回檔，由低位階個股補漲接棒，人氣持續熱絡。,2
2018-06-13T06:31:00.000Z,  繼周二台股隨著台積電收高穩盤。,0
2018-06-13T06:31:00.000Z,  整體來看，今早由大立光以及台積電引領電子股走揚，國泰金 (2882) 、富邦金 (2881) 等大型金控穩住金融股小漲；電金穩盤，台股守穩月線關卡，今日也一度突破5日線。,3
2018-06-13T06:31:00.000Z,台股今日收在相對高點，仍是高檔震盪格局。,1
2018-06-13T06:31:00.000Z,  上周五出現高檔長黑棒後，本周以來台股呈現震盪整理，目前均線仍是多頭排列，且6月初突破的11000點具備強勁支撐。,5
2018-06-13T03:26:00.000Z,美股仍在高檔，科技股續強，台股由股王大立光 (3008) 以及台積電 (2330) 走揚領軍，加權指數穩在11100點以上，早盤呈現震盪小漲的格局，雖被動元件族群漲多回檔，由低位階個股接棒，人氣持續熱絡。,5
2018-06-13T03:26:00.000Z,  回顧周二台股開低後在平盤附近震盪，成交金額放大至1799.27億元，電子股交投熱絡，台積電收高，台股小跌4點，收在11144.79點。,-2
2018-06-13T03:26:00.000Z,  今早由大立光以及台積電引領電子股走揚，國泰金 (2882) 、富邦金 (2881) 等大型金控穩住金融股小漲；電金穩盤，台股守住月線關卡，仍是高檔震盪格局。,3
2018-06-13T03:26:00.000Z,  上周五出現高檔長黑棒後，本周以來台股呈現震盪整理，目前均線仍是多頭排列，且6月初突破的11000點具備強勁支撐。,5
2018-06-13T03:19:00.000Z,（中央社記者潘智義台北2018年6月13日電）台北股市今天開高震盪盤整，法人指出，美聯準會（Fed）升息、美國擬定貿易制裁清單兩項消息底定後，若沒有無太大意外，台股有機會持續上漲。,-1
2018-06-13T03:19:00.000Z,凱基投顧指出，台股震盪等待聯準會升息、以及美國貿易制裁清單等消息面底定，若升息符合預期，美也未對世界各國課高關稅，台股還有機會再向上攻。,4
2018-06-13T03:19:00.000Z,凱基投顧表示，台股單日成交量動輒1700億、1800億元，顯示投資人參與度相當高、市場資金充沛，受惠漲價題材、5G、電動車供電供應鏈相關個股，都可能是資金青睞的對象。,6
2018-06-14T07:09:00.000Z,Fed決議升息，並暗示今年將進一步升息，衝擊昨夜美股收低，亞股今日氣色不佳，台股在權值三巨頭台積電 (2330) 、大立光 (3008) 、鴻海 (2317) 聯袂走低，加上昨日爆量衝上8年高價的聯電 (2330) 腿軟回弱，包括電金傳權值股聯發科 (2454) 、台達電 (2308) 、台塑四寶、富邦金 (2881) 及國泰金 (2882) 等同步下挫，拖累指數大跌逾百點，並一路往11000點靠攏，尾盤國巨 (2327) 、玉晶光 (3406) 等遭空軍重襲，使指數跌點擴大，終場加權指數收在今日最低11013.98點、下跌159.23點，失守月線大關，成交值縮為1641.51億元。,-9
2018-06-14T07:09:00.000Z,FED今晨宣布升息1碼雖如市場預期，但暗示今年共將升息4碼，比市場原先預估多1碼，加上遇端午連假前賣壓干擾，使台股在台積電、鴻海及大立光等蘋果三雄帶頭重跌下，盤勢一路開低跌深，終場大跌逾百點，跌破11100點及月線等關卡。,-6
2018-06-14T06:45:00.000Z,Fed決議升息，並暗示今年將進一步升息，影響昨夜美股收低，亞股今日跟跌，台股在權值三指標台積電 (2330) 、鴻海 (2317) 、大立光 (3008) 領跌之下，指數開低走低，盤中雖有華通 (2313) 等電子零組件族群奮起抗跌，惟國巨 (2327) 、玉晶光 (3406) 等尾盤遭空軍追打，跌幅雙雙超過4%，大盤跌點隨之擴大，終場大跌159.23點，收11013.98點，月線告失，總成交值較昨日縮減至1641.51億元；店頭市場下跌0.29點，收157.58點，總成交值419.33億元。,-6
2018-06-14T06:45:00.000Z,"分析師表示，台股短線日KD值交叉向下，接下來看季線10,880點支撐，後市需密切留意外資態度是否出現大賣情形。",0
2018-06-14T06:45:00.000Z,後續要關注三重點，首先，明日美國是否開出對中國500億美元課稅清單，是否影響美中貿易的角力，進而影響台股；其次，近期盤面上常有20、30檔股票亮燈漲停，這種氣勢不宜淡化，以免人氣消散；第三、類股能否良性輪動，避免資金全集中在被動元件或矽晶圓等族群。,5
2018-06-14T06:18:00.000Z,（中央社記者韋樞台北2018年6月14日電）美國聯準會(FED)今天升息1碼，歐美股持平到小跌，亞股則一片綠，台股盤中跌幅加重逾百點，以最低點收盤。,-3
2018-06-14T06:18:00.000Z,法人表示，市場資金難免亂竄，但台股基本面仍佳，中長多格局不變。,-1
2018-06-14T06:18:00.000Z,台股終場下跌159.23點，收在最低的11013.98點，成交值新台幣1641.5億元。,-3
2018-06-14T06:18:00.000Z,美國聯準會升息1碼，歐洲央行將討論貨幣寬鬆政策退場問題，亞股一片倒，日、韓、港股跌幅較重，台股開低走低，早盤10時過後跌幅加重，指數下跌百餘點，半導體、光電等股領跌，蘋概三雄台積電 (2330) 、鴻海 (2317) 、大立光 (3008) 等跌幅約2.33%到2.62%。,-8
2018-06-14T06:18:00.000Z,股市資深分析師林成蔭表示，美國聯準會除今天宣布升息1碼，下半年不排除再升息兩次，且失業率下調，通膨不變；有可能造成市場預期心理，資金加速移往美國，造成新興市場股匯市走軟，估計未來一陣子國際市場資金難免到處流竄，台股多少會受影響。,-2
2018-06-14T06:18:00.000Z,林成蔭說，先讓資金流竄到一定程度，之後自然會找到平衡點；反觀台股基本面佳仍佳，中多行情不變，台股至多會先壓回到10800點，再向上逐步挑戰前波高點的11270點。,3
2018-06-14T06:01:00.000Z,（中央社記者張良知台北2018年6月14日電）美國聯準會如預期宣布升息1碼，台股今天開低走低，包括台積電等蘋概三雄及熱門族群被動元件、遊戲族群走弱。,-2
2018-06-14T06:01:00.000Z,台股加權指數終場以11013.98點作收，下跌159.23點，跌幅1.43%，成交值新台幣1641.50億元。,-3
2018-06-14T06:01:00.000Z,台股指數近期呈現震盪整理格局，建議擇優布局漲價概念及業績題材類股等。,2
2018-06-14T02:54:00.000Z,Fed決議升息，並暗示今年將進一步升息，傾向鷹派言論對股市構成壓力，影響昨夜美股收低，亞股今早跟跌，台股三大期指亦全數開低，隨後集中市場開盤下跌30.17點、以11143.04點開出，在權值三巨頭台積電 (2330) 、大立光 (3008) 、鴻海 (2317) 聯袂走低，加上昨日爆量衝上8年高價的聯電 (2330) 腿軟回弱，指數大跌百點，退守11100點之下，僅靠國巨 (2327) 、奇力新 (2456) 、華通 (2313) 等電子零組件族群奮起強攻，牽制空軍勢力。,-6
2018-06-15T07:26:00.000Z,台股因端午連假在即，市場買盤呈現觀望，早盤在三天王大立光 (3008) 、台積電 (2330) 、鴻海 (2317) 陷入整理下，多空勢力於11000點大關拉鋸，所幸金融股國泰金 (2882) 、富邦金 (2881) 及股后國巨 (2327) 挺身而出，加上台積電 (2330) 擺尾收高，最後一盤爆出422.82億元大量，拉升加權指數收在今日最高點11087.47點，上漲73.49點，重返月線大關，成交值放大至1899.78億元。,5
2018-06-15T07:26:00.000Z,　台股三天王大立光 (3008) 、鴻海 (2317) 盤下整理，台積電 (2330) 擺尾收高重返230元、二線光學股、博弈概念股受到內資力挺，玉晶光 (3406) 、伍豐 (8076) 表現搶眼，光碟雙雄錸德 (2349) 、中環 (2323) 亦擺脫回檔走勢，被動元件族群攻勢再起，國巨 (2327) 、禾伸堂 (3026) 、華新科 (2492) 、大毅 (2478) 聯袂勁揚，奇力新 (2456) 澄清無高層人員涉入內線交易案，亦未遭檢調搜索，股價收黑1%。,3
2018-06-15T07:26:00.000Z,受端午節連續假期在即，加上中美貿易戰疑慮再起，使今市場觀望氣氛偏濃，台股多於平盤附近來回震盪，所幸國泰金、富邦金等金融股撐盤，台塑化 (6505) 、統一 (1216) 等權值股力挺多方，加上台積電及國巨突圍建功，使指數守穩「萬一」之上，並重返月線關卡。,0
2018-06-15T07:26:00.000Z,後市若美股續強，台股仍有機會再拚高點。,1
2018-06-15T06:20:00.000Z,在端午節前夕，台股尾盤積極作價，最後一盤爆出422.82億元大量，台積電 (2330) 、金融股等大型股尾盤強拉，指數終場站上月線，終場以11087.47點作收，上漲73.49點，漲幅0.67％，成交金額1899.77億元。,4
2018-06-15T06:20:00.000Z,但尾盤強力擺尾，應為外資傑作，轉為買超機率大，接下來仍看端午過後，是否外資資金能否重回台股。,2
2018-06-15T06:07:00.000Z,（中央社記者田裕斌台北2018年6月15日電）台股早盤面臨短線賣壓，指數一度跌破11000點大關，不過，台積電 (2330) 尾盤向上拉抬，帶動指數穩守11000點及月線約11032點大關，最後一盤更強拉40點。,1
2018-06-15T06:07:00.000Z,分析師表示，台股早盤雖在電子權值股表現不佳下，一度逼近月線支撐，不過大立光 (3008) 、台積電陸續回神，金融股富邦金 (2881) 、國泰金 (2882) 穩住陣腳，午盤後集中市場明顯轉強，櫃買市場則是由紅翻黑。,0
2018-06-15T06:07:00.000Z,分析師表示，指數尾盤大拉穩住盤勢，月線確認支撐力道，買盤是否來自於外資值得觀察，不過，新台幣匯率今天走貶，盤中一度觸及30元大關，是否觸動外資持續賣股的壓力，也是台股能否結束本波修正走勢的關鍵。,1
2018-06-15T00:26:00.000Z,外資翻臉賣股走人，昨（14）日賣超集中市場擴大至近144億元，八大官股券商出手護盤台積電 （2330） 、中華電 （2412） 及台塑 （1301） 等大型權值股，買超近27億元，惟仍難力挽狂瀾，台股昨日收盤仍重挫159點，今日面臨「萬一」關卡保衛戰。,0
2018-06-15T00:26:00.000Z,　法人認為，散戶融資餘額昨日絲毫不畏盤勢大跌逆勢增，但融資餘額可謂 「水能載舟也能覆舟」，融資衝高後，若盤勢無法止跌，恐將引發下一波多殺多賣盤；而搶帽客操作「打帶跑」的情況加劇，再加上外資昨日賣股走人，賣超擴大至近144億元，對台股後市持保留看法。,-3
2018-06-15T00:22:00.000Z,"台股早盤小幅跳空低開，盤中亞股持續走弱，台股在台積電 (2330) 與金融類股拖累下，指數一路下滑，尾盤跌破月線，最終收盤指數下跌159點，跌幅1.43%，收在11,013.98點。",-8
2018-06-15T00:22:00.000Z,　技術面與籌碼面：　均線：台股周四收長黑K棒，跌破月均線。,-2
2018-06-19T07:02:00.000Z,中美貿易戰砲火隆隆，台股大跌逾180點，權值股首當其衝，大立光 (3008) 、國巨 (2327) 大跌5%以上，台積電 (2330) 、鴻海 (2317) 跌逾2%，僅風電、LED等族群強勢。,1
2018-06-19T07:02:00.000Z,終場台股收在10904.19點，下跌183.28點，成交量1695.04億元。,-2
2018-06-19T07:02:00.000Z,  中美貿易大戰重啟，台股「端午變盤」大跌183點，5日RSI為29.06，10日RSI為41.21，9日K值為32.09，9日D值為52.53，20日乖離率為-1.14，三大法人賣超224億元。,-2
2018-06-19T07:02:00.000Z,美國課徵大陸關稅名單釋出、大陸還以顏色，台股恐無法置身事外，惟台灣銀行存放款利率達歷史新低、台積電等大型權值股除息大戲登場，以及蘋概股將重回盤面焦點等因素支持，台股後市先不用太悲觀。,-5
2018-06-19T05:58:00.000Z,（中央社記者鍾榮峰台北2018年6月19日電）美中互祭高關稅，亞股重挫，台股未能倖免，終場下跌183點，失守月線和11000點大關。,-3
2018-06-19T05:58:00.000Z,法人表示，台股收在11000點之下整理，短線台股走勢盤整，等待市場進一步反應。,1
2018-06-19T05:58:00.000Z,美中互祭高關稅、貿易戰升溫，亞股重挫，台股也未能倖免，不僅月線11031點失守，也跌破11000點大關，力守10900點整數關卡，逼近季線10879點。,-3
2018-06-19T05:58:00.000Z,午盤橫向整理，尾盤電金弱勢，台股大跌逾180點，守住10900點大關。,-1
2018-06-19T05:58:00.000Z,終場台股加權股價指數終場收在10904.19點，下跌183.28點，跌幅1.65%，成交值新台幣1695.04億元，電子股下跌2.04%，金融股跌1.3%。,-3
2018-06-19T05:58:00.000Z,元富投顧總經理劉坤錫表示，美中貿易戰升溫，週一部分亞股已先行反應，台股今天下挫，主要還是受到美中貿易戰影響。,-1
2018-06-19T05:58:00.000Z,劉坤錫指出，美中貿易戰升溫，可能對全球金融市場產生壓力，台股11000點是關鍵，今天台股收盤在11000點之下整理，短線台股走勢盤整，等待市場進一步反應。,0
2018-06-19T02:34:00.000Z,（中央社記者鍾榮峰台北2018年6月19日電）美中互祭高關稅，台股盤中一度大跌逾180點，失守月線，逼近季線。,-3
2018-06-19T02:34:00.000Z,法人表示，大盤下殺，加上新台幣匯率走貶，外資有撤出跡象，預期台股短線走勢震盪整理。,-1
2018-06-19T02:34:00.000Z,美中互祭高關稅、貿易戰升溫，台股早盤重挫逾百點，不僅失守月線11030點，也跌破11000點大關，電子金融跌幅加深，盤中加權指數一度大跌逾180點，逼近季線約10879點，力守10900點整數關卡。,-5
2018-06-19T02:34:00.000Z,到10點30分，台股加權指數來到10918.43點，下挫169.04點，成交值新台幣824.76億元。,-1
2018-06-19T02:34:00.000Z,國泰證期顧問處協理簡伯儀指出，台股今天受到美中貿易戰升溫影響、開低走低，跌破月線支撐，預估今天量能在1780億元左右。,-3
2018-06-19T02:34:00.000Z,簡伯儀指出，今天電子股回檔，大盤下殺，加上新台幣兌美元匯率走貶，外資有撤出跡象，若外資未持續加碼，預期台股短線走勢震盪整理。,1
2018-06-19T02:30:00.000Z,中美貿易大戰重啟，昨夜美股下跌，今早亞股跟隨走弱，台股「端午變盤」魔咒被打開，6月台指期開盤大跌百餘點，金融期及電子期聯袂開低，集中市場開盤下跌78.7點、以11008.77點開出，受權值股台積電 (2330) 、大立光 (3008) 下跌影響，加權指數不斷下修，最低一度大跌逾170點，台股失守6月4日多方缺口。,-9
2018-06-19T02:30:00.000Z,分析師表示，台股極短線一定是保守盤，預期中美貿易大戰還是會拖，這個時間點選擇本益比不要太高的，內需股如風力發電族群今日表現較為強勢，但此一族群尚未繳出獲利，追高宜慎。,-1
2018-06-19T01:24:00.000Z,（中央社記者鍾榮峰台北2018年6月19日電）美中互祭高關稅，台股今天甫開盤跌破11000點大關。,-1
2018-06-19T01:24:00.000Z,台股今天開盤也未能倖免，甫開盤就跌破11000點大關，最低來到10946點，下挫140點，失守月線約11033點，隨後跌幅漸收斂，來到10960點附近，下跌120點。,-6
2018-06-20T09:05:00.000Z,週二美股在貿易戰的陰影下大跌，道瓊指數今年來漲幅全數回吐，不過台股經歷昨日重挫後，權直股出面穩軍心，大立光 (3008) 、台積電 (2330) 翻紅，國泰金 (2882) 、富邦金 (2881) 、兆豐金 (2886) 、中信金 (2891) 等大型金控股上漲逾1%，大盤指數在11點半過後往平盤靠攏，進而成功翻紅，守住季線。,1
2018-06-20T09:05:00.000Z,終場台股收盤漲23點，為10927點。,1
2018-06-20T09:05:00.000Z,  台股力抗空頭，今日小漲23點，5日RSI為33.27，10日RSI為43.11，9日K值為28.14，9日D值為44.40，20日乖離率為-0.92。,0
2018-06-20T09:05:00.000Z,台股經大幅回檔修正，技術面跌破月線，且三大法人昨日賣超200多意，嚇壞投資人，今日雖然季線有守，但國際股市普遍弱勢，短期中美貿易攻防未有退讓跡象，外資持股較高的權值股仍需小心，與中美連動性不高的個股則成為避險天堂。,-1
2018-06-20T08:43:00.000Z,藝人陶晶瑩今天現身花旗財管「國人財富態度大調查」活動，陶晶瑩表示，個人投資理財都交由專業理專，偶爾自己也投資股票，如美股和台股，至於陸股方面，因為工作太忙不熟悉，所以至今尚未投資陸股。,2
2018-06-20T06:16:00.000Z,（中央社記者江明晏台北2018年6月20日電）美中貿易戰恐升溫，美股道瓊指數大跌、歐股收黑，台股早盤回測半年線，但在國巨跌幅收斂，台積電、大立光等蘋概股力守下，震盪翻紅，終場收復季線、10900點關卡，收10927.44點。,0
2018-06-20T06:16:00.000Z,台股加權股價指數今天終場上漲23.25點，收在10927.44點，漲幅0.21%，成交值新台幣1780.62億元。,2
