PublishDate,Sentence,Score
2018-04-23T01:39:00.000Z,（中央社記者張建中新竹2018年4月23日電）台積電 (2330) 申讓太陽能廠茂迪 (6244) 9700張持股，衝擊茂迪股價表現疲弱，盤中一度達新台幣21.65元，跌幅達6.48%。,-2
2018-04-23T01:39:00.000Z,台積電過去曾跨足太陽能領域，除成立子公司台積太陽能，並斥資新台幣約62億元，參與茂迪私募，取得茂迪20%股份，成為茂迪最大股東。,1
2018-04-23T01:39:00.000Z,只是太陽能產業嚴重供過於求，台積太陽能因未能發展出穩定獲利模式，考量缺乏經濟規模，成本上不具競爭優勢，業務發展不具長期經濟效益，最終以關廠結束，台積電也將茂迪轉為財務性投資，並釋出部分持股。,3
2018-04-23T01:39:00.000Z,台積電近日對茂迪展開新一波釋股行動，申讓茂迪9700張持股，有效轉讓期間為今天起至5月22日，預定轉讓後台積電持有茂迪股份將降至4861萬9782股。,2
2018-04-23T01:39:00.000Z,茂迪今天股價表現疲弱，開低震盪走低，盤中一度達21.65元，跌1.5元，跌幅達6.48%。,-5
