PublishDate,Sentence,Score
2017-07-04T05:53:00.000Z,加權股價指數終場下跌65.01點、跌幅0.62%、收在10347.78點、成交值新台幣920億元，在亞股中跌幅稍輕，主要來自於金融股的貢獻，國泰金、富邦金今天持續穩健填息腳步，明天除息的開發金 (2883) 及月中除息的元大金 (2885) 、中信金 (2891) ，近期走勢都相當強勁。,1
2017-07-04T02:46:00.000Z,國際股市漲跌不一，台股大盤今早亦在台積電 (2330) 、鴻海 (2317) 、面板雙虎等主要權值指標紛紛走弱的影響下，開盤下跌14.86點，以10397.93點開出，所幸長榮海 (2603) 揚升近6%，推升航運類指大漲近2%，加上國泰金 (2882) 、富邦金 (2881) 、元大金 (2885) 齊漲支撐金融類指守穩高檔，大盤跌點並未擴大，盤中，中經院公布6月PMI降至57.6%，惟仍連16月擴張，多空並無太大反應，指數遂於10400低檔狹盤。,2
2017-07-04T05:53:00.000Z,加權股價指數終場下跌65.01點、跌幅0.62%、收在10347.78點、成交值新台幣920億元，在亞股中跌幅稍輕，主要來自於金融股的貢獻，國泰金、富邦金今天持續穩健填息腳步，明天除息的開發金 (2883) 及月中除息的元大金 (2885) 、中信金 (2891) ，近期走勢都相當強勁。,1
2017-07-04T02:46:00.000Z,國際股市漲跌不一，台股大盤今早亦在台積電 (2330) 、鴻海 (2317) 、面板雙虎等主要權值指標紛紛走弱的影響下，開盤下跌14.86點，以10397.93點開出，所幸長榮海 (2603) 揚升近6%，推升航運類指大漲近2%，加上國泰金 (2882) 、富邦金 (2881) 、元大金 (2885) 齊漲支撐金融類指守穩高檔，大盤跌點並未擴大，盤中，中經院公布6月PMI降至57.6%，惟仍連16月擴張，多空並無太大反應，指數遂於10400低檔狹盤。,2
2017-07-11T10:36:00.000Z,金融股也獲外資買盤加持，中信金 (2891) 買超張數達1.2萬張，國泰金 (2882) 、元大金 (2885) 、新光金 (2888) 、兆豐金 (2886) 、永豐金 (2890) 都排在今天外資買超前25名。,4
2017-07-28T07:11:00.000Z,金融股弱勢整理，富邦金 (2881) 、國泰金 (2882) 、元大金 (2885) 成領跌指標。,-2
