PublishDate,Sentence,Score
2018-12-25T06:42:00.000Z, 盤面上，韓國瑜今天就任高雄市長，呼籲中央開放陸資高雄買房，支撐今日營建股中的高雄概念股無畏台股大跌百餘點，京城 (2524) 、遠雄 (5522) 逆漲，隆大 (5519) 、國揚 (2505) 、永信建 (5508) 等溫和下跌，表現優於大盤。,5
2018-12-27T02:08:00.000Z, 9.京城 (2524) ：「雄」概股熱度不熄，外資由減碼變加碼，股價在季線之前止跌反彈，漲幅高達8%。,3
2018-12-14T07:18:00.000Z,金融股因企業爆發財務危機憂心忡忡，京城銀 (2809) 、富邦金 (2881) 、國泰金 (2882) 、新光金 (2888) 跌勢尤重。,-5
2018-12-25T06:42:00.000Z, 盤面上，韓國瑜今天就任高雄市長，呼籲中央開放陸資高雄買房，支撐今日營建股中的高雄概念股無畏台股大跌百餘點，京城 (2524) 、遠雄 (5522) 逆漲，隆大 (5519) 、國揚 (2505) 、永信建 (5508) 等溫和下跌，表現優於大盤。,5
2018-12-27T02:08:00.000Z, 9.京城 (2524) ：「雄」概股熱度不熄，外資由減碼變加碼，股價在季線之前止跌反彈，漲幅高達8%。,3
