PublishDate,Sentence,Score
2017-03-09T07:06:00.000Z,塑化股昨天由二線廠領軍抗跌，今天台塑四寶齊跌，受到國際油價大跌逾 5% 拖累，台塑、南亞、台化、台塑化等，平均跌幅超過 2%，也壓抑台達化、國喬、台苯、中石化、再生 - KY、聯成、台聚、萬洲、東洋、永裕、昭輝等跌逾 1%。,-6
2017-03-10T07:05:00.000Z,原物料族群因油價跌落50美元拖累成為重災區，台塑四寶南亞 (1303) 、台化 (1326) 、台塑 (1301) 、台塑化 (6505) 續弱，二線族群台達化 (1309) 、華夏 (1305) 齊挫4%以上跌勢尤重，聯成 (1313) 、亞聚 (1308) 、國喬 (1312) 、台聚 (1304) 跟進走軟。,-3
2017-03-10T06:02:00.000Z,   國際油價跌破50美元大關，導致全球對原油供給疑慮擔憂再度升高，台塑四寶今日持續修正，但跌幅已經相較昨收斂，二線塑化股反而跌幅較大，台達化 (1309) 、華夏 (1305) 下跌幅度最大，盤中走跌約5.5%~4.5%，聯成 (1313) 跌幅也達3.5%，其他亞聚 (1308) 、國喬 (1312) 、台聚 (1304) 也全數壓回震盪。,-7
2017-03-10T02:37:00.000Z,  與原物料連動關係強的族群個股為空方攻擊標的，由於國際原油庫存量持續令市場十分擔憂，美國能源資訊局(EIA)預估該國原油日產量今年將高達920萬桶，且更有市場大膽預測油價會回測到42美元左右，台塑四寶台塑 (1301) 、台化 (1326) 、南亞 (1303) 、台塑化 (6505) 今聞訊全數走低，又以台化下跌約2%的修正幅度較大，二線塑化股華夏 (1305) 更是大跌6.5%，台達化 (1309) 重挫逾5%，其餘台苯 (1310) 、國喬 (1312) 、中石化 (1314) 等跌幅也達3%左右。,-9
2017-03-16T07:06:00.000Z,國際油價大漲帶動塑化股齊揚，台塑四寶南亞 (1303) 、台化 (1326) 、台塑化 (6505) 、台塑 (1301) 攜手喊衝，激勵二線塑化股國喬 (1312) 、華夏 (1305) 、台達化 (1308) 、台苯 (1310) 、聯成 (1313) 同步大漲。,7
