PublishDate,Sentence,Score
2018-01-02T02:58:00.000Z,截至10時30分，加權股價指數上漲35.97點、為10678.83點、成交值427.13億元，不但集中市場量縮，櫃買指數今天量能更恐不到300億元，將創去年10月以來新低量。,-3
2018-01-04T06:15:00.000Z,儲祥生說，台股前一交易日大漲後，今天漲勢稍微緩和，只要外資沒大買，台股就陷入整理，不過外資近日加碼櫃買市場，使櫃買指數破波段新高，集中市場行情也不會太差。,3
2018-01-02T02:58:00.000Z,截至10時30分，加權股價指數上漲35.97點、為10678.83點、成交值427.13億元，不但集中市場量縮，櫃買指數今天量能更恐不到300億元，將創去年10月以來新低量。,-3
2018-01-04T06:15:00.000Z,儲祥生說，台股前一交易日大漲後，今天漲勢稍微緩和，只要外資沒大買，台股就陷入整理，不過外資近日加碼櫃買市場，使櫃買指數破波段新高，集中市場行情也不會太差。,3
2018-01-05T05:52:00.000Z,  台股指數今日出現罕見的連七紅，目前短中長期均線持續走揚格局，KD與MACD指標均呈現偏多訊號，不僅如此，在籌碼面上，外資在連假後積極於期現貨同步作多，量能持續加溫但未有失控狀況，台股下周續攻前波高點10882點可期，另外，現階段櫃買指數漲勢相對加權指數強勁，前高已經突破，目前站在月、季線之上，留意後勢若能量價齊揚，未出現背離，中小型個股有機會表現。,11
2018-01-05T02:50:00.000Z,台股從2017年12月27日展開反彈行情連6漲，指數上漲近400點，各日均線均翻揚，櫃買指數今天盤中續創153.47點新高。,2
2018-01-09T02:51:00.000Z,國泰證期顧問處協理簡伯儀表示，台股開平高，大盤指數站上波段新高後，拉回震盪整理，大盤與月線正乖離有擴大的跡象，OTC櫃買指數也高檔回落。,4
2018-01-18T07:31:00.000Z,周三美股全面大漲，道瓊、費半指數再創新高！昨日站上11000點的台股今日依舊氣勢如虹，在權王台積電 (2330) 衝高領軍下，鴻海 (2317) 、大立光 (3008) 同步走揚，盤中指數一度大漲逾百點，攻抵11122.82點，續創近28年新高價，半導體、遊戲族群走勢尤為強勁，終場加權指數上漲66.77點為11071.57點，成交值為1489億元；櫃買指數同步登高，收在153.02點、上漲0.65點。,12
