PublishDate,Sentence,Score
2017-11-08T07:03:00.000Z,　蘋果iPhoneX銷售強勁，股王大立光 (3008) 扮演多頭主帥，華通 (2313) 挾業績利多強勢漲停，玉晶光 (3406) 、亞光 (3019) 、正崴 (2392) 等光芒再現，惟昨日創下收盤新高的台積電 (2330) 出現回檔走勢，記憶體族群旺宏 (2337) 、華邦電 (2344) 及面板雙雄群創 (3481) 、友達 (2409) 同步熄火，削弱多頭士氣；PCB、LED、矽晶圓等族群人氣火紅，第三季轉盈的燿華 (2367) 放量衝高，晶電 (2448) 軋空助威股價再創波段新高，帶動隆達 (3698) 飆高、兆遠 (4944) 強攻漲停，合晶 (6182) 挾亮眼業績登上40元。,15
2017-11-08T06:12:00.000Z,矽晶圓市場供應仍吃緊，環球晶 (6488) 第三季獲利亮麗，合晶 (6182) 業績續強。,2
2017-11-08T03:08:00.000Z,矽晶圓市場供應仍吃緊，環球晶 (6488) 第三季獲利亮麗，合晶 (6182) 業績也續強。,2
2017-11-10T06:18:00.000Z,分析師表示，投資人由於9日午盤後台股出現跳水式下殺，加上國際股市表現疲弱，多頭追價意願不足，所幸矽晶圓族群率先走揚，環球晶、合晶 (6182) 聯袂拉出漲停，中美晶 (5483) 大漲。,1
2017-11-13T04:27:00.000Z,買盤觀望，台股指數緩步邁向月線！美國超級財報周及台股第3季季報陸續公布，甫於上周一創下創27年新高的台股指數在上周四及上周五遭逢亂流，失守月線，讓多頭氣勢受挫，儘管股王-大立光 (3008) 、台積電 (2330) 、鴻海 (2317) 及蘋果供應鏈的10月合併營收表現出色，但股價不漲或走弱，上周強勢的晶電 (2448) 重挫，紡織龍頭廠儒鴻 (1476) 探底，加上上周五美股收低且今天日股開低，讓台股指數以小黑開出，所幸具題材的中小型股如：博磊 (3581) 、光耀 (3666) 、大宇資 (6111) 、精材 (3374) 、立康 (6242) 、生展 (8279) 等強攻漲停板，節能股如：合晶 (6182) 續強，穩住多頭信心。,7
2017-11-22T06:28:00.000Z,  台積電ADR再創新高，台積電早盤244.5元差0.5元平新高，蘋果供應鏈表現不錯，股王大立光 (3008) 領軍，玉晶光 (3406) 等光學族群再度放光芒，蘋概股可成 (2474) 續攻；漲價題材的國巨 (2327) 續強，合晶 (6182) 也在高檔；今年具轉機題材的晶電 (2448) 早盤持續上攻，以及具高人氣的雙D，包括TFT面板的群創 (3481) 、友達 (2409) ，DRAM的南亞科 (2408) 、華邦電 (2344) 續上揚。,11
