PublishDate,Sentence,Score
2017-04-05T06:54:00.000Z,鴻海大漲激勵同為iPhone代工廠的和碩 (4938) 股價翻紅，台積電 (2330) 、股王大立光 (3008) ，以及可成 (2474) 、台郡 (6269) 等蘋概股全面上攻，加上金融指數同步開高，國泰金 (2882) 、中信金 (2891) 等大型金控上揚，傳產老大哥中鋼 (2002) 、台塑 (1301) 走穩盤上，多方氣勢如虹，指數一路過關斬將，收在最高點9949.48點，上漲137.96點。,8
2017-04-05T06:54:00.000Z,新台幣急升，壽險Q1恐見高額匯損，促使金融股走勢分歧，富邦金 (2881) 賣壓沉重，跌逾1%，國泰金 (2882) 因澄清匯損衝擊不大，股價守穩盤上；玉山金 (2884) 因股利維持高水準，今日持續反彈格局，回到5日、10日與月線之上。,-3
2017-04-05T01:49:00.000Z,  今為清明節四天連假後首日，台股多頭展現攻勢，帶量上攻，電子主攻，國泰金 (2882) 、兆豐金 (2886) 等大型金控上揚，中鋼 (2002) 、台塑 (1301) 等原物料股走勢亦穩；今早僅航空股的華航 (2610) 、長榮航 (2618) 受到利空打壓，股價走跌。,1
2017-04-07T07:08:00.000Z,　台股早盤受到美軍向敘利亞發射導彈訊息傳出，在台積電 (2330) 、鴻海 (2317) 、和碩 (4938) 等蘋概股表現弱勢，且國泰金 (2882) 、富邦金 (2881) 與台塑 (1301) 等權值股也無力撐盤下，使短線逢高獲利回吐賣壓大舉出籠，盤中急殺逾百點、退防9800點，萬點行情越走越遠！所幸股王大立光 (3008) 盤中翻紅、收在4700元，宏達電 (2498) 也在3月營收雙成長下，股價逆勢抗跌；3月營收告捷的智伸科 (4551) 、邑錡 (7402) 、德微 (3675) 、偉詮電 (2436) 、雷科 (6207) 等無懼大盤重挫攜手攻上漲停，表現最為亮眼；網通股昇達科 (3491) 、智邦 (2345) 、明泰 (3380) 、眾達-KY (4977) 等續扮多頭指標強勢走揚。,5
2017-04-07T02:08:00.000Z,  瑞銀證點選的「最青睞個股名單」包括:台積電 (2330) 、日月光 (2311) 、和碩 (4938) 、鴻海 (2317) 、國泰金 (2882) 、富邦金 (2881) 、台灣大 (3045) 。,1
2017-04-10T07:01:00.000Z,金融股擺尾收高，國泰金 (2882) 、玉山金 (2884) 、兆豐金 (2886) 成領漲指標。,2
2017-04-10T07:01:00.000Z,台股今日因國泰金、兆豐金與台塑四寶等集團股力挺短多，化解台積電、大立光與航運等權值股弱勢演出，使盤勢開高震盪趨堅。,0
2017-04-10T06:47:00.000Z,金融權值股則由兆豐金 （2886） 、國泰金 （2882） 漲逾1％領軍，富邦金 （2881） 亦漲近0.5％。,2
2017-04-10T06:13:00.000Z,現在談獲利了結還過早，第二季動能仍可持續，預期恐第三季賣壓才會出籠，重申台股目標指數9850點；在投資組合中，較青睞台積電(2330)、和碩(4938)、鴻海(2317)、國泰金(2882)、富邦金(2881)、台灣大(3045)等；至於較不青睞的個股則為宏達電(2498)、鴻準(2354)、緯創(3231)、上銀(2049)。,2
2017-04-10T02:53:00.000Z,傳產及金融權值股接力撐盤，由首季獲利破百億的國泰金 （2882） 穩揚逾1％領攻，台塑 （1301） 、台化 （1326） 、台塑化 （6505） 、兆豐金 （2886） 等漲近1％。,2
2017-04-11T09:36:00.000Z,在各大期指的表現上，雖然台積電與鴻海兩大權值股收在平盤之上，但股王大立光先前對於 4 月份業績展望偏弱，回檔約 2%，聯發科由於中國智慧型手機市場雜音未除，跌幅逾 2%，電子期收低 0.57%；周一領軍金融股反彈的國泰金下挫 1.5%，富邦金亦弱勢呈現，金融期下跌 0.67%，季線支撐失守；傳產族群中，雖然台塑四寶首季獲利年增 95%，然而周一股價已有提前反應，台塑化拉回近 1%，加上其他類股普遍下跌，非金電期收低 0.68%。,2
2017-04-11T06:59:00.000Z,金融股表現相對疲弱，國泰金 (2881) 、開發金 (2883) 、新光金 (2888) 遭空頭襲擊賣壓尤重，拖累指數跌落季線關卡。,-6
2017-04-11T06:59:00.000Z,台股今日受制國泰金、統一 (1216) 與聯發科 (2454) 等龍頭股表現疲軟，且股王大立光呈開低殺低窘境，令短多士氣低迷不振，終場失守月線大關。,-4
2017-04-17T06:08:00.000Z,金融股富邦金 (2881) 跌0.11%，收47.25元；國泰金 (2882) 跌0.53%，收47.25元；兆豐金 (2886) 、中信金 (2891) 平盤，分別收24元、18.45元。,-1
2017-04-18T07:06:00.000Z,金融股持續探低，富邦金 (2881) 、國泰金 (2882) 相對弱勢。,-1
2017-04-18T07:06:00.000Z,台股受惠電子、傳產攜手反彈，化解國泰金、富邦金等金融股走疲壓力，今日盤勢開高走高，收漲30.16點，五日線得而復失。,2
2017-04-18T06:32:00.000Z,台股今日在指標股台積電 (2330) 領軍電子族群持穩盤勢，加上為升 (2231) 等車電展概念股強攻的氛圍下，盤初一度來到9771點、站上5日線，惟富邦金 (2881) 、國泰金 (2882) 、彰銀 (2801) 等持續疲弱拖累金融類股壓低整理，牽制多頭上攻力道，終場集中市場上漲30.16點，收在9746.56點，離5日線仍差一步，總成交值則降至714.28億元；店頭市場小漲1.64點，收在131.63點，總成交值255.09億元。,0
2017-04-18T06:24:00.000Z,金控股相對疲軟，國泰金 (2882) 收在46.9元，跌0.74%，富邦金 (2881) 收46.5元，跌1.59%。,-1
2017-04-18T03:01:00.000Z,金控股國泰金 (2882) 、富邦金 (2881) 盤中弱勢。,-1
2017-04-19T06:54:00.000Z,英國宣布提前大選，英鎊強升拖累歐美股市同步走弱，台股今日跟進開低，在電金及原物料族群不支，台積電 (2330) 、鴻海 (2317) 、國泰金 (2882) 、中鋼 (2002) 、台塑 (1301) 等權值股同步下跌，使盤中指數跌破季線及9700點，午盤過後殺盤力道加重，終場加權指數下跌106.62點為9639.94點，創下逾1個月新低，成交值放大至873.79億元。,-7
2017-04-19T05:55:00.000Z,其中，金融股續弱是台股多頭近期受阻的主因，包括富邦金 (2881) 、國泰金 (2882) 已經盤跌接近1個月。,-1
2017-04-19T03:16:00.000Z,其中，金融股續弱將是台股多頭受阻的主因，包括富邦金 (2881) 、國泰金 (2882) 已經盤跌接近1個月，即使電子權值股鴻海 (2317) 、台積電 (2330) 近來相對有撐，但指數卻持續下探支撐，在金融股尚未回穩撐盤前，台股難有表現。,-2
2017-04-20T06:59:00.000Z,金融股在富邦金 (2881) 、國泰金 (2882) 、中壽 (2823) 等壽險股領彈下終見止跌訊號，帶動類紙收高0.34%。,0
2017-04-20T06:14:00.000Z,金融股漲多跌少，富邦金 (2881) 漲1.18%，收47.05元；國泰金 (2882) 漲1.19%，收46.75元；兆豐金 (2886) 漲0.42%，收24元；中信金 (2891) 跌0.27%，收18.3元。,0
2017-04-20T00:59:00.000Z,o弱勢股：1.權值股壓抑指數，台積電 (2330) 、鴻海 (2317) 、台塑化 (6505) 、大立光 (3008) 、台塑 (1301) 、國泰金 (2882) 、中鋼 (2002) 下跌。,-5
2017-04-21T07:02:00.000Z,周四美股主要指數收紅，那斯達克指數創下收盤新高，激勵亞股全面走揚，台股今日跟進開高，在股王大立光 (3008) 勇闖歷史天價及權值股台積電 (2330) 、鴻海 (2317) 、國泰金 (2882) 同步領軍下，指數重新站回9700點關卡，終場加權指數上漲84.72點為9717.41點，一舉收復五日線及季線大關，成交值縮至701.51億元，創近1個半月來新低；周線連2黑、本周下跌15.52點。,9
2017-04-21T07:02:00.000Z,金融股持續上演跌深反彈，國泰金 (2882) 、元大金 (2885) 、合庫金 (5880) 成領漲指標。,0
2017-04-21T06:05:00.000Z,分析師表示，台股今天漲勢幾乎全由權值股帶動，台積電上漲1.6%，股王大立光 (3008) 更是大漲超過3%，連近期相對弱勢的金融股也都有反彈，國泰金 (2882) 漲幅逼近1%，多頭攻勢沒人扯後腿。,4
2017-04-25T11:31:00.000Z,鉅亨台北資料中心◆盤勢分析受到法國選舉結果的利多影響，週一美國股市表現強勁，三大指數漲幅都超過 1%，而歐洲藍籌 50 更是大漲接近 4%，顯示國際市場相當看好法國選情，並預計自英國脫歐和川普當選後的民粹主義浪潮能夠有效抑止，在偏多氛圍轉強下，週二台指期也一掃前一日的疲態，期指不但盤初開高，權重股如台積電、國泰金和台塑化都成為領漲的要角，特別是日前跌幅較重的金融股買氣回籠的狀況特別顯著，給予期指強勁的上漲動能，最後以上漲 107 點至 9814 點作收，重新站回 9800 點上並克服月均線反壓，透露出多方已有重整旗鼓的機會。,12
