PublishDate,Sentence,Score
2018-12-05T07:13:00.000Z,美債走勢示警經濟增長恐放緩，衝擊周二美股三大指數暴跌逾3%，亞股今日籠罩一片低氣壓，萬點好光景僅短短兩日的台股在蘋概股三天王台積電 (2330) 、鴻海 (2317) 與大立光 (3008) 齊步跳水下，開盤即摜破頸線10014點及萬點關卡，包括國泰金 (2882) 、富邦金 (2881) 、台塑 (1301) 、台化 (1326) 等傳金權值股同步走疲，加上日前強勢的被動元件、矽晶圓、二極體等漲價概念股聯袂拉回，衝擊早盤一度大跌逾180點，最低來到9895.29點，連續失守萬點及9900點關卡，終場加權指數下跌166.8點為9916.74點，成交值為1137.09億元。,-2
2018-12-22T00:00:00.000Z,　八大官股券商昨日買超、且12月來也是買超3億元以上，計有台積電、元大金、鴻海、台化、南亞、中美晶、台塑、華新科、國泰金、大同、遠東新、南亞科、微星等，明顯集中在電金產大型權值股，且不少是屬於集團龍頭股，以台塑集團股買超最積極。,3
2018-12-27T07:05:00.000Z,傳產股中的塑化、機電和金融股表現不俗，受到國際原油價格強彈激勵，台塑四寶台塑 (1301) 、南亞 (1303) 、台化 (1326) 、台塑化 (6505) 重啟攻勢，台塑化 (6505) 砲火猛烈推升油電燃氣類指大漲近6%，表現最為強悍。,7
2018-12-27T04:28:00.000Z,　權值股今日振奮，以傳產的台塑化 （6505） 漲近6％氣勢最旺，台積電 （2330） 、台化 （1326） 雙雙漲逾3％，股王大立光 （3008） 、聯發科 （2454） 、日月光投控 （3711） 、南亞 （1303） 、台塑 （1301） 漲逾2％。,3
2018-12-28T07:09:00.000Z,傳產股由台塑四寶台塑 (1301) 、南亞 (1303) 、台化 (1326) 、台塑化 (6505) 扮領攻要角，包括紡織、塑化、水泥以及汽車等漲勢領先；備受外界關注的浩鼎 (4174) 案一審獲判無罪，股價聞訊走高。,6
2018-12-28T06:02:00.000Z, 今日八大類股漲多跌少，紡織、塑化、水泥以及汽車等漲勢領先，台塑四寶台塑 (1301) 、南亞 (1303) 、台化 (1326) 、台塑化 (6505) 持穩撐盤，電子股則集中在中小型題材股，MOSFET缺貨態勢抵定，明年報價可望再度上調，尼克森 (3317) 大漲約4%，大中 (6435) 、富鼎 (8261) 、杰力 (5299) 等也齊揚。,4
