PublishDate,Sentence,Score
2018-07-02T07:12:00.000Z,台股早盤延續上周五強彈氣勢，在被動元件族群華新科 (2492) 、奇力新 (2456) 、信昌電 (6173) 、國巨 (2327) 攜手領軍，以及股王大立光 (3008) 、聯電 (2303) 同步點火下，指數一度強攻至10886點站上季線，惟矽晶圓族群環球晶 (6488) 、台勝科 (3532) 遭空頭狙擊、台積電 (2330) 變臉翻黑，以及金融及傳產股聯袂走跌，拖累指數由紅翻黑，尾盤更遭大單賣出壓低指數，終場加權指數下跌58.97點為10777.94點，10800點及季線大關得而復失，成交值為1425.81億元。,-1
2018-07-02T06:27:00.000Z,被動元件獨木難撐，台股虎頭蛇尾再度失守10800點！　被動元件及二極體續吹漲價風，被動元件及二極體個股今天扮演起多頭撐盤的要角，華新科 (2492) 旗下子公司蘇州華科針對部分緊俏產品向客戶發出漲價函，自2018年7月1日起依照出貨日調整MLCC價格，華新科、禾伸堂 (3026) 、信昌電 (6173) 等股價強攻漲停板作收，國巨 (2327) 重回1200元關卡，華新集團的瀚宇博 (5469) 亦同步漲停，二極體的德微 (3675) 盤中亦漲停，台半 (5425) 及強茂 (2481) 強勢收高，漲價題材個股及聯電 (2303) 一度帶領台股指數無畏亞股走弱攻克季線，不過中場過後，亞股跌幅擴大，日股、韓股及陸股不支倒地，矽晶圓的環球晶 (6488) 、台勝科 (3532) 、鴻海 (2317) 及台積電 (2330) 走弱，金融及傳產類股聯袂下挫，台股指數由紅翻黑後一路走低，並以今天最低點作收，終場加權股價指數為10777.94點，下跌58.97點，成交量為1425.81億元；OTC指數為152.96點，下跌0.57點，成交量為378.92億元。,0
2018-07-02T03:41:00.000Z,內資強攻，台股一度收復季線！美股連兩天反彈，台股也延續上周五強勢大漲180點長紅氣勢，在6月合併營收可望持續有亮眼表現的被動元件—華新科 (2492) 、奇力新 (2456) 、信昌電 (6173) 、國巨 (2327) ，以及股王大立光 (3008) 、聯電 (2303) 及台積電 (2330) 領軍下，台股指數以紅盤開出，更一度強攻至10886點，站上季線，不過矽晶圓的環球晶 (6488) 、台勝科 (3532) 、鴻海 (2317) 等走弱，且中場過後，台積電壓回平盤，金融及傳產類股走跌，加上亞股普遍拉回，拖累台股指數由紅翻黑，季線再度失守，截至11點20分為止，加權股價指數為10829.46點，下跌7.45點，成交量為855.45億元；OTC指數為153.87點，上漲0.34點，成交量為233.91億元。,3
2018-07-02T07:12:00.000Z,台股早盤延續上周五強彈氣勢，在被動元件族群華新科 (2492) 、奇力新 (2456) 、信昌電 (6173) 、國巨 (2327) 攜手領軍，以及股王大立光 (3008) 、聯電 (2303) 同步點火下，指數一度強攻至10886點站上季線，惟矽晶圓族群環球晶 (6488) 、台勝科 (3532) 遭空頭狙擊、台積電 (2330) 變臉翻黑，以及金融及傳產股聯袂走跌，拖累指數由紅翻黑，尾盤更遭大單賣出壓低指數，終場加權指數下跌58.97點為10777.94點，10800點及季線大關得而復失，成交值為1425.81億元。,-1
2018-07-02T06:27:00.000Z,被動元件獨木難撐，台股虎頭蛇尾再度失守10800點！　被動元件及二極體續吹漲價風，被動元件及二極體個股今天扮演起多頭撐盤的要角，華新科 (2492) 旗下子公司蘇州華科針對部分緊俏產品向客戶發出漲價函，自2018年7月1日起依照出貨日調整MLCC價格，華新科、禾伸堂 (3026) 、信昌電 (6173) 等股價強攻漲停板作收，國巨 (2327) 重回1200元關卡，華新集團的瀚宇博 (5469) 亦同步漲停，二極體的德微 (3675) 盤中亦漲停，台半 (5425) 及強茂 (2481) 強勢收高，漲價題材個股及聯電 (2303) 一度帶領台股指數無畏亞股走弱攻克季線，不過中場過後，亞股跌幅擴大，日股、韓股及陸股不支倒地，矽晶圓的環球晶 (6488) 、台勝科 (3532) 、鴻海 (2317) 及台積電 (2330) 走弱，金融及傳產類股聯袂下挫，台股指數由紅翻黑後一路走低，並以今天最低點作收，終場加權股價指數為10777.94點，下跌58.97點，成交量為1425.81億元；OTC指數為152.96點，下跌0.57點，成交量為378.92億元。,0
2018-07-02T03:41:00.000Z,內資強攻，台股一度收復季線！美股連兩天反彈，台股也延續上周五強勢大漲180點長紅氣勢，在6月合併營收可望持續有亮眼表現的被動元件—華新科 (2492) 、奇力新 (2456) 、信昌電 (6173) 、國巨 (2327) ，以及股王大立光 (3008) 、聯電 (2303) 及台積電 (2330) 領軍下，台股指數以紅盤開出，更一度強攻至10886點，站上季線，不過矽晶圓的環球晶 (6488) 、台勝科 (3532) 、鴻海 (2317) 等走弱，且中場過後，台積電壓回平盤，金融及傳產類股走跌，加上亞股普遍拉回，拖累台股指數由紅翻黑，季線再度失守，截至11點20分為止，加權股價指數為10829.46點，下跌7.45點，成交量為855.45億元；OTC指數為153.87點，上漲0.34點，成交量為233.91億元。,3
2018-07-14T02:19:00.000Z,"美中貿易戰峰迴路轉，在Nasdaq再創歷史新高激勵，股王大立光強勢站穩5,000元大關，帶動高價股多頭氣勢，台股前十大高價股中包括玉晶光、環球晶本周站穩500元關卡，高價族群再度成為盤面焦點。",10
2018-07-14T02:19:00.000Z,上市有大立光、國巨、矽力-KY、旭隼及玉晶光，上櫃有精測、信驊、精華、大江及環球晶。,0
2018-07-14T02:19:00.000Z,不過，近1個月上櫃高價股跌幅慘重，除大江近一個月逆勢上揚22.58％傲視群雄外，其餘精測、信驊及精華跌幅在10.28％至20.22％，環球晶則小跌0.78％。,-3
2018-07-14T02:19:00.000Z,　本周玉晶光受惠蘋果訂單加持，環球晶持續受惠矽晶圓供不應求，高價股逐步重返榮光。,1
2018-07-15T07:37:00.000Z,　本周另一個焦點是新一波除權息股，主要留意電子的環球晶、飛捷、晶電、瀚宇博，以及傳產的遠東新、為升、和泰車、瓦城、雄獅、豐泰、上緯投控等，環球晶股價達512元將除息10元，而為升、和泰車、瓦城、雄獅等高價位股除息也受到期待。,3
2018-07-16T06:25:00.000Z,被動元件帶衰，台股季線又失守！在上週隨全球股市反彈收復季線的台股今天只演了三分之一場好戲，台股開盤在上週五美股持續攻高帶動以紅盤開出，上週舉行法說會釋出樂觀訊息的股王—大立光 (3008) 盤中股價攻抵5130元，創下波段新高，生技類股、矽晶圓及Mosfet相關個股亦強出頭，佐登-KY (4190) 、慕康生醫 (5398) 及晟德 (4123) 盤中股價強攻漲停板，葡萄王 (1707) 、大江 (8436) 、寶齡 (1760) 、美時 (1795) 等收高，大中 (6435) 、尼克森 (3317) 、台勝科 (3532) 、合晶 (6182) 、環球晶 (6488) 強攻，讓台股早盤一度攻抵10890點，直逼10900點。,10
2018-07-16T04:31:00.000Z,　半導體的營收分散，相較於面板和記憶體個股，半導體的「中國製造、出口美國」占比較低，美系外資看好如台積電 (2330) 及環球晶 (6488) 等。,1
2018-07-16T03:52:00.000Z,中小型股當道，台股力拚站穩季線！  大陸與美國貿易戰利空逐漸鈍化，美股、陸股及亞股均在上星期強勢反彈，尤其是美國科技類股Nasdaq指數再創新高，搭配上週四法說會的股王—大立光 (3008) 釋出正面訊息，激勵台股擺脫之前頹勢，跟隨全球股市強力反彈，延續上週五以長紅收復季線氣勢，今天台股再由生技類股、矽晶圓及Mosfet相關個股領軍，佐登-KY (4190) 、慕康生醫 (5398) 強攻漲停板，葡萄王 (1707) 、大江 (8436) 、寶齡 (1760) 、美時 (1795) 等強勢上攻，大中 (6435) 、台勝科 (3532) 、合晶 (6182) 、環球晶 (6488) 強攻，帶動櫃買指數強勢走高，儘管受到陸股及港股走弱拖累，台積電 (2330) 休息，致使台股指數在中場過後由紅翻黑，但多頭企圖力守季線，指數在平盤附近游走，截至11點30分為止，加權股價指數為10860.4點，小跌4.14點，成交量為758.72億元；OTC指數為153.09點，上漲1.28點，成交量為258.72億元。,12
2018-07-17T07:13:00.000Z,環球晶 (6488) 除息首日出師不利，早盤一度填息6成變翻黑貼息，拖累矽晶圓族群台勝科 (3532) 、合晶 (6182) 同步轉弱。,-7
2018-07-19T07:13:00.000Z,矽晶圓族群環球晶 (6488) 3日填息達陣，提振合晶 (6182) 、台勝科 (3532) 多頭士氣。,1
2018-07-20T07:10:00.000Z,矽晶圓族群亦遭空頭襲擊，環球晶 (6488) 、嘉晶 (3016) 、合晶 (6182) 同步拉回。,-1
2018-07-23T07:03:00.000Z,太陽能矽晶圓廠中美晶 (5483) 除息首日出師不利面臨貼息窘境，環球晶 (6488) 、台勝科 (3532) 跟進壓回。,-3
2018-07-24T06:33:00.000Z,隨著被動元件與MOSFET族群股價回溫，同為缺貨漲價概念股的矽晶圓族群股價也同步走高，環球晶圓 (6488) 股價重返500元關卡之上，收在513元，漲15元，漲幅約3.01%。,5
