PublishDate,Sentence,Score
2017-06-09T06:10:00.000Z,  分析師指出，台股短線穩在高檔，顯示多頭趨勢不變，惟市場觀望英國大選會對脫歐決議產生衝擊，導致市場信心稍嫌不足，量能部分價平量增，有機會再攻高表現，另外，考量台股目前技術及籌碼面未出現轉弱現象，後續有機會持續驚驚漲行情，選股可留意5月營收成長、高殖利率概念股波段操作。,8
2017-06-09T06:09:00.000Z,（中央社台北2017年6月9日電）在費城半導體指數大漲下，亞股今天普遍走揚，台股早盤也一度再創波段新高10268點，但台積電 (2330) 創高後拉回，拖累電子股走低，指數也因而由紅翻黑，跌破10200點。,-1
2017-06-09T06:09:00.000Z,分析師表示，台股再創高後出現獲利了結賣壓，指數雖跌破5日線10213點，且日KD值高檔交叉向下，短線恐出現停利賣壓，但由於國際股市走勢仍相對穩健，台股雖有拉回疑慮，但尚無出現大幅回檔的危機。,-2
2017-06-09T02:50:00.000Z,（中央社台北2017年6月9日電）電子股依舊是台股的中流砥柱，在費城半導體大漲創高激勵下，台股今天持續向上攻堅，盤中再創波段新高10268點，週線可望收出3連紅的強勢表現。,8
2017-06-09T02:50:00.000Z,截至10時40分，加權股價指數上漲7.51點、為10233.29點、成交值新台幣493億元，雖然金融股表現欠佳，但股王大立光 (3008) 、權王台積電 (2330) 及人氣王鴻海 (2317) 都穩在盤上，台股雖有高檔獲利了結賣壓湧出，但指數力守平盤之上。,3
2017-06-09T02:50:00.000Z,分析師表示，台股維持碎步創高的驚驚漲態勢，雖然指數天天創新高，但成交量、融資餘額皆未出現暴衝走勢，顯示籌碼面依舊趨於穩定，下週有機會挑戰2000年2月高點10393點。,8
2017-06-09T02:50:00.000Z,法人也認為，台股持續獲外資關愛，外資不僅連6個月買超台股，今年1至5月買超金額更逾2400億元，高居亞股買超之冠，帶動台股指數頻創新高，在資金行情持續發酵，且市場暫無重大系統性下跌風險下，預期9月前台股可望延續震盪走高行情，不過，指數上漲空間相對有限，個股表現為主。,6
2017-06-09T02:44:00.000Z,美股四大指數全數收漲，科技股相對強勢，那斯達克再創新高，歐股則漲跌互見，主要還是因為英國大選，短線對於英國脫歐恐會有所衝擊，日韓股市強勢走揚，台股則開高12點，指數呈現高檔震盪，一度再創17年的新高，盤面以電子股為領軍主流，短線市場持續關注英國大選，以及台股5月營收、股東會行情等。,8
2017-06-09T02:44:00.000Z,  分析師指出，目前台股短期均線及KD指標多頭態勢不變，雖量能略有下滑，主要原因看來是因為市場觀望英國大選，短線對於英國脫歐將有所衝擊，不過對於市場來說，英國脫歐可能延遲或有所阻礙，反而可能不算利空，但因外資對台股維持買超立場，預期台股指數仍由業績優質股掛帥，盤面持續反應營收，業績股短線輪動趨勢未變，加上季底法人以及集團作帳題材，目前大盤可用之兵仍多，應可維持逐步盤堅續揚。,2
2017-06-10T01:37:00.000Z,　　歐系外資券商主管指出，從昨天台積股價下跌0.47％，但久未有表現的大立光卻上漲1.36％等跡象來看，蘋果供應鏈作為台股多頭主軸的基調並未改變，只是個股輪動，加上國際資金迄未有從台股抽離落跑跡象，因此，別太多慮。,0
2017-06-12T07:50:00.000Z,（中央社記者田裕斌台北2017年6月12日電）群益金鼎證券 (6005) 今天舉行投資理財說明會，預估下半年台股高點將挑戰10700點，由於第3季除息平減點數約400點，合理高點將落在10300點至10700點間。,3
2017-06-12T07:41:00.000Z,投顧認為，台股大盤指數收在10109.96點，跌89.69點，可視為過萬點後拉回整理，指數將回測萬點關卡，將是本週觀察重點，若能站穩萬點大關，台股後續走勢將正向發展。,3
2017-06-12T06:03:00.000Z,（中央社記者鍾榮峰台北2017年 6月12日電）美科技股重摔，蘋果下挫，亞股臉綠，台股因蘋概股無力，終場下跌近90點，收今天最低。,-6
2017-06-12T06:03:00.000Z,法人表示，外資持有台股籌碼穩健，大盤回檔幅度有限。,2
2017-06-12T06:03:00.000Z,美科技股那斯達克指數10日由歷史高峰重摔，蘋果（Apple）股價下挫3.88%，主要亞股今紛紛走弱，台股也無法倖免，台積電、鴻海和大立光為首的蘋概股無力，台股失守10日均線約10161點， 尾盤電子續弱，金融撐盤有限，台股收在今日最低點， 力守月線約10093點之上。,-7
2017-06-12T06:03:00.000Z,台股加權股價指數終場收在10109.96點，下跌89.69點，跌幅0.88%，成交值來到新台幣894.85億元，電子股跌1.33%，金融股漲0.36%。,-2
2017-06-12T06:03:00.000Z,台新高股息平衡基金經理人劉宇衡表示，台股5月11日收盤登上萬點後，漲勢慢慢由少數蘋概股向外擴散，台股位階處於相對高檔，投資人可審慎看待，不過目前外資持有台股比例仍高，籌碼相對穩健，加上國際情勢短期仍有利風險資產，預期近期大盤回檔幅度有限。,11
2017-06-12T04:07:00.000Z,美國科技股崩盤，台股失守10150點！美國科技股在上周五豬羊變色，在中場過後狂殺，包括台積電ADR重挫2.8%，引發外資台灣盤後期貨交易避險需求激增，爆出1.2萬口成交量創下新高，讓今天台股未開盤先籠罩下跌陰影中，尤其是蘋果重挫，蘋果概念股未開盤氣先虛，台積電 (2330) 、大立光 (3008) 、鴻海 (2317) 、和碩 (4938) 等蘋果供應商一開盤就跳空下跌，台股指數亦跳空下挫開出，失守10150點，不過建準 (2421) 、千如 (3236) 等5月合併營收出色的個股，以及買盤力挺的智邦 (2345) 、神盾 (6462) 、群電 (6412) 等強勢大漲，加上金融類股及造紙類股走提，穩住台股多頭信心。,4
2017-06-12T04:07:00.000Z, 　就技術面來看，受到美國四大指數全面上漲激勵，上周五台股以上漲13點10238點開出後，快速攻上盤中最高10268.37點，創下1997年8月27日以來新高後，獲利賣壓出籠，台達電 (2308) 、聯發科 (2454) 、和碩、研華 (2395) 等股價疲弱，指數拉回並由紅翻黑，收盤指數為10199.65點，收上影線，累計一周以來上漲41.5點，漲幅0.41%，周線連3紅，OTC指數部分，上周五呈現下挫0.5%，累計一周以來上漲0.21%。,4
2017-06-12T04:07:00.000Z,  今天台股在美國科技股重挫，台積電領跌下，指數跳空開低，不過中小型股力挺，逢低買盤不弱，指數小幅拉升；台股自4月中旬周KD回到50附近，即展開反彈，指數創波段新高，投資人也逐步習慣指數站上萬點，加權指數均線呈現多頭排列，仍未見疲態，指數有機會往2000年高點10393挑戰，惟周KD又已來至80的過熱區，需慎防突來的回檔，在櫃買指數部份，5月繳稅季節影響內資意願，但步入6月後，內資已回籠，指數過3月138.83點只是時間問題，且櫃買指數在3月下旬回檔後，進行約2個月的整理，櫃買周KD並未過熱，加上6月後逐步進入旺季，中小型股業績將明顯回升，櫃買指數均線也呈多頭排列，中小型股行情可期，選股上中小型股將優於大型權值股；不過台股連三周長紅棒，卻在上周五午盤過後出現下殺情況，日KD已由高檔下彎，預期本周攻勢暫緩，以高檔整理格局為主，故在操作部分不宜追高，預期指數修正空間不大，10100點附近應有所支撐。,8
2017-06-12T04:07:00.000Z,　台新高股息平衡基金經理人劉宇衡表示，台股在1990、1997、2000、2015(盤中)和2017年登上萬點，前3次因為泡沫破滅、國際系統因素衝擊，萬點行情破滅後，波段跌幅都相當可觀，市場因而心生恐懼。,-1
2017-06-12T04:07:00.000Z,以今年而言，5月11日台股登上萬點後，漲勢慢慢由少數蘋概股向外擴散，台股位階處於相對高檔，投資人確實應該保持戒心，但以當前外資持有台股比例高達41%，籌碼相對穩健，且而國際情勢短期內仍有利於風險資產，估計近期即使大盤回檔，幅度亦有限。,9
2017-06-12T04:07:00.000Z,　劉宇衡指出，今年以來外資買超台股已達2500億元，主要集中在蘋概股身上，除了看好蘋果的iPhone十周年新產品外，台股傲人的高現金殖利率也是重要賣點。,6
2017-06-12T04:07:00.000Z,金融海嘯後，台股企業進一步增發現金股息、降低股票配發，統計上市企業今年將發放1.17兆元的現金股息，再創歷史新高，6月密集股東會後就是除權息大戲，預期盤勢將維持高檔盤旋，高息的高殖利率個股將躍居盤面主流。,3
2017-06-12T04:07:00.000Z,　劉宇衡表示，高股息股可依三大方向布局：一、目前台股股息殖利率約在3.65%，可挑選殖利率在4~5%以上且具成長性的標的。,2
2017-06-12T02:50:00.000Z,（中央社記者鍾榮峰台北2017年 6月12日電）美科技股重摔，蘋果股價挫，台股盤中蘋概股失神，大盤暫跌破10日線10165點，力守月線10095點。,-2
2017-06-12T02:50:00.000Z,美科技股那斯達克指數10日由歷史高峰重摔，蘋果（Apple）股價下挫3.88%，牽動今日蘋概股走弱，電子權值股三大指標台積電、鴻海、大立光弱勢，金融撐盤有限，台股最低來到10114點，失守10日均線約10165點，盤中跌幅收斂橫向整理，力守月線約10095點之上。,-6
2017-06-12T02:50:00.000Z,到10點34分，台股加權指數來到10146.49點，下跌53.16點，跌幅0.52%，成交值來到新台幣425.5億元。,-3
2017-06-12T02:50:00.000Z,傳產股汽車盤中跌2.1%，橡膠跌0.8%，水泥跌0.5%，台新2000高科技基金經理人沈建宏表示，台股後市要留意半導體庫存和電子下游需求狀況。,0
2017-06-13T07:03:00.000Z,美股仍受蘋果拖累，周一主要指數收黑，晨間傳出巴拿馬證實與大陸建交利空消息干擾，台股今日小幅開低，盤中在台積電 (2330) 、鴻海 (2317) 等蘋概股回神，配合金融、傳產接棒撐盤，推升指數翻紅一路穩在10120點之上，終場加權指數上漲18.19點為10128.15點，成交值縮至794.34億元。,-3
2017-06-13T07:03:00.000Z,台股今日受惠台塑 (1301) 、國泰金 (2882) 、富邦金 (2881) 與統一 (1216) 等集團股力挺多方，且台積電力守榮面擔任穩盤角色，化解面板、南亞科等電子股拉回壓力，使盤勢開低震盪趨堅。,2
2017-06-13T07:03:00.000Z,分析師表示，短線在國際股市震盪下，投資人應審慎因應，預估台股整理機會較大；美股及亞股走勢仍是觀察重點，月底前重量級股東會的市場反應也將成為行情指標。,4
2017-06-13T06:38:00.000Z,歐美股市昨夜續弱，惟亞股今日多頭回神開低走高，而台股早盤雖小跌0.26點開出，且有與巴拿馬斷交政治雜音，惟在5月企業營運報喜，加上金融、傳產攜手撐盤，台積電 (2330) 、鴻海 (2317) 、大立光 (3008) 亦於盤中翻紅增添市場信心下，大盤指數整場持穩於10120~10130點高檔狹幅震盪，終場小漲18.19點，收在10128.15點，總成交值再縮至794.34億元；店頭市場小跌0.61點，收在136.34點，總成交值226.33億元。,9
2017-06-13T03:17:00.000Z,（中央社記者田裕斌台北2017年6月13日電）美股科技股連續2個交易日出現回檔走勢，台股雖然受到影響程度還好，但元大投顧杜富蓉認為，台股能否站穩萬點要看外資臉色，其中，重量級個股除息是指標。,1
2017-06-13T03:17:00.000Z,杜富蓉表示，雖然目前還看不出外資有流出台股的跡象，但一旦外資對台股出現連續3個交易日以上的大幅賣超，就必須擔心萬點能否站得穩，尤其是外資持股比重高、高現金股息的權值股，外資在領到股息後若不再投資轉而匯出，台股可能就會跌落萬點之下。,-4
2017-06-13T03:17:00.000Z,杜富蓉認為，截至今年6月7日止，新台幣已升值7.26%，加上台股平均4%的現金股息殖利率，吸引國際熱錢簇擁台灣，買超台股超過新台幣2600億元，也推升台股上漲超過10%，美國科技股輝達(Nvidia)、谷歌(Google)、Avago、蘋果(Apple)、特斯拉(Tesla)也都帶動國內蘋概、數據中心、網通、電動車供應鏈個股大漲，只要新台幣匯率無明顯貶值，台股對外資仍有一定吸引力。,7
2017-06-13T02:41:00.000Z,昨夜美股主要指數持續受蘋果拖累收黑，亞股今早跟隨走弱，台股開盤亦小跌0.26點，以10109.7點開出，盤初雖台積電 (2330) 、鴻海 (2317) 等蘋概族群持續疲弱，且傳出我邦交國巴拿馬證實與中國大陸建交的利空消息，惟昨日外資在台指期未平倉淨多單部位仍增加1688口，顯示短線上並未出現全面棄殺台股，另外上市櫃公司5月、前5月營收雙雙寫下歷年同期最高，提供基本面支撐，今日大盤由金融、傳產奮起護盤，輔以慶豐富 (9935) 等小型股積極挺進，支撐指數持續守穩10120點高檔之上。,3
2017-06-13T00:57:00.000Z,週一(6/12)亞股主要指數下跌；台股加權指數下跌 89.69 點(-0.88%)，漲/跌家數達 301/512家，形成價跌量縮、帶上影小黑 K，持續收在五日均線之下，延續拉回修正。,-1
2017-06-14T06:59:00.000Z,美股升勢再起，激勵台股開高，台積電 (2330) 股價有撐，可成 (2474) 再創今年新高，股王大立光 (3008) 今早股東會，股價同步向上。,5
2017-06-14T06:59:00.000Z,台股重跌亦影響除權息行情，樺漢 (6414) 今除息，早盤開漲後因賣壓湧現，股價下跌至366元，填息之路出師不利；寒舍 (2739) 也在今日除息，開高後跟隨大盤同步翻黑，盤中挫跌逾3%，雖然奮力翻紅卻後繼乏力，填息之路受挫。,-6
2017-06-14T06:59:00.000Z,台股今日收盤下跌55.69點，為10072.46點。,-2
2017-06-14T06:59:00.000Z,  外資持續賣超，今日三大法人賣超50.2億元，台股5日RSI為29.90，10日RSI為45.27，9日K值為36.69，9日D值為58.17，20日乖離率為-0.28。,-1
2017-06-14T06:59:00.000Z,"台股指數在創下10,268點波段新高之後，即出現快速回檔，今日失守月線，由於萬點以上投資人多居高思危，且外資連日來的賣超，已對台股產生壓力，指數恐面臨萬點保衛戰。",1
2017-06-14T02:58:00.000Z,分析師表示，台股近1個半月以來都站穩月線之上，今天盤中雖然跌破，但量能並未明顯暴增，顯示籌碼面仍未轉為凌亂，若國際股市現持穩，短線跌勢可望先視為多頭趨勢中的亂流。,-1
2017-06-14T02:58:00.000Z,法人指出，股王大立光 (3008) 近期股價連番下跌，對光學股造成不小壓力，加上近期強勢的遊戲、網通今天也都有走弱跡象，短線台股需先尋求回到月線之上進行震盪整理，待下半年電子股進入產業旺季，及蘋果(Apple)新機供應鏈開始拉貨，下半年台股還有走強契機。,-2
2017-06-14T01:48:00.000Z,台股守住月線後，今早穩定上揚。,1
2017-06-14T01:48:00.000Z,　  近期美股回跌，主要是科技股的蘋果(Apple)、亞馬遜(Amazon)、臉書(facebook)等本波帶領美股創高的個股出現劇烈回檔走勢，也衝擊台股蘋概股，但隨著美股迅速回穩，周二台積電不畏外資賣超，股價有撐，可成今早股價再創今年新高，股王大立光今早股東會順利結束，股價亦同步向上。,2
2017-06-14T01:48:00.000Z,  另外，美股止穩，特斯拉(Tesla)再攀歷史新高價，台股的相關供應鏈和大 (1536) 、貿聯-KY (3665) 今早股價亦走揚。,1
2017-06-14T01:48:00.000Z,  上周五美股急跌，台股本周一跳空開低，跌破5日及10日線，但周二台股終場指數以上漲18點收在10128點，成交量為794億元，呈現量縮止跌。,-4
2017-06-14T01:48:00.000Z,  今早隨著美股進一步反彈，台股持續在台積電開高帶領下，指數亦穩在10100點及月線之上。,2
2017-06-14T01:48:00.000Z,不過，國泰金 (2882) 等大型金控表現仍平淡，金融類股指數盤中一度小跌，台股仍多倚靠電子撐盤。,-1
2017-06-15T07:12:00.000Z,台股今日小幅開高後出現翻黑，一度下探10046.8點，所幸電子股回穩，面板股突圍向上，推升指數力守榮面，終場加權指數上漲15.89點為10088.35點，成交值縮至758.3億元。,3
2017-06-15T07:12:00.000Z,聯準會宣布升息1碼符合預期，但通膨等數據未如預期向上攀升，使台股今日觀望氣氛濃厚，盤面上在台積電、鴻海、聯發科 (2454) 及中華電 (2412) 等電子股力挺多方下，與中鋼 (2002) 、台塑 (1301) 及統一 (1216) 等傳產疲軟走勢形成多空拉鋸，使指數多於平盤附近量縮整理。,3
2017-06-15T07:12:00.000Z,分析師表示，在全球景氣復甦、企業獲利成長、資金依然充沛的環境下，有利風險性資產續揚，台股近期在股東會旺季與除權息行情激勵下，中長多格局不變，後市仍不必過分看淡。,3
2017-06-15T06:26:00.000Z,台股在面板股走揚，台積電 (2330) 微幅收高，指數今天小幅彈升，終場以10088.35點作收，上漲15.89點，漲幅0.16％，成交金額為758.3億元。,4
2017-06-15T06:26:00.000Z,　分析師指出，台股維持低量，盤面焦點仍在外資及權值股身上，FED確定升息，將引領美元轉強，新台幣可能趨向貶值，且近期國際股市波動較大，外資操作轉趨保守，對台股加碼力道還要觀察，若台幣持續貶值，就要留意萬點關卡是否能有效支撐，一旦跌破萬點又將由支撐轉換為壓力，指數將轉為弱勢。,2
2017-06-15T06:06:00.000Z,（中央社記者張建中台北2017年6月15日電）美國聯邦準備理事會(FED)宣布升息，市場並不意外，中性反應，台股呈量縮震盪格局，終場指數小漲15.89點。,1
2017-06-15T06:06:00.000Z,分析師王兆立表示，台股短期將震盪整理，將以個股表現為主。,0
2017-06-15T02:58:00.000Z,（中央社記者張建中台北2017年6月15日電）美國聯邦準備理事會（Fed）宣布升息，結果市場並不意外，只是台股走勢震盪，在平盤上下震盪；其中，電子股表現相對強勢。,2
2017-06-15T00:01:00.000Z,"台股跌勢再起，大立光 （3008） 、台積電 （2330） 震盪走弱，強勢股轉弱，衝擊指數開高走低跌破月線、收10,072點，目前有26家庫藏股嚴陣以待。",-5
2017-06-15T00:01:00.000Z,"　台股昨日短暫開高到10,165點，但股王大立光股東會釋出利多，股價卻不漲反跌，收盤下跌2.39％，權值龍頭台積電也跌0.48％，影響指數跌破10,100點，剛好也是月線位置，盤中最低達10,033點，尾盤小反彈指數收10,072點，跌幅0.55％，月線失守，櫃買指數收低134.27點更下跌1.52％，近逼季線134.23點關卡。",-7
2017-06-15T00:01:00.000Z,"　在台股目前面臨萬點保衛戰之際，共有26家上市櫃公司正實施買回庫藏股，其中有9家上市櫃公司是大盤指數5月23日攻上萬點以來，才陸續宣布實施庫藏股，尤以三陽及瑞傳兩公司各預計買回3萬張、1.05萬餘張最多，光聯5,000張，和勤及雙鴻都是3,000張，其餘依序為：台聯電、上緯投控、華廣及五鼎等都在千張以上。",1
2017-06-16T07:01:00.000Z,聯準會宣布升息和今年開始縮表，拖累美股三大股指收黑，亞股今日漲跌互見，台股開低震盪後，盤中受到大立光 (3008) 、台積電 (2330) 、鴻海 (2317) 等蘋概股轉強，推升指數翻紅並一路走高，終場加權指數上漲68.38點為10156.73點，一舉攻回5日線與月線，成交值放大至956.03億元；周線終止3連紅、本周指數下跌42.92點。,-1
2017-06-16T07:01:00.000Z,台股今日受惠於大立光、台積電、鴻海等蘋概股回穩走揚，配合面板雙虎友達、群創穩盤，化解台塑 (1301) 、中華電 (2412) 等權值股拉回壓力，使指數一舉收復5日線、月線及10100關卡。,2
2017-06-16T07:01:00.000Z,分析師指出，台股逐步消化美國升息政策影響後，市場恐慌情緒平復，預期台股震盪整理後，仍由績優股掛帥領攻，第三季在蘋果新款iPhone題材發酵下，有機會帶動相關供應鏈後市；惟美、英、日、香港及大陸等國陸續祭出緊縮政策，應密切注意外資動向，操作上看好高股息股防禦佳，可留意半導體、電子硬體、網通、汽車相關及利基型傳產股。,5
2017-06-16T06:19:00.000Z,台股終場上漲68.38點，以1萬156.73點作收，成交值新台幣956.03億元。,1
2017-06-16T06:19:00.000Z,台股早盤開低走平，大致在平盤1萬88點附近游走，但國際美元走強，外資明顯匯出跡象，導致新台幣開盤走貶，貶破30.3元關卡時，出口商拋匯賣盤湧現，推升匯市交易量；十時過後，電子權值股鴻海 (2317) 股價走揚，大立光 (3008) 股價也黑翻紅，台積電 (2330) 也守穩在平盤上，聯發科 (2454) 一直在平盤上下游走，尾盤上拉，收在最高的253元。,4
2017-06-16T06:19:00.000Z,林成蔭說，台股這一波能突破1萬268點的空間有限，除非量能夠大，才有機會推升台股最高到1萬300點左右，投資人接下來不妨觀察個股表現，以及成長型的電子股與美國科技股之間的走勢連動關係，估計價值型的金融、原物料等類股在下半年有表現空間。,6
2017-06-16T06:18:00.000Z,台股今開平震盪走高，成功站回月線位置，早盤在將美股升息及貨幣緊縮的壓力消化告一段落後，整體表現在電子權值股回神助攻下，指數越走越強，量能也明顯回流，終場台股收漲68.38點、報在10156.73點、成交量956.03億元；台股周線終止3連紅、本周指數下跌42.92點，下周挑戰收復10日均線。,1
2017-06-16T06:18:00.000Z,  分析師指出，因為聯準會已經宣布升息，加上市場預期可能最快在9月就會縮減資產負債表，短線對漲多的美股來說，在沒有新經濟數據利多帶動下，四大指數不排除陷入震盪，短線宜觀察最弱勢的那斯達克指數，在沒有站穩月線之前，都有可能再下探季線以下，成為國際股市短線變數，至於台股方面，目前考量外資已重回買超行列，預期台股有機會守穩萬點，未來留意召開法說會及除權息個股表現，建議逢高減碼持股。,5
2017-06-16T03:22:00.000Z,（中央社記者韋樞台北 2017年6月16日電）台股15日盤中逐步消化美股升息及貨幣緊縮的下跌壓力，今天開低走高，電子股漲勢整齊，傳產股漲跌互見下，台股盤中黑翻紅重回1萬100點之上，法人指台股將重回個股業績輪動。,3
2017-06-16T03:22:00.000Z,台股今天開盤小跌十點，指數隨後拉回平盤後逐步走高，盤中小漲十餘點，回到1萬100點之上震盪；類股方面電子股漲勢整齊，權值股台積電 (2330) 、大立光 (3008) 、鴻海 (2317) 、聯發科 (2454) 聯袂從平盤下拉回平盤上小漲，鴻海漲逾2%，最高105元。,5
2017-06-16T03:22:00.000Z,統一證券表示，台股15日逐步消化美國聯準會宣布升息影響及14日修正的套牢賣壓後，就技術指標考量，短期均線下彎趨勢漸緩，市場恐慌情緒平復，且外資賣超金額縮小，近期國際政策對於股市的影響暫告一段落。,-6
2017-06-16T02:44:00.000Z,歐美股市全數收黑，亞股漲跌互見，台股今開低震盪，盤中指數一度拉高到平盤上小漲，但量能持續偏弱，預計今日全天量能落在600~700億元，後續預計隨著市場短線對貨幣政策疑慮解除下，盤面表現將回歸業績題材面發揮。,-2
2017-06-16T02:44:00.000Z,  在美國科技股壓回震盪下，今台股電子股兩大龍頭指標大立光 (3008) 、台積電 (2330) 並無明顯領軍表現，大立光小跌震盪，盤中跌幅約0.5%，股價最低達4635元，寫下本波段的新低，惟盤中一度翻紅，台積電則多弱勢於平盤附近震盪，今日電子股以中低價股相對具有表現空間，面板雙虎群創 (3481) 、友達 (2409) 在外資持續進行加碼下，支撐股價今股價雙雙走揚，群創漲幅約1.5%，友達則在漲幅1%內跳動，也帶動同屬面板股的彩晶 (6116) 同步走揚。,5
2017-06-16T02:44:00.000Z,  分析師指出，台股在歷經昨日逐步消化美國升息政策影響後，短期均線下彎趨勢漸緩，市場恐慌情緒平復，預期台股指數在震盪整理消化賣壓後，仍由業績優質股掛帥，且第二季已經逐漸步入尾聲，第三季在蘋果新款iPhone題材發酵下，預計有機會帶動相關供應鏈後市，有望逐步盤堅走揚。,4
2017-06-17T03:11:00.000Z,"台股周五（16日）在指標權值股鴻海 （2317） 、台積電 （2330） 強勢走揚，帶動指數收高10,156.73點，但周線仍下跌42.92點，周線中止連3紅翻黑，而櫃買指數也震盪拉回，周線翻黑。",0
2017-06-17T03:11:00.000Z,投資專家表示，台股短線已化解萬點破底危機，由於鴻海下周四（22日）召開股東會，以及台積電除息日逼近等因素，有利於盤勢維持高檔震盪格局。,0
