PublishDate,Sentence,Score
2017-12-13T06:33:00.000Z,台股終場上漲27.42點，以10470.70點收盤，成交值新台幣1024.78億元。,1
2017-12-13T06:33:00.000Z,美股道瓊指數和標準普爾指數今天收盤再創新高，台股今天開高走高，維持30點上下的漲幅；蘋概股電子權值股台積電 (2330) 、大立光 (3008) 、鴻海 (2317) 在平盤下偏弱勢整理，跌幅不大，電子股次族群包括IC設計、被動元件、印刷電路板等維持上漲。,3
2017-12-13T06:33:00.000Z,股市資深分析師林成蔭表示，美國本週將公布升息、能源等資訊，油國組織會公布與原油相關資訊，相對全球股市非常重要，但在資訊明朗之前，雖然美股表現不錯，但台股難免會停滯不前。,2
2017-12-13T06:33:00.000Z,林成蔭強調，目前台股的科技股正在整理，台積電董事長張忠謀認為來不及供應客戶高速運算的強勁需求，直接反駁外資說法，而明年第1季仍是傳統淡季，但目前情況還好，因此市場資金難免會轉進業績落後的產業價值股，包括正值旺季的汽車零組件、生技、金融股等。,-3
2017-12-13T03:30:00.000Z,（中央社記者韋樞台北2017年12月13日電）美國聯準會(Fed)即將升息，帶動歐美股走高，亞股僅韓股和港股小漲；外資雖然連13賣，但台股今天開高走高小漲力守10400點，法人表示，台股長線仍多頭，良性換手後多頭延續。,8
2017-12-13T03:30:00.000Z,雖然美股受惠減稅計畫和升息而頻創新高，但外資卻在台股連13賣，金額已達新台幣788億元之多，連帶台股買盤也跟著縮手，台股反彈兩天後，12日電子權值股鴻海 (2317) 、和碩 (4938) 等再遭調節，幸台積電 (2330) 守穩未再下跌，大盤小跌但仍力守10400點之上。,5
2017-12-13T03:05:00.000Z,台股今早蘋概三巨頭台積電 (2330) 、大立光 (3008) 、鴻海 (2317) 偏弱勢整理，但金融股挺身，電子記憶體族群以及被動元件、印刷電路版等次族群領軍，台股盤中維持上漲的態勢，守穩五日線及10400點支撐。,2
2017-12-13T03:05:00.000Z,  台股本周一跳空開高，回到10400點之上；雖台積電、鴻海等蘋概指標受到外資賣超壓抑，台股連兩天收盤仍力守10400點關卡。,-3
2017-12-13T03:05:00.000Z,今日早盤蘋概三巨頭台積電、大立光、鴻海持續整理，電子類股指數受壓抑，但金融類股指數開高走高，引領台股持續向上反彈，配合電子次族群也有不錯的表現。,1
2017-12-13T03:05:00.000Z,  台股在電子跌勢收斂，金融股向上，包括國泰金 (2882) 、富邦金 (2881) 、新光金 (2888) 今早均走揚；以及傳產持穩下，今日早盤維持震盪盤堅格局。,2
2017-12-13T03:05:00.000Z,  雖美股頻創新高，但台股跌落半年線、表現脫勾，主要受到蘋概股鴻海、台積電等成為外資調節標的。,3
2017-12-13T03:05:00.000Z,外資在台股呈現連13天賣超，累計賣超金額達788億元；周三外資期貨淨多單小幅加碼374口至3萬9279口，整體操作方向仍偏空。,-1
2017-12-13T03:05:00.000Z,若外資持續賣超台股，台股短期指數空間仍將受壓抑，以法人買超的個股較具表現機會。,0
2017-12-14T07:02:00.000Z,台股今日開高走揚，電子、金融、傳產權值股同步回神，早盤順利站回10日均線、半年線，一度大漲逾百點，台積電 (2330) 、鴻海 (2317) 、大立光 (3008) 均一度走揚逾1%，國泰金 (2882) 、中信金 (2891) 亦同步漲近1%，傳產集團股價作帳啟動，統一 (1216) 、台化 (1326) 、統一超 (2912) 等皆有不凡表現。,6
2017-12-14T07:02:00.000Z,  台股收漲67點卻未能守住半年線，5日RSI為57.64，10日RSI為47.34，9日K值為42.27，9日D值為31.68，20日乖離率為-0.73。,1
2017-12-14T07:02:00.000Z,外資今日轉為買超，惟年終長假將到恐影響外資操作，加上台股雖見止跌跡象，短線技術指標卻偏弱，指數表現空間受限。,0
2017-12-14T06:44:00.000Z,美國聯準會宣布升息1碼、明年預期升息3次，並調升明年經濟成長率預期，台股今日在權值股回神下開高走揚，盤中一度大漲106.83點，惟尾盤追價意願不高，且大立光 （3008） 受賣單拖累翻黑收在最低點，壓抑指數漲幅，半年線10545點得而復失。,1
2017-12-14T06:44:00.000Z,  權值股午盤後走勢分化，台股三劍客由台積電 （2330） 漲逾1.5％最強勢，鴻海 （2317） 亦上漲1.28％，大立光早盤一度漲逾1％，惟午盤後賣壓湧現，終場反收黑2.27％，收在全日最低點。,-3
2017-12-14T06:44:00.000Z,  台股今日早盤量增穩揚，接連收復10日均線、10500點及半年線10545點，惟尾盤調節賣壓湧現下，半年線得而復失。,-1
2017-12-14T06:44:00.000Z,分析師認為，短期內台股雖見止跌跡象，惟短線技術指標仍偏弱，預期仍將呈現10300～10600點間的區間震盪格局。,-1
2017-12-14T05:56:00.000Z,法人指出，台股今天量能回到1100億元之上，略有回溫，若要突破半年線反壓，最好日成交值可以達1300億元水準較具攻擊力，反觀櫃買指數今天仍有約500億元的成交值，人氣持續維持高檔，若能趁勢回到月線147.81點之上，加上有主流族群挺身而出，在財報空窗期可望有較為凸出的表現。,3
2017-12-14T03:51:00.000Z,大摩出具最新台股投資策略，大摩給明年台股目標價為11000點，在各族群上，「加碼」金融和通訊族群，並更多著墨會在中、小型股。,2
2017-12-14T03:51:00.000Z,  大摩點選的台股「加碼」個股包括：鴻海 (2317) 、聯發科 (2454) 、台達電 (2308) 、可成 (2474) 、南亞科 (2408) 、緯創 (3231) 、台郡 (6269) 、祥碩 (5269) 、玉山金 (2884) 、中租-KY (5871) 、台塑 (1301) 、台灣大 (3045) 、遠傳 (4904) 、儒鴻 (1476) 、和大 (1536) 、智伸科 (4551) 、巨大 (9921) 、美食-KY (2723) 等。,2
2017-12-14T03:51:00.000Z,  台股今年在科技股帶動下，指數站上27年新高，萬點不破。,4
2017-12-14T03:51:00.000Z,展望2018年，大摩持較審慎的態度，並給台股「中立」評等。,3
2017-12-14T03:51:00.000Z,大摩認為明年的台股較保守的3項因素包括：一、台灣的科技權植股台積電 (2330) 被降評，而對大立光 (3008) 的前景也較為保守。,-1
2017-12-14T03:51:00.000Z,  大摩也認為，明年台股觀察重點包括新台幣兌美元匯價，以及台股交易量。,0
2017-12-14T03:51:00.000Z,但目前看來這兩項因素在明年對台股不會提供大多的利好消息。,0
2017-12-14T03:18:00.000Z,台股今日開高走揚，在電子、金融、傳產權值股同步回神下，各類股普遍上揚，帶動加權指數順利站回10日均線、半年線10545點，早盤持穩10530點之上，一度大漲106.83點至10577.53點。,6
2017-12-14T03:18:00.000Z,  分析師認為，台股近日守穩月線，指數已逐漸止跌回穩，近期國內外各經濟指標展望仍樂觀，在聯準會決議符合市場預期、外資賣壓暫歇、內資持續活躍下，帶動今日指數量增反彈，有利技術面指標轉強，短期觀察量能能否持穩增溫，以及半年線10545點能否站穩。,6
2017-12-14T03:18:00.000Z,  分析師預期，短期台股仍將呈現10300～10600點區間震盪態勢，由於年底集團作帳行情可望啟動，選股上可留意基本面佳的5G概念股，半導體矽晶圓、IntelPurley、塑化及生技等族群，具題材的中小型股亦有較大表現空間。,1
2017-12-14T02:56:00.000Z,（中央社記者田裕斌台北2017年12月14日電）美國升息後亞股普遍走揚，台股也在權值股帶動下開高，盤中一度大漲百點，挑戰半年線10545點反壓，先前弱勢的鴻海 (2317) 、台積電 (2330) 更是止穩走揚。,4
2017-12-14T02:56:00.000Z,分析師表示，擺脫過去2個交易日成交值不到1100億元的低量，台股今天成交值有機會觸碰1200億元，略呈回溫跡象，櫃買指數人氣更是不退，今天成交值有機會達500億元、創12月以來單日次高。,1
2017-12-14T02:56:00.000Z,分析師表示，電子權值股來自於外資的賣壓稍歇，金融股表現帶動多頭回籠，包括國泰金 (2882) 、開發金 (2883) 、新光金 (2888) 、永豐金 (2890) 、中信金 (2891) 在本波回檔股價維持相對高檔水準，加上傳產包括水泥、食品力挺，台股短線可望確立止跌。,3
2017-12-14T02:56:00.000Z,此外，美國升息幅度符合市場預期，升息後美元指數並未相對強勢，新台幣匯率今天也呈現升值，資金從台股外流的疑慮暫除，加上外資在連賣14個交易日、賣超近780億元後，隨著陸續開始放長假，賣壓也有逐漸減緩的跡象，指數下檔空間相對有限。,-1
2017-12-15T07:12:00.000Z,周四美股震盪走跌、四大指數全數收黑，今日亞股中僅以韓股相對有撐，台股面臨月線、季線反壓，今日開低震盪走低，在蘋果三雄大立光 (3008) 、鴻海 (2317) 、台積電 (2330) 同步熄火，金融股亦壓回修正下，指數一度大跌百點、下探10436.11點，所幸尾盤獲買盤拉抬，指數跌幅略為收斂，終場加權指數下跌46.57點為10491.44點，5日線失而復得，成交值增為1248.38億元，周線翻紅上漲92.82點；今日外資賣超42.8044億元，投信賣超0.6025億元，自營商賣超29.901億元，三大法人賣超73.30億元。,-5
2017-12-15T07:12:00.000Z,台股今日由台積電、鴻海及大立光蘋果三劍客領跌，加上國泰金、富邦金等金融股表現弱勢，使指數開低走低一度下殺百點，所幸台積電尾盤跌幅收斂，終場指數得以強拉回5日線之上。,-4
2017-12-15T07:12:00.000Z,"分析師指出，受制於股王大立光跌破前波底部，使台股在多數權值股""嚇""跌影響下，盤勢開低走低，加上外資賣壓仍相對沉重，使市場仍籠罩在悲觀氣氛中；預料在外資減緩賣超、量能回溫及台積電、鴻海及大立光等三天王止跌回穩前，台股將於10350點至10600點區間震盪。",-9
2017-12-15T06:31:00.000Z,在美股收黑、亞股弱勢下，台股今開低盪走低，呈現量縮價跌，在大型電子股、金融股無力撐盤下，加權指數欲振乏力，盤中跌幅一度逾百點之多，失守5日線和10日線，惟尾盤跌幅收斂，最後一筆買盤回流，最後一盤成交量達296億元，拉抬指數驚險要回5日線，周線收紅，終場台股收跌46.57點、報在10491.44點、成交量為1248.38億元，寫下本周最高單日成交金額；台股周線翻紅，終止二連黑，本周指數漲92點。,-9
2017-12-15T06:31:00.000Z,  分析師表示，台股開低走低，指數遇到10日線反壓，加上量能不足下，指數拉回整理，因為指數已經回落半年線之下，恐導致整理時間相對較久，綜觀各均線扣抵值的未來走勢來看，大盤要到明年一月之後，才有機會出現波段行情。,-3
2017-12-15T06:31:00.000Z,此外，因為目前台股成交量仍不足五日均量，要持續上攻還需外資連續買超、集團股作帳等助威，建議選股方面可留意指數股票基金波段操作。,0
2017-12-15T06:23:00.000Z,（中央社記者鍾榮峰台北2017年12月15日電）台股盤中一度下挫近百點，尾盤台積電率電子股神龍擺尾，大盤5日和10日線失而復得，週線收紅。,2
2017-12-15T06:23:00.000Z,法人表示，台股短線震盪整理為主，利基型個股較有表現機會。,2
2017-12-15T06:23:00.000Z,台股今震盪走低，一度下挫近百點，電子金融弱勢，盤中在5日均線約10483點和10日均線約10478點之下低檔橫向整理，尾盤台積電率電子股擺尾，台股終場跌幅收斂，5日線和10日線失而復得，週線也收紅。,-3
2017-12-15T06:23:00.000Z,台股加權股價指數終場收在10491.44點，下跌46.57點，跌幅0.44%，成交值新台幣1248.39億元，電子股跌0.54%，金融股跌0.66%，台股週線收紅擺脫連2黑，週線上漲92.82點。,-1
2017-12-15T06:23:00.000Z,台新中國通基金經理人魏永祥指出，全球景氣可望持續走高到明年上半年，台股基本面佳，不過目前全球股市評價大多位於歷史區間上緣，待時間消化上檔壓力，台股短線震盪整理格局為主。,0
2017-12-15T03:12:00.000Z,（中央社記者鍾榮峰台北2017年12月15日電）美股收黑，亞股下挫，台股盤中電金弱勢，大盤一度下跌百點，5日線和10日線失守。,-6
2017-12-15T03:12:00.000Z,法人預期在外資回籠前，台股震盪整理格局為主，短線留意3大變數。,1
2017-12-15T03:12:00.000Z,受到美股收黑影響，亞洲主要股市下挫，台股今天盤中震盪走跌，電子金融弱勢，大盤最低來到10437.13點，下挫百點，失守5日均線約10475點和10日均線約10474點。,-6
2017-12-15T03:12:00.000Z,上午10時30分，台股加權指數來到10455.77點，下跌82.24點，跌幅0.78%，成交值來到新台幣479.15億元。,-3
2017-12-15T03:12:00.000Z,台新中國通基金經理人魏永祥表示，外資近期賣超、權值股拉回修正，台股均線失守，預期在外資回籠前，台股震盪整理格局為主。,-1
2017-12-15T03:12:00.000Z,觀察台股短線，魏永祥表示需留意3大變數，包括觀察蘋果iPhone X零組件生產良率與組裝量能否跟上需求；觀察美國聯準會（Fed）資產收縮速度與升息路徑；觀察營運動能是否影響科技類股表現。,4
2017-12-15T02:57:00.000Z,美股震盪走跌，四大指數全數收黑，亞股中也僅剩下韓股相較有撐，台股面臨月線、季線反壓，指數今日開盤跌20.18點，報在10517.21點，指數震盪走低，一度下跌逾90點、終止連二紅，跌破5日均線，在電金同步熄火下，本周連續反彈暫告一段落。,-6
2017-12-15T02:57:00.000Z,  分析師表示，台股今失守五日線，月、季線附近反壓沉重，大型權值股無發揮領軍作用，加上櫃買指數目前價跌量增，恐有背離疑慮，在中小型個股震盪加劇下，宜持續觀察量價關係，後市若未出現背離，個股仍有機會表現。,-3
2017-12-15T02:46:00.000Z,美股震盪走跌，四大指數全數收黑，亞股中也僅剩下韓股相較有撐，台股面臨月線、季線反壓，指數今日開盤跌20.18點，報在10517.21點，指數震盪走低，一度下跌逾90點、終止連二紅，跌破5日均線，在電金同步熄火下，本周連續反彈暫告一段落。,-6
2017-12-15T02:46:00.000Z,  分析師表示，台股今失守五日線，月、季線附近反壓沉重，大型權值股無發揮領軍作用，加上櫃買指數目前價跌量增，恐有背離疑慮，在中小型個股震盪加劇下，宜持續觀察量價關係，後市若未出現背離，個股仍有機會表現。,-3
2017-12-18T07:07:00.000Z,美國收高，台股置身事外台積電 (2330) 、大立光 (3008) 早盤疲弱；大立光 (3008) 跌勢止不住，低點來到4070元，一度面臨4000大關保衛戰，台積電 (2330) 面臨賣壓，跌幅達1%。,-4
2017-12-18T07:07:00.000Z,台股群龍無首，僅靠中小型股撐盤，指數沿10500點狹幅震盪。,0
2017-12-18T07:07:00.000Z,油價節節高升，油電、塑膠2大受惠族群居撐盤要角，加上資金轉向被動元件，國巨 (2327) 、華新科 (2492) 、禾伸堂 (3026) 同步攻上漲停板，搭配電動車電池材料廠-康普 (4739) 及美琪瑪 (4721) 走高，大立光11點半過後啟動跌深反彈上漲3%，台股力守紅盤，收漲15.08點，為10506.52點。,7
2017-12-18T07:07:00.000Z,  外資今日賣超1.2億元，調節力道明顯收斂，但即將進入聖誕長假，近期對操作態度偏向謹慎，台股5日RSI為51.25，10日RSI為45.05，9日K值為54.81，9日D值為42.60，20日乖離率為-0.85。,1
2017-12-18T07:07:00.000Z,本波從高檔拉回修正逾500點，指數已於台股上周震盪回穩，周K線中止連兩黑翻紅，加上近十年封關偏漲升行情，專家看好封關前上揚行情有望。,6
2017-12-18T06:53:00.000Z,被動元件紅通通，台股緩步往半年線前進！智慧型手機成長趨緩，無論蘋果iPhone或大陸智慧型手機品牌廠銷售都不理想，讓市場開始擔心大舉擴產的大立光 (3008) 將引爆光學鏡頭廠殺價競爭，大立光早盤股價續弱，拖累玉晶光 (3406) 、新鉅科 (3630) ，甚至是大陸舜宇光學股價同步走跌，資金棄守光學、蘋果概念股，轉向有基本面，供不應求可望到明年的被動元件股，國巨 (2327) 漲停再創上市新天價，華新科 (2492) 、禾伸堂 (3026) 亦連袂攻上漲停板，華新集團旗下瀚宇博 (5469) 也在集團作帳加持下漲停，信昌電 (6173) 收高。,4
2017-12-18T06:53:00.000Z,　就技術面來看，上週五美股收紅，讓有基本面的被動元件等漲勢再起，但大立光等權值股續弱，壓抑台股，指數在平盤附近游走，尾盤時大立光翻紅強勢收紅，帶動台股指數守住紅盤，終場加權股價指數上漲15.08點，以10506.52點作收；上週台股先上後下，指數一度觸及半年線後遭到壓回，上週五雖力守短均不破，但多方展現反彈氣勢卻未竟全功，所幸今天台股在尾盤奮力收高，讓指數能守住5日線及10500點，但半年線尚未收復，指數仍處於短均下方，原本有望重回多方優勢的局面有所變化，由於目前指數位置回落至12月6日長黑K實體的中點下方，加上10500點關卡之上復有半年線、月線與季線等均線壓抑，可見現階段上檔壓力仍相對沉重，對照今年以來的修正波，11月下旬至12月初的這波修正500點乃是幅度最大的一次，且今年每次跌破半年線皆未跌破超過3天，此次已可視為有效跌破，推估季線和半年線都將下彎，因此只要指數仍在半年線下方，盤勢偏弱態勢恐益加明顯，所幸近期美股表現強勢，對台股多頭仍有助攻效果，若國際股市能持續走高，台股指數有機會震盪築底，預估本週台股指數區間在10500點上下150點區間整理。,9
2017-12-18T06:53:00.000Z,　復華數位經濟基金經理人周奇賢表示，外資近期對台股態度偏向謹慎，技術面短線日KD轉為向上，但週KD、月KD仍處於向下延續修正整理走勢，加上指標電子權值股漲跌互見，預估大盤近1週仍可能處於震盪整理走勢，並以個股或族群表現為主，待年底法人實現獲利賣壓告一段落，明年初資金再開始重新布局後，台股仍將逐漸反應中期仍偏正向之基本面發展，由於半導體景氣循環仍向上，仍可留意相關具漲價及缺貨概念之電子零組件，或因近期資金流動而受惠的傳產及金融族群。,7
2017-12-18T06:44:00.000Z,（中央社記者吳家豪台北2017年12月18日電）外資持續出脫，台股今天震盪修正，大立光止跌守住4000元，空方氣勢減弱，指數收復10500點整數關卡。,-1
2017-12-18T06:44:00.000Z,分析師認為，資金流出亞洲趨勢暫緩，台股位階相對偏低，短線反彈行情有望延續。,0
2017-12-18T06:44:00.000Z,台股加權指數今天收在10506.52點，上漲15.08點，漲幅0.14%，成交值新台幣941.35億元。,2
2017-12-18T06:44:00.000Z,蔡明翰指出，資金流出亞洲趨勢暫緩，加上耶誕節前後有望受到強勢美股激勵，另外在月、季線之下的台股位階相對偏低，短線反彈行情有望延續，預估本週台股指數區間10450點到10700點。,3
2017-12-18T04:07:00.000Z,美股漲不敵大立光 (3008) 下殺，台股指數10500點浮沉！儘管上周五美國股市衝高，但台股受到股王—大立光及台積電 (2330) 雙王股價走弱壓制，玉晶光 (3406) 、亞光 (3019) 等光學股及蘋果概念股今天依舊疲弱，成為阻礙多頭上攻的大石頭，所幸資金轉向具基本面支撐的被動元件，國巨 (2327) 、華新科 (2492) 、禾伸堂 (3026) 同步攻上漲停板，華新集團旗下瀚宇博 (5469) 亦漲停，信昌電 (6173) 同步大漲，PCB廠營運看俏，華通 (2313) 及燿華 (2367) 轉強，搭配電動車電池材料廠—康普 (4739) 及美琪瑪 (4721) 走高，以及傳產股的油電氣類股走強，讓台股力守紅盤。,7
2017-12-18T04:07:00.000Z,　台股截至11點45分為止，加權股價指數為10506.32點，小漲14.88點，成交量為622.04億元；OTC指數為146.33點，上漲0.53點，成交量為228.45億元。,1
2017-12-18T04:07:00.000Z,　就技術面來看，上周五在美股三大指數集體出現創高後拉回影響下，台股以下跌21點至10517點開出後，權值股以鴻海 (2317) 、聯發科 (2454) 為首湧現賣壓，使指數盤中跌幅達百點之譜，但尾盤跌幅逐漸收斂，收盤前因中型100指數調整帶動被動式基金買盤拉抬指數幾十點，終場加權股價指數10491.44點作收，累計一周上漲0.89%，周線收紅；OTC指數亦上揚0.96%，收在145.8點，今天雖然受惠上周五美股收紅，但大立光等權值股續弱，壓抑台股，指數在平盤附近游走；上周受到美股三大指數集體出現拉回，以及法人買盤隨年底結帳效應略有降溫影響下，上周五台股出現震盪拉回格局，但尾盤跌幅顯著收斂，尤其是上周一及上周四台股連兩次盤中漲逾百點，但收盤都無法守成，且次一交易日都遭到黑K吞噬，多方力道明顯遭到空方壓制，若近期台股10550點未能儘快攻克，短線皆屬弱勢震盪，靠攏年線步調不變，應注意探低風險；不過台股在跌破半年線後持續走低至10322點，短線跌幅也至M頭型態滿足點附近，月線走勢來看，近期拉回至10日線、約10332點附近，為今年此波漲勢來第一次回測，對盤勢後勢有一定支撐效果，且從價量關係來看，亦未出現異常訊號，因此若國際股市能持續走高，台股指數有機會震盪築底，預估本周台股指數區間在10500點上下150點區間整理。,0
2017-12-18T04:07:00.000Z,　國泰證期顧問處協理簡伯儀表示，台股早盤再電子股走勢相對疲弱下，盤面雖有塑化類股出現反彈，但整體指數仍舊維持弱勢整理走勢，雖然目前大盤日線技術指標仍維持反彈走勢，加上外資近期賣超出現趨緩，短線有機會出現反彈，但由於近期反彈量能不足，因此，半年線附近的反壓相對沉重，預期台股短線應該仍不拖量縮打底的走勢；類股來看，塑化類股今日上漲幅度較強，主要為近期原油仍維持相對強勢，加上整體營收進入旺季，預期短線將維持相對強勢的走勢。,-3
2017-12-18T03:16:00.000Z,（中央社記者吳家豪台北2017年12月18日電）台股今天早盤震盪，在10500點整數關卡附近換手，蘋概股普遍弱勢，大立光 (3008) 陷入4000元保衛戰，盤面以被動元件、車用、PCB、塑化族群表現較佳，預估量能不到千億元。,-4
2017-12-18T03:16:00.000Z,至10時47分左右，台股加權指數來到10491.85點，上漲0.41點，漲幅0.00%，成交值新台幣480.23億元。,2
2017-12-19T07:08:00.000Z,稅改案過關在即，美股再創新高！亞股今日表現相對淡定，台股在蘋果三天王大立光 (3008) 、台積電 (2330) 、鴻海 (2317) 走疲下，盤中指數由紅翻黑，一度下探10452.08點，由於外資即將進入聖誕假期，權值股表現受壓抑，以內資主導的中小型題材及年底作帳集團股較有表現，終場加權指數下跌39.18點為10467.34點，再度跌破10500點與五日線，成交值放大為1115.3億元，今日外資賣超53.9575億元，投信買超8.106億元，自營商買超8.3052億元，三大法人賣超37.54億元。,-5
2017-12-19T07:08:00.000Z,台股今日因蘋果供應鏈三雄台積電、鴻海與大立光領跌電子股，使台塑四寶、國泰金與聯發科等權值股力挺短多無功而返，加權股價指數開高殺低，再度跌破10500點與五日線。,-2
2017-12-19T07:08:00.000Z,分析師表示，目前台股技術面上轉弱，月、季線趨勢反轉向下，未來不宜再破底；加上美稅改法案過關後牽引全球資金重分配，未來國際熱錢是否回流北美仍待觀察，但亞洲新興市場多少受負面影響，不利台股波段資金行情。,-4
2017-12-19T06:34:00.000Z,（中央社記者韋樞台北2017年12月19日電）美股頻創新高，台股今天仍量縮震盪，在外資縮手、投資人觀望下，台股午盤前開始震盪走低，電子權值股賣壓重，10500點再失守。,1
2017-12-19T06:34:00.000Z,台股終場下跌39.18點，以10467.34點收盤，成交值新台幣1115.3億元。,-2
2017-12-19T06:34:00.000Z,台股開高走平後，午盤前翻黑走低，賣壓持續加重，指數跌破10500點；大型電子權值股持續弱勢，股價難有起色，股王大立光 (3008) 跌幅達2.9%，股價收在最低的4180元；台積電 (2330) 持續受外資調節，股價震盪走低，收在225元，但成交量放大到2.56萬張；鴻海 (2317) 一路走低，收在最低91.2元，下跌2.56%。,-10
2017-12-19T06:34:00.000Z,國泰證券期貨顧問處協理簡伯儀表示，台股今天維持量縮走勢，在半年線未有效放量攻克下，大盤仍弱勢整理；全球的資金大都前進美國股市，而台股明天遇上台指期結算，以及新台幣未升值情形下，外資也不願回補，造成台股反壓較重。,0
