PublishDate,Sentence,Score
2017-12-01T13:05:00.000Z,（中央社記者田裕斌台北2017年12月1日電）台股本週在台積電 (2330) 大跌下週線重挫超過250點，市值縮水新台幣7427.86億元，台灣證券交易所統計，截至12月1日止，全體上市公司市值31兆6828.47億元。,-3
2017-12-01T08:55:00.000Z,台股今震盪劇烈，儘管連續三天破底的台積電 (2330) 出現回溫跡象，但其餘兩檔蘋果指標股大立光 (3008) 、鴻海 (2317) 卻是空方氣焰高張，台股指數盤中一度翻黑跌破半年線以及10500點支撐，其後指數又見回穩，金融股扮演強力支撐，加權指數一度大漲逾百點，高低上下震盪逾170多點，終場台股收漲39.93點、報在10600.37點，成交值1787.34億元；台股周線收黑、本周指數跌點253.72點。,-2
2017-12-01T08:55:00.000Z,  在電子權值股無力撐盤下，金融股今日成功救火，旺旺保 (2816) 大漲逾7%，國泰金 (2882) 、中壽 (2823) 勁揚5%、4%，富邦金 (2881) 亦走揚逾3%，中信金 (2892) 、開發金 (2883) 也同步跟漲，此外，台股連日放量，也帶動證券股元富證 (2856) 、統一證 (2855) 等扮演多頭指標。,6
2017-12-01T08:55:00.000Z,  分析師表示，目前有鑑於台股技術及籌碼面尚未出現明顯反轉跡象，加上美稅改不確定性升溫，半導體前景亦出現雜音，短線建議保守操作，另外，儘管連日來破底的台積電今天止穩，只是鴻海、大立光仍持續下滑，其中大立光的M頭已然成形，相較不利於未來走勢，預計短線資金會陸續轉進傳產和金融類股。,-7
2017-12-01T07:01:00.000Z,台股大洗三溫暖！受美股帶動，加上韓國宣布升息，電金帶動台股開高，但股王大立光 (3008) 跌破5000元，櫃買指數補跌，指數急速翻轉，盤中跌破10500點，再出現長黑出量。,2
2017-12-01T07:01:00.000Z,惟台股元氣大傷，市場保守以對，終場收漲39.93點，為10600.37點。,0
2017-12-01T07:01:00.000Z,瑞銀證最新2018年台股策略報告，給金融股「加碼」評等，看好明年FED升息有助於擴大銀行存放利差，國泰金大漲5%，富邦金勁揚3.7%，2大權重股領漲下，金融指數重新站回5日及10日線，收盤漲幅近2%。,9
2017-12-01T07:01:00.000Z,台股交易量大增，證券股受惠，今天全面大漲，宏遠證、大慶證、福邦證、康和證盤中觸及漲停，大展證漲幅一度超過8%，上市的統一證、元富證、群益金鼎證也見到買盤敲進，成為當紅炸子雞。,8
2017-12-01T07:01:00.000Z,  台股本週因美費半大跌、台積電重挫等利空衝擊，週跌253.72點，外資今日再賣超台股78億元，自營商加大調節力道，亦賣超31億元，台股5日RSI為31.02，10日RSI為37.82，9日K值為29.66，9日D值為41.28，20日乖離率為-1.19。,-4
2017-12-01T06:19:00.000Z,（中央社記者吳家豪台北2017年12月1日電）台股今天早盤急殺翻黑，跌破半年線10530點和10500點整數關卡，但權值股及時回神，加上金融股撐盤，終場收復10600點；法人認為，12月進入消費旺季，台股仍有望轉強。,0
2017-12-01T06:19:00.000Z,台股加權指數今天收在10600.37點，上漲39.93點，漲幅0.38%，成交值新台幣1787.34億元。,2
2017-12-01T06:19:00.000Z,國泰證期今天表示，就過往紀錄而言，台股與美股在12月上漲機率達8成至9成，近10年的12月平均漲幅皆達2.5%左右，加上台股與美股第3季財報皆優於預期，明年展望也維持樂觀，在漲多回跌之下，雖台股線型遭到破壞，但基本面仍佳，且進入消費旺季後，預期美股與台股仍有轉強走高的機會。,6
2017-12-01T05:28:00.000Z,（中央社記者田裕斌台北2017年12月1日電）台股繼昨天爆出新台幣2334.91億元的大量之後，今天可望再度出現超過1800億元的大量，證券股在經紀收入大增下，今天全面大漲，多檔證券股盤中攻上漲停價位。,4
2017-12-01T05:28:00.000Z,台股今天早盤殺低跌破半年線10534點後，權值股在國泰金 (2882) 、台積電 (2330) 等重量級權值股帶領下，吹起反攻號角，加上場內當沖交易相當熱絡，5日均量已經增溫至1500億元以上，券商喜迎錢潮。,-1
2017-12-01T05:28:00.000Z,在年底前台股熱度持續升溫的預期下，上櫃券商股價正面反應，除了宏遠證 (6015) 、大慶證、福邦證 (6026) 、康和證 (6016) 盤中一度拉上漲停外，大展證 (6020) 漲幅也超過8%，連上市的統一證 (2855) 、元富證 (2856) 、群益金鼎證 (6004) 也見到買盤積極敲進，成交量較前一個交易日翻了數倍。,5
2017-12-01T02:57:00.000Z,美股在市場期待參院通過稅改，加上科技類股反彈，四大指數全面收高，昨天重挫的台股今天受美股帶動，加上韓國宣布升息，預期對金融股有利，電子及金融股帶動開高，但盤中股王大立光 (3008) 跌破5000元，櫃買指數補跌，台股走勢急速翻轉，大盤盤中跌破半年線及10500點，再度出現長黑出量。,4
2017-12-01T02:57:00.000Z,不過，股王大立光盤中急跌，不但跌破年線支撐，5000元也宣告失守，引發台股一波殺盤；昨日收下影線的櫃買市場，也出現補跌現象，一根長黑摜破月線，出現多殺多現象。,-3
2017-12-01T02:57:00.000Z,　在一波恐慌性買盤後，台股出現支撐買盤，今天震盪加劇，導致量能持續放大，集中市場上看1900億元，櫃買市場也有可能看到600億元大量，近期盤勢更難掌控，投資人應小心謹慎。,3
2017-12-01T02:57:00.000Z,　雖然就過往12月台股走勢來看，台股與美股在12月上漲機率達到8～9成，近10年12月平均漲幅皆達2.5％左右，加上台美股在第3季財報皆優於預期，明年展望也維持樂觀，但以12月第一個交易日來看，樂觀中仍帶隱憂，加上台股許多個股股價相對高檔，挑選個股相當重要。,9
2017-12-01T02:51:00.000Z,（中央社記者吳家豪台北2017年12月1日電）美股齊揚帶動台股今天開盤上漲31點，但技術面不利多方和籌碼面凌亂，權值股受壓抑，大立光更急殺跌破年線5012元及5000元整數關卡，大盤指數於9時52分急殺翻黑，一度下探10495.15點。,-5
2017-12-01T02:51:00.000Z,至10時25分左右，台股加權指數來到10536.81點，下跌23.63點，跌幅0.22%，成交值新台幣864億元。,-3
2017-12-01T02:31:00.000Z,　儘管美股再創新高，本週台股受到外資調降台積電 (2330) 等半導體個股投資評等影響，指數連日下挫，大立光也因外資及投信賣超，股價連番破底，今天盤中股價更大跌400元，失守至5000元關卡，更創下2017年6月16日以來新低。,0
2017-12-04T10:23:00.000Z,投信也統計，11月以來外資對亞股有買有賣，買超市場以印度逾30億美元為首，越南4.42億美元居次，韓股4.18億美元買超挹注第三，其它亞洲股市則呈現資金淨流出狀態，其中以印尼失血13.76億美元最多，台股失血逾13億美元第二；今年除泰國與印尼之外，其它亞股全數獲得外資青睞，南韓股市吸金逾92億美元最高，印度股市獲逾88億美元買超位居第2，台股獲外資挹注近70億美元排名第三。,4
2017-12-04T10:23:00.000Z,摩根台灣金磚基金經理人葉鴻儒表示，上週台股出現明顯拉回，成交金額跟著放大，顯見在指數站上10800點之上以後，居高思危氣氛再起，使得指數出現回檔，不過，1日盤中走低後，見到跌深承接買盤蹤跡，依目前情況研判，由於國際市場並未出現決定性的變數，上週台股回檔主要來自漲多獲利了結所致。,8
2017-12-04T10:23:00.000Z,葉鴻儒指出，由於台股本波多頭仰賴的重心就在科技股，但近期半導體供應鏈承壓，當電子領頭羊轉弱，對整體盤勢將造成影響，因此，包括權值股龍頭、股王等指標股價是否回穩，是未來必須持續觀察的焦點。,1
2017-12-04T06:32:00.000Z,（中央社記者田裕斌台北2017年12月4日電）美股電子盤大漲超過200點，台股早盤雖一度在短線客出場衝擊下由紅翻黑，但台積電 (2330) 回神站回季線231.67元，加上金融股國泰金 (2882) 助攻，指數終於克服季線。,1
2017-12-04T06:32:00.000Z,分析師表示，台股在1日回測半年線10538點支撐後，今天多頭力圖反攻，除了台積電、金控股表現起帶頭作用外，國際油價回到每桶60美元大關，帶動二線塑化、紡織股吹起進攻號角，台聚 (1304) 、亞聚 (1308) 、台達化 (1309) 、國喬 (1312) 攀高，新纖 (1409) 、集盛 (1455) 、宜進 (1457) 也跟進走揚。,6
2017-12-04T06:32:00.000Z,法人表示，台股今天量縮震盪，雖然大立光依舊演出重挫走勢，但電子權值股已有止穩跡象，加上部分電子次族群包括LED、矽晶圓依然有資金著墨，顯示在外資賣超可望告一段落後，內資可望成為影響台股行情的主要推手。,-4
2017-12-04T03:59:00.000Z,（中央社記者吳家豪台北2017年12月4日電）2家亞系外資出具台股策略研究報告，分別預估台股加權指數2018年底目標為11300點、11200點，除看好科技股表現仍將優於大盤，更預估2018年台股獲利成長將上看10.7%。,5
2017-12-04T03:59:00.000Z,亞系外資表示，台股加權指數11月下跌2.2%，主要受到外資賣超和科技股下挫影響，預估台股目標2017年底10800點、2018年底11300點，並看好在半導體族群成長、iPhone X強勁週期帶動下，明年科技股表現仍將優於大盤。,1
2017-12-04T03:59:00.000Z,另一家亞系外資指出，市場對於2017年台股獲利成長率預估，已從11月初的12%下修到目前的10%；由於今年基期較低，加上iPhone出貨放量時間將從今年下半年延後到明年上半年，可望推升明年台股獲利成長10.7%，預估台股加權指數2018年目標11200點，相較於11月底的10560點，仍有6%上漲空間。,2
2017-12-04T03:17:00.000Z,（中央社記者田裕斌台北2017年12月4日電）美國參議會通過川普稅改方案，美股電子盤大漲超過200點；不過亞股反應相對平淡，日股更是走跌，台股早盤開平高盤後拉回震盪，季線10644點反壓不小。,2
2017-12-04T03:17:00.000Z,截至上午10時30分，加權股價指數上漲1.14點、為10601.51點、成交值新台幣547.25億元，在上週連續2個交易日爆出超過1800億元巨量後，今天激情略有消退，預估成交值降至1200億元以下，分析師表示，台股恐要在季線及半年線10538之間約100點空間進行整理。,2
2017-12-04T03:17:00.000Z,法人表示，台股跌破季線，多空目前在10600點附近僵持，反觀櫃買指數在測試月線148.44點之後隨即量縮站穩，中小型股依舊具有支撐力道，後續需注意新台幣匯率及外資進出狀況，尤其是新台幣匯率在升破30元大關之後出現回檔，加上往年新台幣在12月貶值機率偏高，觀察外資是否順勢匯出。,-3
2017-12-04T03:17:00.000Z,此外，由於外資進入12月之後開始陸續休假，加上台股進入財報空窗期，內資對個股的影響力道增強，具有利基或題材的中小型股近期表現可望較大盤突出，指數在大型權值股多休息下，短線恐難有所表現。,3
2017-12-01T13:05:00.000Z,（中央社記者田裕斌台北2017年12月1日電）台股本週在台積電 (2330) 大跌下週線重挫超過250點，市值縮水新台幣7427.86億元，台灣證券交易所統計，截至12月1日止，全體上市公司市值31兆6828.47億元。,-3
2017-12-01T08:55:00.000Z,台股今震盪劇烈，儘管連續三天破底的台積電 (2330) 出現回溫跡象，但其餘兩檔蘋果指標股大立光 (3008) 、鴻海 (2317) 卻是空方氣焰高張，台股指數盤中一度翻黑跌破半年線以及10500點支撐，其後指數又見回穩，金融股扮演強力支撐，加權指數一度大漲逾百點，高低上下震盪逾170多點，終場台股收漲39.93點、報在10600.37點，成交值1787.34億元；台股周線收黑、本周指數跌點253.72點。,-2
2017-12-01T08:55:00.000Z,  在電子權值股無力撐盤下，金融股今日成功救火，旺旺保 (2816) 大漲逾7%，國泰金 (2882) 、中壽 (2823) 勁揚5%、4%，富邦金 (2881) 亦走揚逾3%，中信金 (2892) 、開發金 (2883) 也同步跟漲，此外，台股連日放量，也帶動證券股元富證 (2856) 、統一證 (2855) 等扮演多頭指標。,6
2017-12-01T08:55:00.000Z,  分析師表示，目前有鑑於台股技術及籌碼面尚未出現明顯反轉跡象，加上美稅改不確定性升溫，半導體前景亦出現雜音，短線建議保守操作，另外，儘管連日來破底的台積電今天止穩，只是鴻海、大立光仍持續下滑，其中大立光的M頭已然成形，相較不利於未來走勢，預計短線資金會陸續轉進傳產和金融類股。,-7
2017-12-01T07:01:00.000Z,台股大洗三溫暖！受美股帶動，加上韓國宣布升息，電金帶動台股開高，但股王大立光 (3008) 跌破5000元，櫃買指數補跌，指數急速翻轉，盤中跌破10500點，再出現長黑出量。,2
2017-12-01T07:01:00.000Z,惟台股元氣大傷，市場保守以對，終場收漲39.93點，為10600.37點。,0
2017-12-01T07:01:00.000Z,瑞銀證最新2018年台股策略報告，給金融股「加碼」評等，看好明年FED升息有助於擴大銀行存放利差，國泰金大漲5%，富邦金勁揚3.7%，2大權重股領漲下，金融指數重新站回5日及10日線，收盤漲幅近2%。,9
2017-12-01T07:01:00.000Z,台股交易量大增，證券股受惠，今天全面大漲，宏遠證、大慶證、福邦證、康和證盤中觸及漲停，大展證漲幅一度超過8%，上市的統一證、元富證、群益金鼎證也見到買盤敲進，成為當紅炸子雞。,8
2017-12-01T07:01:00.000Z,  台股本週因美費半大跌、台積電重挫等利空衝擊，週跌253.72點，外資今日再賣超台股78億元，自營商加大調節力道，亦賣超31億元，台股5日RSI為31.02，10日RSI為37.82，9日K值為29.66，9日D值為41.28，20日乖離率為-1.19。,-4
2017-12-01T06:19:00.000Z,（中央社記者吳家豪台北2017年12月1日電）台股今天早盤急殺翻黑，跌破半年線10530點和10500點整數關卡，但權值股及時回神，加上金融股撐盤，終場收復10600點；法人認為，12月進入消費旺季，台股仍有望轉強。,0
2017-12-01T06:19:00.000Z,台股加權指數今天收在10600.37點，上漲39.93點，漲幅0.38%，成交值新台幣1787.34億元。,2
2017-12-01T06:19:00.000Z,國泰證期今天表示，就過往紀錄而言，台股與美股在12月上漲機率達8成至9成，近10年的12月平均漲幅皆達2.5%左右，加上台股與美股第3季財報皆優於預期，明年展望也維持樂觀，在漲多回跌之下，雖台股線型遭到破壞，但基本面仍佳，且進入消費旺季後，預期美股與台股仍有轉強走高的機會。,6
2017-12-01T05:28:00.000Z,（中央社記者田裕斌台北2017年12月1日電）台股繼昨天爆出新台幣2334.91億元的大量之後，今天可望再度出現超過1800億元的大量，證券股在經紀收入大增下，今天全面大漲，多檔證券股盤中攻上漲停價位。,4
2017-12-01T05:28:00.000Z,台股今天早盤殺低跌破半年線10534點後，權值股在國泰金 (2882) 、台積電 (2330) 等重量級權值股帶領下，吹起反攻號角，加上場內當沖交易相當熱絡，5日均量已經增溫至1500億元以上，券商喜迎錢潮。,-1
2017-12-01T05:28:00.000Z,在年底前台股熱度持續升溫的預期下，上櫃券商股價正面反應，除了宏遠證 (6015) 、大慶證、福邦證 (6026) 、康和證 (6016) 盤中一度拉上漲停外，大展證 (6020) 漲幅也超過8%，連上市的統一證 (2855) 、元富證 (2856) 、群益金鼎證 (6004) 也見到買盤積極敲進，成交量較前一個交易日翻了數倍。,5
2017-12-01T02:57:00.000Z,美股在市場期待參院通過稅改，加上科技類股反彈，四大指數全面收高，昨天重挫的台股今天受美股帶動，加上韓國宣布升息，預期對金融股有利，電子及金融股帶動開高，但盤中股王大立光 (3008) 跌破5000元，櫃買指數補跌，台股走勢急速翻轉，大盤盤中跌破半年線及10500點，再度出現長黑出量。,4
2017-12-01T02:57:00.000Z,不過，股王大立光盤中急跌，不但跌破年線支撐，5000元也宣告失守，引發台股一波殺盤；昨日收下影線的櫃買市場，也出現補跌現象，一根長黑摜破月線，出現多殺多現象。,-3
2017-12-01T02:57:00.000Z,　在一波恐慌性買盤後，台股出現支撐買盤，今天震盪加劇，導致量能持續放大，集中市場上看1900億元，櫃買市場也有可能看到600億元大量，近期盤勢更難掌控，投資人應小心謹慎。,3
2017-12-01T02:57:00.000Z,　雖然就過往12月台股走勢來看，台股與美股在12月上漲機率達到8～9成，近10年12月平均漲幅皆達2.5％左右，加上台美股在第3季財報皆優於預期，明年展望也維持樂觀，但以12月第一個交易日來看，樂觀中仍帶隱憂，加上台股許多個股股價相對高檔，挑選個股相當重要。,9
2017-12-01T02:51:00.000Z,（中央社記者吳家豪台北2017年12月1日電）美股齊揚帶動台股今天開盤上漲31點，但技術面不利多方和籌碼面凌亂，權值股受壓抑，大立光更急殺跌破年線5012元及5000元整數關卡，大盤指數於9時52分急殺翻黑，一度下探10495.15點。,-5
2017-12-01T02:51:00.000Z,至10時25分左右，台股加權指數來到10536.81點，下跌23.63點，跌幅0.22%，成交值新台幣864億元。,-3
2017-12-01T02:31:00.000Z,　儘管美股再創新高，本週台股受到外資調降台積電 (2330) 等半導體個股投資評等影響，指數連日下挫，大立光也因外資及投信賣超，股價連番破底，今天盤中股價更大跌400元，失守至5000元關卡，更創下2017年6月16日以來新低。,0
2017-12-04T10:23:00.000Z,投信也統計，11月以來外資對亞股有買有賣，買超市場以印度逾30億美元為首，越南4.42億美元居次，韓股4.18億美元買超挹注第三，其它亞洲股市則呈現資金淨流出狀態，其中以印尼失血13.76億美元最多，台股失血逾13億美元第二；今年除泰國與印尼之外，其它亞股全數獲得外資青睞，南韓股市吸金逾92億美元最高，印度股市獲逾88億美元買超位居第2，台股獲外資挹注近70億美元排名第三。,4
2017-12-04T10:23:00.000Z,摩根台灣金磚基金經理人葉鴻儒表示，上週台股出現明顯拉回，成交金額跟著放大，顯見在指數站上10800點之上以後，居高思危氣氛再起，使得指數出現回檔，不過，1日盤中走低後，見到跌深承接買盤蹤跡，依目前情況研判，由於國際市場並未出現決定性的變數，上週台股回檔主要來自漲多獲利了結所致。,8
2017-12-04T10:23:00.000Z,葉鴻儒指出，由於台股本波多頭仰賴的重心就在科技股，但近期半導體供應鏈承壓，當電子領頭羊轉弱，對整體盤勢將造成影響，因此，包括權值股龍頭、股王等指標股價是否回穩，是未來必須持續觀察的焦點。,1
2017-12-04T06:32:00.000Z,（中央社記者田裕斌台北2017年12月4日電）美股電子盤大漲超過200點，台股早盤雖一度在短線客出場衝擊下由紅翻黑，但台積電 (2330) 回神站回季線231.67元，加上金融股國泰金 (2882) 助攻，指數終於克服季線。,1
2017-12-04T06:32:00.000Z,分析師表示，台股在1日回測半年線10538點支撐後，今天多頭力圖反攻，除了台積電、金控股表現起帶頭作用外，國際油價回到每桶60美元大關，帶動二線塑化、紡織股吹起進攻號角，台聚 (1304) 、亞聚 (1308) 、台達化 (1309) 、國喬 (1312) 攀高，新纖 (1409) 、集盛 (1455) 、宜進 (1457) 也跟進走揚。,6
2017-12-04T06:32:00.000Z,法人表示，台股今天量縮震盪，雖然大立光依舊演出重挫走勢，但電子權值股已有止穩跡象，加上部分電子次族群包括LED、矽晶圓依然有資金著墨，顯示在外資賣超可望告一段落後，內資可望成為影響台股行情的主要推手。,-4
2017-12-04T03:59:00.000Z,（中央社記者吳家豪台北2017年12月4日電）2家亞系外資出具台股策略研究報告，分別預估台股加權指數2018年底目標為11300點、11200點，除看好科技股表現仍將優於大盤，更預估2018年台股獲利成長將上看10.7%。,5
2017-12-04T03:59:00.000Z,亞系外資表示，台股加權指數11月下跌2.2%，主要受到外資賣超和科技股下挫影響，預估台股目標2017年底10800點、2018年底11300點，並看好在半導體族群成長、iPhone X強勁週期帶動下，明年科技股表現仍將優於大盤。,1
2017-12-04T03:59:00.000Z,另一家亞系外資指出，市場對於2017年台股獲利成長率預估，已從11月初的12%下修到目前的10%；由於今年基期較低，加上iPhone出貨放量時間將從今年下半年延後到明年上半年，可望推升明年台股獲利成長10.7%，預估台股加權指數2018年目標11200點，相較於11月底的10560點，仍有6%上漲空間。,2
2017-12-04T03:17:00.000Z,（中央社記者田裕斌台北2017年12月4日電）美國參議會通過川普稅改方案，美股電子盤大漲超過200點；不過亞股反應相對平淡，日股更是走跌，台股早盤開平高盤後拉回震盪，季線10644點反壓不小。,2
2017-12-04T03:17:00.000Z,截至上午10時30分，加權股價指數上漲1.14點、為10601.51點、成交值新台幣547.25億元，在上週連續2個交易日爆出超過1800億元巨量後，今天激情略有消退，預估成交值降至1200億元以下，分析師表示，台股恐要在季線及半年線10538之間約100點空間進行整理。,2
2017-12-04T03:17:00.000Z,法人表示，台股跌破季線，多空目前在10600點附近僵持，反觀櫃買指數在測試月線148.44點之後隨即量縮站穩，中小型股依舊具有支撐力道，後續需注意新台幣匯率及外資進出狀況，尤其是新台幣匯率在升破30元大關之後出現回檔，加上往年新台幣在12月貶值機率偏高，觀察外資是否順勢匯出。,-3
2017-12-04T03:17:00.000Z,此外，由於外資進入12月之後開始陸續休假，加上台股進入財報空窗期，內資對個股的影響力道增強，具有利基或題材的中小型股近期表現可望較大盤突出，指數在大型權值股多休息下，短線恐難有所表現。,3
2017-12-05T07:15:00.000Z,昨夜美股道指創高，惟那指重挫逾1%，台股電子族群今日成空軍重砲轟擊標靶，包括龍頭指標台積電 (2330) 、鴻海 (2317) 、大立光 (3008) 無一倖免，康控-KY (4943) 更下殺跌停，晶電 (2448) 、亞光 (3019) 、嘉聯益 (6153) 也紛紛跌逾5%，拖累大盤指數一度重挫110餘點，最低來到10540點，所幸國泰金 (2882) 在多數高權值電子股回檔休息之際，帶領金融類股力挽狂瀾，無奈尾盤國泰金仍腿軟翻黑收低，集中市場終場下跌84.26點，收10566.85點，成交值放大至1443.19億元。,-11
2017-12-05T06:49:00.000Z,周一那指重挫，衝擊今日台股電子族群幾乎全軍覆沒，影響大盤指數下跌43.49點，以10607.62點開出，昨日方才收復的季線10645點又宣告失守，回測半年線支撐。,-3
2017-12-05T06:49:00.000Z,  分析師表示，因體短期均線仍維持下彎，加上指標仍持續轉弱，短線台股恐將進行修正，不宜過度躁進。,-2
2017-12-05T06:34:00.000Z,（中央社記者鍾榮峰台北2017年12月5日電）台股午盤後一度大跌逾百點，10600點得而復失，尾盤電金小反彈，跌幅收斂，終場守住半年線。,-2
2017-12-05T06:34:00.000Z,法人表示，在外資買盤未回籠前，預期台股短線持續整理格局。,2
2017-12-05T06:34:00.000Z,台股今開盤跌破10600點大關，雖然金融翻紅反彈，助台股跌幅收斂站回10600點之上，不過午盤後電子走弱，金融翻黑，10600點大關得而復失，最低來到10540點，大跌逾百點，回測半年線約10542點，尾盤電金小反彈，台股守住半年線。,-4
2017-12-05T06:34:00.000Z,台股加權股價指數終場收在10566.85點，下跌84.26點，跌幅0.79%，成交值新台幣1443.2億元，電子股跌1.46%，金融股小跌0.16%。,-3
2017-12-05T06:34:00.000Z,台新2000高科技基金經理人沈建宏表示，外資近期出現連續性賣超，台股季線失守，在外資買盤未回籠前，預期台股短線陷入整理格局。,-1
2017-12-05T03:14:00.000Z,（中央社記者鍾榮峰台北2017年12月5日電）金融反彈，台股跌幅收斂，站回10600點之上，不過仍暫失季線。,-2
2017-12-05T03:14:00.000Z,台股今開盤一度跌破10600點大關，最低來到10568點，回測半年線約10542點，隨後金融由黑翻紅，台股跌幅收斂，站回10600點大關之上，不過仍失守季線約10645點。,-2
2017-12-05T03:14:00.000Z,到10點20分，台股加權指數來到10604.48點，下跌46.63點，跌幅0.44%，成交值來到新台幣611.8億元。,-3
2017-12-05T03:14:00.000Z,國泰證期顧問處協理簡伯儀表示，台股受到美國科技股回檔，電子表現弱勢，大盤回測半年線，不過傳產和金融墊檔，大盤跌幅收斂，預估今天量能在1400億元左右。,-2
