PublishDate,Sentence,Score
2017-12-19T06:34:00.000Z,簡伯儀指出，台股今年前11月漲勢明顯，且無明顯修正，僅12月這一波明顯回檔，往例台股在耶誕節會有較明顯的上揚，今年預估短線上會因結帳行情而逆勢上揚，但中線來看，要視台指期結算後外資的買賣超動向，只要未平倉多單口數不要再明顯下降，同時台股成交量放大下，台股才有機會走穩。,4
2017-12-19T06:28:00.000Z,儘管美股指數持續創下新高，但亞股今反應卻是略顯無感，多於平盤附近狹幅震盪，僅港股獨自走揚，台股開高後震盪壓低，在無龍頭權值股撐盤下，指數翻黑下探，最低一度達10452點，摔下5日均線，終場台股收跌39.18點、報在10467.34點、成交量為1115.3億元。,-3
2017-12-19T06:28:00.000Z,  分析師表示，台股在外資期現貨持續偏空操作，導致近期主力權值股弱勢表現，量能大幅萎縮，此狀況不利台股反彈，也使得今日摔落至5日均線，惟值得留意的是，近期美股走勢亮麗，後續可以留意美稅改發展及川普廢止網路中立性所帶來的影響，有機會帶動台股跟進，選股方面，建議留意產品漲價、缺貨以及年底作帳題材股。,4
2017-12-19T03:29:00.000Z,（中央社記者韋樞台北2017年12月19日電）美國稅改方案進入最後階段，由於通過機率升高，美股那斯達克指數和道瓊指數大漲，台股今天開高走平，盤中電子權值股僅聯發科表現優異，傳產股漲跌互見。,2
2017-12-19T03:29:00.000Z,台股開高走平，一度跌破10500點後狹幅震盪，外資12月出脫甚多的大型電子權值股今天仍難振奮人心，大立光 (3008) 開低走低下跌逾2%，仍力守4000元之上，台積電 (2330) 、鴻海 (2317) 仍在平盤下狹幅整理。,-4
2017-12-19T03:29:00.000Z,統一證券表示，台股連續3天站上10日均線，加上下彎季線本週將扣抵10300點低點，有助季線向上翻揚，屆時將對多方有助漲力道。,4
2017-12-19T03:29:00.000Z,考量台股12月易漲難跌的慣性，搭配基本面良好，內資及集團作帳行情可進一步觀察。,3
2017-12-19T02:55:00.000Z,美國稅改政策可望在聖誕節前送審川普，帶動美股持續創高行情，四大指數收漲，亞洲股市卻是表現淡定，日、韓、陸股普遍持平表現，台股小漲開出，開盤漲1.81點，加權股價指數報在10508.33點，盤中指數甚至一度翻黑，由於外資即將進入聖誕假期，內資資金將成為盤面主導力量，壓抑權值股表現，市場聚焦中小型題材以及年底作帳集團行情個股。,0
2017-12-19T02:55:00.000Z,  外資年底態度縮手，集團作帳行情動起來，內資表現活躍，台股籌碼面呈現內外資不同調，這也使得中小型股較有表現空間，受惠積層陶瓷電容器(MLCC)報價連續4度調漲，華新科 (2492) 大漲約5.5%，國巨 (2327) 、禾伸堂 (3026) 亦同步大漲逾3%，族群展開比價行情；年底作帳行情啟動，華新集團、台塑集團及大同集團都已經展開一波作帳行情，泛宏碁 (2353) 集團股價近期也有輪動轉強跡象，緯創 (3231) 今早股價突破5日及10日線，宏碁 (2353) 則在這波漲到22.15元後，拉回整理，啟碁 (6285) 股價沿5日線向上，挑戰季線反壓；聯電 (2303) 家族中，聯電盤中小漲0.6%，原相 (3227) 受惠Switch明年揮軍大陸市場，今一度大漲3%。,7
2017-12-19T02:55:00.000Z,  分析師表示，目前台股技術面上轉弱，月、季線趨勢反轉向下，宜留意未來若能不再破底，且有價漲量增情況，就有機會轉強發展，現階段外資即將進入聖誕假期，內資資金將成為盤面主導力量，目前國內外多空因素，利多大於利空，加上年底還有集團作帳行情，因此對於後市看法仍然樂觀，加權指數持續反彈可期。,5
2017-12-20T07:12:00.000Z,憂稅改影響貨幣政策和利率前景，周二美股三大指數回落，台股今日在蘋果三巨頭台積電 (2330) 、鴻海 (2317) 、大立光 (3008) 止跌回穩下開高，配合金融股穩盤以及被動元件、印刷電路板等電子次族群續強帶動，使指數震盪走高，一度攻抵10514.31點，終場加權指數上漲37.18點為10504.52點，重返10500點與五日線，成交值縮至1011.12億元，今日外資賣超0.7449億元，投信買超1.5622億元，自營商買超4.4261億元，三大法人買超5.24億元。,0
2017-12-20T07:12:00.000Z,台股今日受惠鴻海與股王大立光回神反彈，引領電子股重返主流，配合具題材的中小型股活蹦亂跳，使盤勢開高走高，終場重返10500點及五日線。,4
2017-12-20T07:12:00.000Z,分析師表示，耶誕節長假逐漸逼近，外資在台股的調節賣壓也漸趨式微，連帶牽引市場殺低意願不高，在內資、大股東等市場大戶作多意願仍濃厚，及政策面不偏空下，台股年底前的作帳行情與2018年農曆年前的年終獎金資金行情仍審慎樂觀。,0
2017-12-20T06:42:00.000Z,周二美股三大指數小跌，台股今早由金融股穩住盤勢，盤中鴻海 (2317) 破底翻，股王大立光 (3008) 翻紅，加上被動元件等電子次族群續強，台股收高37點至10504點，成交值1011億元。,-1
2017-12-20T06:42:00.000Z,台股今早台積電 (2330) 、鴻海 (2317) 、大立光 (3008) 蘋果三巨頭相對前幾天跌勢收斂，惟金融股走揚，加上電子的被動元件、印刷電路板等次族群持續人氣熱絡，台股今早開高走高，早盤即一度攻克5日線及10500點。,2
2017-12-20T06:42:00.000Z,  台股本周先前受到鴻海股價持續探底、蘋果三巨頭疲弱影響。,-1
2017-12-20T06:42:00.000Z,加上前波最強勢的記憶體族群包括旺宏 (2337) 、華邦電 (2344) 、南亞科 (2408) 今早均強勢上揚，電子股仍是台股重心所在。,1
2017-12-20T06:42:00.000Z,  金融股近期成為法人資金避風港，今早在國泰金 (2882) 、富邦金 (2881) 小漲，開發金 (2883) 、新光金 (2888) 等上攻帶領，金融股指數穩健上攻，成為早盤台股撐盤重心。,5
2017-12-20T06:42:00.000Z,電子股指數翻紅收高，帶動台股收上10500點。,2
2017-12-20T06:42:00.000Z,  目前台股因外資偏空，與美股走勢脫勾，台積電尾盤小跌，略壓抑指數上漲空間。,-3
2017-12-20T06:42:00.000Z,台股收盤攻上10500點，但目前仍在季線及半年線之下，今日尾盤台指期結算平穩，台股後續仍待觀察外資動向。,1
2017-12-20T02:57:00.000Z,（中央社記者韓婷婷台北2017年12月20日電）美股出現回檔走勢，不過亞股普遍開低後翻紅，台股也在鴻海 (2317) 率先翻紅下，指數力守在平盤之上，等待尾盤台指期結算後行情走向。,2
2017-12-20T02:57:00.000Z,分析師表示，台股在12月7日落底在10322點之後，指數在10400點至10600點的區間震盪，且近期量能有萎縮跡象，多落在900至1100億元之間，在外資陸續開始放長假後，量能恐難明顯擴張。,0
2017-12-20T00:31:00.000Z,美股3大指數續創歷史新高，台股不僅未能跟進上攻，反遭三大法人逆勢調節，投資專家認為，年底前結帳行情可望暫告一段落，部分權值股已有超跌跡象，投資價值浮現，相關個股可留意台積電 （2330） 、日月光 （2311） 等。,5
2017-12-21T07:14:00.000Z,川普政府主打減稅的稅改案過關後，周三美股出現利多出盡後的修正行情，三大指數微幅收低，但美光財報亮眼帶動費城半導體指數收高，帶動今日台股在台積電 (2330) 回穩下小幅開高，惟指數逼近年線附近隨即壓回，市場交投清淡維持量縮整理，尾盤受到大立光 (3008) 殺低影響，終場加權指數下跌15.55點為10488.97點，10500點及5日線再度失守，成交值萎縮至979.32億元。,-3
2017-12-21T07:14:00.000Z,台股今日由台積電領軍電子股開高趨堅，及中小型股各擁題材助攻，使指數一度向上挑戰月線及半年線，惟市場追價買盤不足，大立光 (3008) 殺跌百元衝擊，使加權股價指數終場翻落10500點及5日線之下。,1
2017-12-21T07:14:00.000Z,分析師表示，外資進入聖誕節長假，使台股量能明顯萎縮，預料短期盤勢多呈現上有壓下有撐的量縮整理格局；短線留意法人作帳或結帳個股，聚焦第1季業績、題材佳族群。,-1
2017-12-21T06:19:00.000Z,（中央社記者張建中台北2017年12月21日電）台積電 (2330) 股價止跌回升，只是股王大立光 (3008) 股價大跌新台幣100元，台股終場收跌15.55點，跌破10500點關卡。,-2
2017-12-21T06:19:00.000Z,分析師王兆立表示，台股短期將延續震盪整理走勢，將以個股表現為主。,0
2017-12-21T03:29:00.000Z,（中央社記者張建中台北2017年12月21日電）美國費城半導體指數收高，漲0.701%，台積電 (2330) 股價止跌回升，支撐台股指數在10500點之上震盪小漲。,2
2017-12-22T07:10:00.000Z,受銀行、能源股走強帶動，周四美股三大指數齊收高！隨著外資進入年終休假，台股今日在內資主導下持續量縮整理，股王大立光 (3008) 回神領軍，指數開高後於平盤附近震盪，午盤過後買單敲進台積電 (2330) 及金融權值股，帶動指數向上拉升，終場加權指數上漲48.3點，收在今日最高點10537.27點，一舉站上10500點及5日線及月線大關，成交值則萎縮至910.11億元；本周上漲45.83點，周線連2紅。,7
2017-12-22T07:10:00.000Z,　蘋果三天王大立光 (3008) 、台積電 (2330) 、鴻海 (2317) 今日同步收高，帶領台股重返月線之上，觸控面板廠TPK-KY (3673) 、GIS-KY (6456) 雙雙走跌較為弱勢；其餘權值股表現方面，台達電 (2308) 、中華電 (2412) 、聯發科 (2454) 同步走揚，宏碁 (2353) 今年來毛利率守穩10%以上、登上近13年來新高，營運轉型站穩腳步，激勵股價爆量鎖漲停，宏達電 (2498) 受到VR一體機市場明年上看150萬台鼓舞，股價聞訊大漲4%。,9
2017-12-22T07:10:00.000Z,台股今日因股王大立光回神領軍，指數得以開高走高，尾盤在台積電翻紅激勵下，指數除收在今日最高點，更連續收復5日線、10500點及月線等關卡。,7
2017-12-22T07:10:00.000Z,分析師表示，從台股技術面觀察，顯示前波底部區10322點短底浮現，目前線型走勢5日線有機會與月線呈現黃金交叉，並向上挑戰季線的中多架構。,3
2017-12-22T07:10:00.000Z,惟短期台股仍受制於外資放假，量能不足影響盤勢上攻不易，不過隨著時序進入年底，作帳行情逐漸啟動及部分法人轉進中小型股，使個股短期領先盤勢發展的波段高檔仍可期。,0
2017-12-22T06:25:00.000Z,法人認為，年底前外資不捧場，台股盤整難免。,0
2017-12-22T06:25:00.000Z,華南投顧董事長儲祥生表示，年底外資沒太多動作，台股呈現價穩量縮格局，量縮尤其明顯。,0
2017-12-22T06:25:00.000Z,美國稅改過關，只帶動美股小幅上漲，台股受惠程度有限，近來一上漲就有賣壓，年底前難免盤整。,3
2017-12-22T06:25:00.000Z,儲祥生認為，除非美股大漲，帶動台股漲勢，否則台股還是等到明年較有表現機會。,6
2017-12-22T06:25:00.000Z,以熱門的蘋果iPhoneX題材而言，因銷售不如預期，影響台股蘋概股表現；特斯拉概念股今年也已漲多，人工智慧概念股也漲了一段，所以年底前這些題材都暫時休息，台股還是盤整機率較高。,2
2017-12-22T06:19:00.000Z,外資年終放假去，台股今日在內資主導下持續量縮整理，在股王大立光 （3008） 回神下開高站回10500點，隨後呈現震盪盤整態勢。,0
2017-12-22T06:19:00.000Z,  台股在外資放假下由內資主導盤勢，呈現量縮盤整、類股輪動態勢。,-1
2017-12-22T06:19:00.000Z,  分析師認為，台股在外資放假、內資掌盤下，下周仍將呈現季線10200點至年線10650點間量縮震盪，屬弱勢反彈格局，需提防法人結帳賣壓。,-4
2017-12-22T02:59:00.000Z,國泰證券認為，由於台股近期盤面資金有移轉到原物料族群，相關個股若量能續增，可偏多操作。,2
2017-12-22T00:22:00.000Z,（中央社記者潘智義台北2017年12月22日電）美股道瓊工業指數上漲55.64點，耶誕假期前外資動作保守，台股在10500點整數關卡前，是否能由企業年底作帳行情帶動漲勢，仍有待觀察。,2
2017-12-22T00:22:00.000Z,台股前一交易日收在10488.97點，下跌15.55點，成交值新台幣979.32億元。,-2
2017-12-22T00:22:00.000Z,台股持續高檔震盪，晶圓代工龍頭台積電 (2330) 、系統組裝服務大廠鴻海 (2317) 、股王大立光 (3008) 3檔蘋概股仍是指標股。,1
2017-12-25T08:52:00.000Z,（中央社記者田裕斌台北2017年12月25日電）外資持續賣超台股，台灣證券交易所統計，外資上週賣超台股新台幣67.49億元，連續第4週賣超。,-1
2017-12-25T08:52:00.000Z,投信表示，過去5年台股12月的月線都收紅，預料最後1週台股易漲難跌。,1
2017-12-25T08:52:00.000Z,周俊宏指出，相對其它股市，台股的本益比偏低，仍具吸引力，具有成長獲利題材如半導體、網通、數據中心、手機新應用技術等電子族群，及電動車、自動駕駛等非電族群皆可觀察留意。,6
2017-12-25T07:12:00.000Z,  分析師認為，台股在外資放假、內資掌盤下，本周將持續在10450點至10550點間量縮震盪。,-1
2017-12-25T07:06:00.000Z,歐美股市在耶誕節前夕收黑，台股受到外資年終放假影響持續量縮整理，今日在電子、金融股同步走弱下，指數開高後隨即翻黑並在平盤附近狹幅震盪，股王 (3008) 一路殺低至4000元衝擊多頭信心，終場加權指數下跌14.78點為10522.49點，守住10500點整數關卡，成交值縮至811.52億元，創10月以來新低。,-4
2017-12-25T07:06:00.000Z,台股今日受制股王大立光開高殺低，牽制短多追價意願，加上鴻海、聯發科 (2454) 、南亞科 (2408) 與統一 (1216) 等權值股演出不振，使指數量縮收跌，惟仍力守在10500點之上。,-4
2017-12-25T07:06:00.000Z,分析師表示，外資放大假在台股操作暫收手，而今年以來內資操作的金融、電子等帳上獲利豐厚，致年底前逢高回吐賣壓也相對沈重，雖政策面未偏空，但市場人氣低迷，係盤勢高不成低不就主因。,-6
2017-12-25T07:06:00.000Z,台股短期無量整理成常態，使市場籌碼相對安定或易於掌控的小型股、轉機股等愈趨抬頭，包括生醫、被動元件及3D感測等相關概念股波段行情可持續追蹤。,1
2017-12-25T06:25:00.000Z,（中央社記者江明晏台北2017年12月25日電）外資過節去，台股今天量縮小跌。,-4
2017-12-25T06:25:00.000Z,台股加權股價指數今天終場下跌14.78點，收在10522.49點，跌幅0.14%，成交值新台幣811.51億元，創下約3個月來的低量。,-2
2017-12-25T06:25:00.000Z,觀察盤中焦點股，電競、新事業創高毛利，宏?? (2353) 大漲逾8%，收24.5元，股價創3年新高，成交量位居台股第一。,4
2017-12-25T06:25:00.000Z,分析師指出，台股近期受內資主控盤勢，預估將呈現量縮震盪整理格局，低價股表現較吸金；後續要關注KD指標是否出現死亡交叉、iPhone X供應商業績動態及外資何時站在買方。,-2
2017-12-25T03:48:00.000Z,隨著耶誕節來臨，外資年終放大假，台股今日依舊量縮下修，開盤加權指數上漲9.37點，來到10546.64點，惟隨後翻黑在平盤下方進行狹幅震盪。,-1
2017-12-25T03:48:00.000Z,  台股在外資買盤縮手、內資追漲意願有限下，近期買盤力道薄弱，持續震盪整理格局。,2
2017-12-25T03:48:00.000Z,  至於後市方面，分析師認為，可觀察台股能否守穩10日線或站回半年線，反彈成交量能否大於20日均量。,0
2017-12-25T03:01:00.000Z,（中央社記者江明晏台北2017年12月25日電）歐美股市在耶誕節前夕收黑，受到外資過節暫歇，台股今天量縮小跌，仍守住10500點整數關卡，盤中電子權值股無力，焦點股則有宏?? (2353) 、PCB族群等。,-6
2017-12-25T03:01:00.000Z,觀察盤中焦點股，宏?痐j漲7.28%，至24.45元，位居台股成交值第一，被動元件、網通、印刷電路板（PCB）族群表現亮眼；其中，達邁 (3645) 大漲近8%，至85.1元，燿華 (2367) 漲5%，至26.15元，台虹 (8039) 大漲約8%，至60.1元。,4
2017-12-25T03:01:00.000Z,日盛投顧表示，近兩週台股持續在10450點至10650點間窄幅震盪，呈現量縮橫盤格局。,-1
2017-12-26T06:40:00.000Z,蘋果砍單陰霾尚未散去，又傳出台商集結地的中國江蘇昆山市為解決水質汙染問題，官方祭出停工令，波及企業包括富士康等270多家，再度重創台股，除了台積電 (2330) 下跌3元壓抑多方氣勢外，鴻海 (2317) 今(26)日盤中再測90.5元日前低點，從11月初以來跌幅將近2成，估計鴻海董事長郭台銘身家蒸發約360億元。,-5
2017-12-26T06:38:00.000Z,受蘋果iPhone X銷售後市看衰、中國昆山傳祭停產令等利空干擾，台股在電子權值股表現疲軟下湧現結帳賣壓，加權指數小幅開高後翻黑走低，11點半後賣壓加重，拖累指數一度重挫114.37點至10408.12點，回測10400點關卡、為8日盤中以來低點。,-10
2017-12-26T06:38:00.000Z,  分析師表示，台股今日受市場利空干擾、氣氛轉趨觀望，導致結帳賣壓加重，表現弱於亞股，拉抬力道不足、殺盤力道擴大，所幸多頭仍力守11日的多方缺口10419～10438點。,-2
2017-12-26T06:38:00.000Z,  分析師認為，在電子股加速回檔下，台股負面因素逐漸消除，對於後市並不悲觀，在外資年初歸隊下，元月指數仍有落後補漲機會，可留意基本面佳的5G概念股，半導體矽晶圓、Intel Purley、塑化及生技等族群。,2
2017-12-26T03:09:00.000Z,外資年終放假去，台股在內資控盤下，近日呈現量縮盤整格局。,-1
2017-12-26T03:09:00.000Z,台股今早小幅開高，加權指數以小漲3.65點的10526.14點開出，惟隨後在蘋概股、權值股及PCB等近日強勢族群轉弱下翻黑走低，盤中一度下跌92.45點至10430.04點。,-3
2017-12-26T03:09:00.000Z,  分析師認為，台股短線窄幅震盪、橫盤格局未變，惟今日受昆山停產等利空消息影響下，出現量增價跌的結帳賣壓，短期跌深股不急於進場搶進，宜進一部觀望多空變化，基本面佳的5G概念股，半導體矽晶圓、Intel Purley、塑化及生技等族群較值得留意。,2
2017-12-27T07:13:00.000Z,台股今日走出自己的路，在塑化、鋼鐵等原物料股受惠國際油價攀揚領軍下，配合被動元件及印刷電路板等電子次族群強攻，使指數震盪走高，一度攻抵10497.77點，逼近10500點大關，午盤過後受到大立光 (3008) 殺盤影響，略為打壓多頭士氣，終場加權指數上漲64.76點為10486.67點，成交值縮為907.37億元。,4
2017-12-27T07:13:00.000Z,台股受惠傳產、金融與部分電子等集團股啟動年終作帳行情，化解雙王台積電及股王大立光表現不振壓力，使盤勢穩步走高，短多似成功取回主導權。,1
2017-12-27T06:27:00.000Z,（中央社記者鍾榮峰台北2017年12月27日電）股王大立光終場下挫4.8%，股價失守4000元大關，台股短期均線得而復失。,-1
2017-12-27T06:27:00.000Z,法人表示，量能稍嫌不足，短線缺少電子族群帶動，大盤不易突破，台股區間整理格局。,-2
2017-12-27T06:27:00.000Z,台股今天走勢堅挺，電子穩盤，金融走揚，大盤最高來到10497點，一度站上5日線約10491點、10日線約10496和月線約10494點。,3
2017-12-27T06:27:00.000Z,不過尾盤電子漲幅收斂，股王大立光下挫4.8%，台股終場5日線、10日線和月線得而復失。,1
2017-12-27T06:27:00.000Z,台股加權股價指數終場收在10486.67點，上漲64.76點，漲幅0.62%，成交值新台幣907.37億元，電子股漲0.12%，金融股漲0.71%。,2
2017-12-27T06:27:00.000Z,兆豐國際投顧表示，台股維持半年線約10554點以下整理，電子持穩未走低，塑化等傳產族群帶動指數走高，不過缺少電子族群帶動，大盤不易突破，短期需觀察明年1月中旬美股財報和台積電財報表現，預期台股短線在10400點到10600點區間整理。,0
2017-12-27T06:27:00.000Z,國泰證期顧問處協理簡伯儀表示，台股今天出現反彈走勢，不過量能稍嫌不足，呈現弱勢整理格局。,-4
2017-12-27T06:27:00.000Z,簡伯儀指出，台股月線約10494點下彎，短線若大盤無法扭轉月線，上有反壓、下有支撐，台股仍是區間整理格局，個股操作，可留意鋼鐵、造紙、塑化等原物料族群。,0
2017-12-27T06:16:00.000Z,美股周二科技股收低，台股今早在台積電 (2330) 等蘋果三巨頭相對前幾天回穩，被動元件及印刷電路板等電子次族群強勁上攻，以及塑化、鋼鐵等原物料股走揚，雖尾盤大立光 (3008) 續挫，但台股仍收漲64點至10486點，成交值907億元。,2
2017-12-27T06:16:00.000Z,  周二台股開平走低，受到中國昆山有可能限排停工的影響，台股周二在內外資及融資同步退場，終場大跌100.58點，跌幅0.96%，收在10421.91點，成交金額972.65億元。,-3
2017-12-27T06:16:00.000Z,  在聖誕假期後，美股周二呈現整理，科技股仍相對偏弱；但今日台股在台積電 (2330) 、大立光 (3008) 、鴻海 (2317) 等蘋果三巨頭早盤回穩，可成 (2474) 、台郡 (6269) 等蘋概股止跌，以及強勢的被動元件國巨 (2327) 領軍，禾伸堂 (3026) 、奇力新 (2456) 、大毅 (2478) 等續漲；印刷電路板由華通 (2313) 強攻表態；由於國際油價強勢上漲，台塑 (1301) 走穩上揚，塑化股包括國喬 (1312) 、中石化 (1314) 、台苯 (1310) 均帶量衝高；以及鋼價穩健上揚，中鋼 (2002) 走穩，中鴻 (2014) 隨著元月報價調漲強攻，東和鋼鐵 (2006) 在法人拉抬下續攻。,7
2017-12-27T06:16:00.000Z,  台股在周二守住10400點支撐，今早盤開高後走穩向上，雖台積電收跌1元，大立光 (3008) 幾乎收最低；使得台股未能收上5日線及月線約在10493點，但距離已明顯拉近。,0
2017-12-27T06:16:00.000Z,目前在外資尚未完全歸隊下，台股大型權值股欠缺動能，由強勢的電子次族群持續匯聚人氣，加上傳產、原物料及金融股撐盤，台股短期守住周二低點後，有機會持續反彈。,2
2017-12-27T03:32:00.000Z,（中央社記者鍾榮峰台北2017年12月27日電）台股電金穩健，大盤走勢堅挺，不過量能相對萎縮。,-1
2017-12-27T03:32:00.000Z,擺脫26日下挫百點陰霾，台股今開高走堅，電子金融穩健，被動元件族群表現活潑，大盤最高來到10478點，逼近5日線約10487點和10日線約10494點。,1
2017-12-27T03:32:00.000Z,到10點35分，台股加權指數來到10467.91點，上漲46點，漲幅0.44%，成交值來到新台幣414.79億元。,2
2017-12-27T03:32:00.000Z,分析師表示，台股近期幾個交易日成交量在千億元以下，年末市場觀望氣氛浮現，交易相對清淡，台股相對缺乏引導主力，不過下方有萬點關卡支撐，短線仍看區間震盪整理。,2
2017-12-27T02:21:00.000Z,受iPhone X需求恐疲弱衝擊，美國蘋果股價下挫；但台股在台積電 (2330) 等蘋果三巨頭今早相對前幾天回穩，被動元件及印刷電路板等電子次族群仍強勁上攻，以及塑化、鋼鐵等原物料股走揚，台股開高走高，多持穩在10450點以上。,1
2017-12-27T02:21:00.000Z,  周二台股開平，但在盤面欠缺主軸，又有中國昆山有可能限排停工的影響，台股周二在內外資及融資同步退場，終場大跌100.58點，跌幅0.96%，收在10421.91點，成交金額972.65億元。,-3
2017-12-27T02:21:00.000Z,  在聖誕假期後，美股呈現整理，科技股仍相對偏弱，美股周二收低；但台股在台積電 (2330) 、大立光 (3008) 、鴻海 (2317) 等蘋果三巨頭早盤回穩，可成 (2474) 、台郡 (6269) 等蘋概股止跌，以及強勢的被動元件國巨 (2327) 領軍，禾伸堂 (3026) 、華新科 (2492) 續漲；印刷電路板由華通 (2313) 強攻表態；由於國際油價強勢上漲，台塑 (1301) 走穩上揚，塑化包括國喬 (1312) 、中石化 (1314) 、台苯 (1310) 均帶量衝高；以及鋼價穩健上揚，中鋼 (2002) 走穩，東和鋼鐵 (2006) 在法人拉抬下續攻。,6
2017-12-27T02:21:00.000Z,  台股在周二守住10400點支撐，今早盤反彈約40~50點，因台積電盤中小跌0.5元，使得台股未能再上攻5日線及月線。,0
2017-12-27T02:21:00.000Z,目前在外資尚未完全歸隊下，台股大型權值股欠缺動能，由強勢的電子次族群持續匯聚人氣。,1
2017-12-27T02:21:00.000Z,由於台股在季線及半年線之下，技術面仍弱勢。,-1
2017-12-28T07:05:00.000Z,蘋果股價回穩帶動周三美股四大指數收高，台股今日也在蘋概股三雄台積電 (2330) 、大立光 (3008) 及鴻海 (2317) 攜手領軍下，推升指數開高走高，盤中一度衝高逾百點，最高來到10592.04點，一吐近期悶氣，為明天封關行情進行暖身，終場加權指數上漲80.97點為10567.64點，一舉收復10500點、5日線、月線及半年線關卡，成交值放大至1044.21億元。,8
