PublishDate,Sentence,Score
2018-08-15T10:59:00.000Z,台積電資深處長莊子壽指出，台積電3奈米總投資預估至少新台幣6000億元，若環評順利通過，預估2020年開始建廠，2021年機器進場安裝，希望2022年底至2023年初開始量產。,7
2018-08-15T02:08:00.000Z,"日本市場研調機構富士總研(Fuji Chimera Research Institute,Inc.)4月23日公布調查報告指出，支援5G的智慧手機預估最快會在2019年上半年問世，不過屆時推出的產品為支援Sub 6頻段的機種，預估支援毫米波頻段的產品最快要等到2019年下半至2020年期間才會問世，且從BOM成本等觀點來看，預估截至2022年為止僅有高階/旗艦等級機種會支援5G，預估2022年5G智慧手機全球市場規模將為3.1億支、佔整體智慧手機市場比重約2成(19.5%)。",4
2018-08-15T02:08:00.000Z,"Seedplanning指出，隨著5G標準化，預估各國將自2019年起開始提供5G服務(中南美預估2021年開始)，在北美、中國、南韓、日本帶動下，預估2020年全球5G行動服務用戶數將為7,500萬件，2021年將年增約3倍至3億件以上、2022年進一步年增約1.3倍至7億件，2025年有望逼近22億件、達21億8,700萬件。",4
2018-08-16T00:29:00.000Z,環保署15日初審通過「台南科學園區二期基地開發暨原一期基地變更計畫環差案」；該案即為台積電(2330)3奈米的南科投資案初審過關，這也意味著，台積電3奈米建廠案，可望在今年11月以前獲得環評大會通過，台積電則計畫，2020年動工，最快2022年底量產。,6
2018-08-16T00:29:00.000Z,台積電3奈米廠總投資額尚未定案，初估將超過6000億元，並在2020年動工，預計在2022年底到2023年初可以進入量產，該廠區僱用員工可以達到4000人。,0
2018-08-15T23:48:00.000Z,"半導體龍頭大廠台積電 (2330) 投資逾6,000億元的3奈米廠確定落腳南科台南園區，環保署環評專案小組昨（15）日審查南科管理局提出的環差案，台積電掛水電雙保證，承諾未來20％使用綠電、每日使用再生水7.3萬噸，環評小組因此一次過關，這是近年來重大開發案中少見現象，估最快2022年底或2023年初量產。",9
2018-08-15T23:48:00.000Z,"　台積電資深廠務處長莊子壽表示，台積電3奈米總投資預估至少6,000億元，如果環評案可以順利通過，預計2020年可以建廠，2021年開始安裝，預估18個月的認證，希望2022年底、2023年初開始量產。",6
