PublishDate,Sentence,Score
2018-01-05T04:46:00.000Z,  法人表示，去年在京東方、華星光電、力晶合肥下單量持續提升，世禾合肥廠去年第4季開始營運逐漸好轉，今年接單金額則有機會再提升，達成全年賺錢。,6
2018-01-05T04:46:00.000Z,替代的東莞廠預計今年第一季完工，使用面積近3千坪，較深圳廠大1倍以上，除承接深圳廠既有客戶之外，包括華星光電新廠、中芯深圳8吋廠以及台系大型面板廠皆為未來潛在動能。,1
2018-01-05T04:46:00.000Z,台灣主要客戶為台積電 (2330) 與群創 (3481) ，中國主要客戶為華星光電、京東方等。,0
2018-01-17T02:12:00.000Z,  資訊設備系統產品主要客戶包括台積電 （2330） 、台塑 （1301） 、關貿 （6183） ；面板設備產品客戶包括友達 （2409） 、群創 （3481） 、彩虹電子、華星光電、合肥鑫晟、南京熊貓、京東方等；機器人客戶包括東風裕隆、北方賓士；自動化設備客戶包括華亞科 （3474） 、頂新集團、廣達 （2382） 等。,1
2018-01-30T02:36:00.000Z,東莞廠也將切入新面板客戶供應鏈，包括華星光電新廠以及台系大型面板廠於廣州的10.5代線皆為未來潛在動能。,1
2018-01-30T02:36:00.000Z,台灣主要客戶為台積電 (2330) 與群創 (3481) ，中國主要客戶為華星光電、京東方等。,0
