PublishDate,Sentence,Score
2017-10-13T06:50:00.000Z,中鋼 (2002) 第四季內銷盤價開高加上傳統旺季效益，鋼廠獲利仍可期，鋼鐵個股漲多跌少，彰源 (2030) 、新光鋼 (2031) 漲幅逼近3%，官田鋼 (2017) 、燁輝 (2023) 亦有2%好成績。,1
2017-10-17T06:35:00.000Z,台股已連漲10個交易日，今日在市場觀望明日大陸十九大及台指期將結算等紛擾下，大盤開平高盤後急轉翻黑，午盤台積電 (2330) 跌幅擴大，影響華邦電 (2344) 、宏達電 (2498) 等權值大軍疲態顯露，尾盤鋼鐵與玉晶光 (3406) 等二線光學鏡頭族群急跌，大盤賣壓隨之增強，加權股價指數終場下跌51.06點，收10723.15點，拉出一根黑K棒，把昨日漲幅吞噬，成交值為1188.53億元。,-3
2017-10-26T06:56:00.000Z,傳產股漲跌互見，鋼鐵骨隨著鋼價下半年回穩，個股近期逐漸擺脫頹勢，中鴻 (2014) 、新光鋼 (2031) 雙雙走揚。,1
2017-10-26T06:20:00.000Z,傳統產業股漲跌互見，玻璃類股指數收漲0.22%，鋼鐵類股指數小漲0.01%，運輸與觀光類股表現相對弱勢，類股指數分別收跌0.53%及0.5%。,-2
2017-10-30T06:59:00.000Z,傳產股跌多漲少，鋼鐵股志聯 (2024) 第四季可望受惠中鋼 (2002) 漲價效應，今年營運相較去年穩定，股價噴出大漲近4%相對耀眼。,2
2017-10-31T06:31:00.000Z,美股回檔，台股受惠近期外資仍偏多操作，加上早盤台積電 (2330) 、鴻海 (2317) 、大立光 (3008) 等蘋概三巨頭挾蘋果股價再創波段新高題材走堅，大盤指數開高小漲12.03點、以10768.9點開出，盤中台積電、大立光一度輪番遭空頭拉下，讓多頭難伸拳腳，惟盤中旺宏 (2337) 等中小型股積極向上，加上鎧勝-KY (5264) 與玉晶光 (3406) 等蘋概落後補漲股展開追價，推升大盤指數一度上攻10829.33點，惟尾盤大立光急殺翻黑，加上金融、鋼鐵、航運、食品等主要傳產類股亦遭空頭俘虜，大盤漲點遂縮減至36.93點，以10793.80點作收，10800城池仍無法順利拿下。,5
2017-10-31T06:31:00.000Z,美股回檔，台股受惠近期外資仍偏多操作，加上早盤台積電 (2330) 、鴻海 (2317) 、大立光 (3008) 等蘋概三巨頭挾蘋果股價再創波段新高題材走堅，大盤指數開高小漲12.03點、以10768.9點開出，盤中台積電、大立光一度輪番遭空頭拉下，讓多頭難伸拳腳，惟盤中旺宏 (2337) 等中小型股積極向上，加上鎧勝-KY (5264) 與玉晶光 (3406) 等蘋概落後補漲股展開追價，推升大盤指數一度上攻10829.33點，惟尾盤大立光急殺翻黑，加上金融、鋼鐵、航運、食品等主要傳產類股亦遭空頭俘虜，大盤漲點遂縮減至36.93點，以10793.80點作收，10800城池仍無法順利拿下。,5
