PublishDate,Sentence,Score
2017-06-13T00:57:00.000Z,日期：2017年 6月13日※本日焦點股康控-KY、新日興、茂達、創意、鎧勝-KY、智寶、豪勉、東聯、新光鋼、大億科、捷波、豪展、日揚、博智、中橡、宏益、彰源※昨日盤勢解析英國大選結果各黨均未過半，英國首相梅伊宣布將組成聯合政府、留任首相；週五西歐三大指數上漲。,3
2017-06-13T00:57:00.000Z,※強勢股：1.生技醫療個股表現，達爾膚 (6523) 、中美冠科-KY (6554) 、聯合 (4129) 、生展 (8279) 上漲。,3
2017-06-19T08:02:00.000Z,　第12屆國際構裝暨電路板研討會今年主要由IEEE CPMT-Taipei、iMAPS-Taiwan、ITRI及TPCA聯合舉辦，今年度，開幕演講邀請到來自筆記型電腦大廠HP的Vice President Shreekant(Ticky) Thakkar帶來下世代與我們日常生活中息息相關的「背景運算」，及其在智慧裝置、數據科技及數位電子中所扮演的關鍵角色，並細說未來產業面臨的挑戰與機會；另有來自德國Fraunhofer IZM的 Dr. Rolf Aschenbrenner，也將於開幕演講中分享「Panel Fan-out Technologies and New Solutions for Autonomous Systems」。,3
2017-06-23T03:17:00.000Z,以太坊已有許多實際應用，聯合國世界糧食計劃署(World Food Program)利用以太坊技術，紀錄協助一萬名敘利亞難民。,1
2017-06-27T01:03:00.000Z,日期：2017年 6月27日※本日焦點股帛漢、聯合、鈺齊-KY、力成、矽格、宏益、晶焱、博智、力麒、智寶、威剛、燁輝、濱川、新光鋼、申豐、亞泰、仲琦、新產※昨日盤勢解析IHS  Markit 公佈歐盟的綜合採購經理人指數(PMI)自 56.8 下跌至 55.7，而市場仍擔憂油價步入熊市，週五西歐三大指數下跌。,-3
