PublishDate,Sentence,Score
2017-10-06T03:03:00.000Z,法人表示，外資在台股仍未退潮、國際資金也未出現避險恐慌，台股萬點支撐力強。,-1
2017-10-06T03:03:00.000Z,台新2000高科技基金經理人沈建宏表示，外資在台股仍未退潮、國際資金也未出現避險恐慌，預期企業今年獲利成長不俗、iPhone X遞延買氣值得期待，台股萬點支撐力強。,4
2017-10-11T06:28:00.000Z,國泰證期指出，美股創新高除了川普稅改等因素，美國經濟數據優於預期，也有利於支撐美元、美股走高；考量美元回流並非避險需求，台股與新興股市或有衝擊，但美股不墜將有利於台股獲支撐。,7
2017-10-16T06:13:00.000Z,此外，外資的歸隊也是台股漲勢持續的原因，外資在現貨市場連買5個交易日，台指期淨多單部位也逼近6萬口的近期高檔，選擇權雖賣權領先買權，但避險意味愈趨濃厚，對多頭的威脅性日益減輕。,3
2017-10-16T04:39:00.000Z,Coinbease執行長Brian Armstrong在推特發文稱，眾人對新功能的最大反應之一是，為什麼這麼晚才推出！避險基金BKCM創辦人Brian Kelly也說，Coinbase的即時購買功能，可望讓比特幣進一步跨入主流，比特幣將更方便交易，流動性也會增加，交易量提高有利價格。,6
2017-10-16T03:43:00.000Z,　台新主流基金經理人施昶成表示，目前外資在台股持續尋找投資機會、國際資金亦未出現避險恐慌，加上企業今年獲利成長不俗、iPhone X遞延買氣值得期待，預期台股萬點支撐力強，明年第一季台股有機會再創高峰，10月若遇指數拉回即是買點，建議優先布局2018年具業績成長契機之作夢題材股。,7
