PublishDate,Sentence,Score
2017-12-04T03:59:00.000Z,亞系外資也列出12月1日起股價漲幅有望超過15%的9檔推薦買進個股，包括台塑 (1301) 、中鋼 (2002) 、台達電 (2308) 、鴻海 (2317) 、美律 (2439) 、聯發科 (2454) 、玉山金 (2884) 、鎧勝-KY (5264) 、億豐 (8464) 。,4
2017-12-04T03:59:00.000Z,亞系外資也列出12月1日起股價漲幅有望超過15%的9檔推薦買進個股，包括台塑 (1301) 、中鋼 (2002) 、台達電 (2308) 、鴻海 (2317) 、美律 (2439) 、聯發科 (2454) 、玉山金 (2884) 、鎧勝-KY (5264) 、億豐 (8464) 。,4
2017-12-19T07:08:00.000Z,年底作帳集團股相對有撐，台塑集團台塑 (1301) 、南亞 (1303) 、台化 (1326) 、台塑化 (6505) 全面收紅；泛華碩集團華碩 (2357) 、和碩 (4938) 、鎧勝-KY (5264) 、祥碩 (5269) 逆勢走高；聯電家族聯電 (2303) 、原相 (3227) 、聯傑 (3094) 、智原 (3035) 、聯陽 (3014) 等紅光滿面。,4
2017-12-19T06:28:00.000Z,  時序適逢年底，集團作帳股行情發燙，今日泛華碩 (2357) 集團有華碩、和碩 (4938) 、鎧勝-KY (5264) 及祥碩 (5269) 等表現優於大盤，另外，泛宏碁 (2353) 集團的緯創 (3231) 也相對有撐；聯電 (2303) 家族中，除聯電相對抗跌外，原相 (3227) 漲幅也逾1%，還有聯傑 (3094) 、智原 (3035) 、聯陽 (3014) 等股價有不錯表現。,2
2017-12-19T02:55:00.000Z,  中小型題材股方面，內資持續扮演市場主力，軟性銅箔基板(FCCL)廠律勝 (3354) 今結束分盤交易的處置，開盤後股價直奔漲停價34.4元；車用概念聯傑 (3094) 因打進歐洲一線車廠供應鏈，飆漲逾7%、登波段新高價；鎧勝-KY (5264) 則因搶蘋果訂單，擬現增73億元，激勵股價衝高逾5%。,5
