PublishDate,Sentence,Score
2018-05-22T07:24:00.000Z,美中貿易停火激勵周一美股強彈，台股今日在台積電 (2330) 領軍下開高，配合蘋概股康控-KY (4943) 、玉晶光 (3406) 攜手大漲，以及被動元件族群日電貿 (3090) 、華新科 (2492) 、奇力新 (2456) 聯袂衝高，推升台股一度奔抵11034.12點，惟11000點大關反壓不輕，使極短線獲利回吐與前波高檔解套賣壓大舉出籠，使指數拉回至平盤附近震盪，尾盤受到台積電漲幅回吐，權值股鴻海 (2317) 、大立光 (3008) 、台塑 (1301) 同步收低，金融股亦無力撐盤，終場加權指數下跌27.47點為10938.73點，11000點大關得而復失，成交值為1339.54億元。,6
2018-05-22T06:43:00.000Z,美股昨夜大漲，激勵台股一度衝上11034.12點，惟調節反壓牽制漲勢，終場仍翻黑收低10938.73點，衝關11000得再加把勁。,2
2018-05-22T06:43:00.000Z,台股早盤在台積電 (2330) 、聯電 (2330) 聯袂上漲，鴻海 (2317) 、大立光 (3008) 亦分別開出高盤與平盤，加上華新科 (2492) 等被動元件個股氣勢如虹的帶動下，大盤指數一度衝上11034.12點，惟台指期旋即翻黑走弱，鴻海、大立光也跟著中箭落馬，電金多頭熄火，盤面上僅由被動元件族群及部分中小型股撐場，終場大盤下跌27.47點、收10938.73點，11000大關仍無法攻克，總成交值則增至1339.54億元；店頭市場下跌0.49點，收152.63點，總成交值411.05億元。,1
2018-05-22T03:14:00.000Z,美股大漲，台股今日開盤10986.77點，漲20.57點，由於外資昨日期現貨轉佈多單，今日多頭量能回流，晨盤電子股資金比重回升至逾7成，大型權值股台積電 (2330) 持穩在平盤上方，康控-KY (4943) 、元太 (8069) 等跌深反彈，台股一度衝上11034.12點，但11000點反壓大，加上期貨翻黑表現弱勢，台股漲幅開始收斂，衝高開始出現壓力。,2
2018-05-25T07:21:00.000Z,塑化股因國際油價重挫一片綠油油，台塑四寶表現低迷，二線族群台達化 (1309) 、台苯 (1310) 、國喬 (1312) 同步拉回修正；水泥股在台泥 (1101) 、亞泥 (1102) 、嘉泥 (1103) 同步軟腳下成盤面弱勢族群。,-2
2018-05-28T03:10:00.000Z,日盛投顧分析，5月22日帶量長黑高點11034點尚未突破，且11000點附近為中線套牢區，預料靠近11000點附近震盪將會較大，但低檔月線上揚角度增加，中線多方結構逐漸強化，走勢偏多。,2
